,Endereco,LATITUDE,LONGITUDE
0,"rua davi xavier da silva, CIDADE INDUSTRIAL, Curitiba",-25.5061668,-49.32477739999999
1,"rua  carlos klemtz, FAZENDINHA, Curitiba",-25.4763452,-49.32130249999999
2,"rua doutor joão de paula moura brito, UBERABA, Curitiba",-25.4813613,-49.2288666
3,"rua edgard cavalcanti de albuquerque, SÍTIO CERCADO, Curitiba",-25.5403967,-49.255643
4,"rua  carlos munhoz da rocha, TATUQUARA, Curitiba",-25.565375,-49.3375249
5,"rua hussein ibrahim omairy, SÍTIO CERCADO, Curitiba",-25.5536787,-49.259569
6,"rua  nova de colombo, SANTA CÂNDIDA, Curitiba",-25.3687164,-49.2202332
7,"rua  carlos essenfelder, BOQUEIRÃO, Curitiba",-25.4993345,-49.2303143
8,"rua presidente faria, CENTRO, Curitiba",-25.4273866,-49.2685354
9,"rua santa edwiges, BOA VISTA, Curitiba",-25.3564835,-49.2738858
10,"rua  oswaldo maciel, TABOÃO, Curitiba",-25.3783556,-49.2813412
11,"rua tobias de macedo, CENTRO, Curitiba",-25.4272583,-49.3292898
12,"rua tiradentes, CENTRO, Curitiba",-25.4297003,-49.2714254
13,"rua maria homan wisniewski, CIDADE INDUSTRIAL, Curitiba",-25.4547996,-49.3506827
14,"rua 1 de maio, XAXIM, Curitiba",-25.5138195,-49.2783394
15,"rua  olindo caetani, UBERABA, Curitiba",-25.4879663,-49.2015464
16,"rua  fredolin wolf, PILARZINHO, Curitiba",-25.3847796,-49.3090743
17,"rua rockefeller, REBOUÇAS, Curitiba",-25.444576,-49.2624885
18,"rua  água verde, ÁGUA VERDE, Curitiba",-25.4530706,-49.2779229
19,"rua  josé tissi, CIDADE INDUSTRIAL, Curitiba",-25.4359992,-49.35024540000001
20,"rua  marechal floriano peixoto, BOQUEIRÃO, Curitiba",-25.5057767,-49.2353257
21,"rua silva jardim, BATEL, Curitiba",-25.4461985,-49.2848727
22,"rua daniel petersen, FAZENDINHA, Curitiba",-25.485284,-49.33971469999999
23,"rua  brasilia, NOVO MUNDO, Curitiba",-25.494606,-49.2838158
24,"rua setembrino portella neto, CIDADE INDUSTRIAL, Curitiba",-25.4981906,-49.3446177
25,"rua expedicionário estanislau wojcik, ALTO BOQUEIRÃO, Curitiba",-25.5358716,-49.2433378
26,"rua jose rodrigues pinheiro, CIDADE INDUSTRIAL, Curitiba",-25.5146831,-49.3138984
27,"rua pinheirinho, CAPÃO RASO, Curitiba",-25.51383,-49.2955154
28,"rua  theophilo mansur, NOVO MUNDO, Curitiba",-25.4926263,-49.3083997
29,"rua estanislau kucek, CIDADE INDUSTRIAL, Curitiba",-25.5019449,-49.3371703
30,"rua plínio tourinho, JARDIM BOTÂNICO, Curitiba",-25.4405407,-49.25487469999999
31,"rua rosa carvalho chaves, NOVO MUNDO, Curitiba",-25.488419,-49.2781019
32,"rua doutor alfredo vieira barcelos, UBERABA, Curitiba",-25.4707132,-49.230385
33,"rua  república argentina, PORTÃO, Curitiba",-25.4728714,-49.2943385
34,"rua  rui barbosa, CENTRO, Curitiba",-25.436289,-49.2738464
35,"rua canal belém, ORLEANS, Curitiba",-25.4854914,-49.2346413
36,"rua silva jardim, REBOUÇAS, Curitiba",-25.4451616,-49.28210809999999
37,"rua gago coutinho, BOA VISTA, Curitiba",-25.3989273,-49.2417919
38,"rua padre tiago alberione, SANTA FELICIDADE, Curitiba",-25.403536,-49.3157296
39,"rua general adalberto massa, SÍTIO CERCADO, Curitiba",-25.5516959,-49.2461879
40,"rua tobias de macedo, CASCATINHA, Curitiba",-25.4272583,-49.3292898
41,"rua alfredo bufren, CENTRO, Curitiba",-25.4286136,-49.2674689
42,"rua presidente affonso camargo, CAPÃO DA IMBUIA, Curitiba",-25.4416829,-49.2175273
43,"rua lodovico geronazzo, BARREIRINHA, Curitiba",-25.3816011,-49.2525886
44,"rua  léa moreira de souza moura, CIDADE INDUSTRIAL, Curitiba",-25.5111147,-49.32572
45,"rua  paraná, SANTA CÂNDIDA, Curitiba",-25.3798738,-49.2281309
46,"rua  lodovico kaminski, CIDADE INDUSTRIAL, Curitiba",-25.4755627,-49.3590222
47,"rua nossa senhora de nazare, BOA VISTA, Curitiba",-25.3898883,-49.2449844
48,"rua nestor de castro, JARDIM BOTÂNICO, Curitiba",-25.4283558,-49.2727099
49,"rua são francisco, CENTRO, Curitiba",-25.4280348,-49.2704056
50,"rua joão budel, SANTA FELICIDADE, Curitiba",-25.389011,-49.3572141
51,"rua beato pedro donders, CIDADE INDUSTRIAL, Curitiba",-25.5304798,-49.3380445
52,"rua carlos munhoz da rocha, TATUQUARA, Curitiba",-25.565375,-49.3375249
53,"rua jorge wendler, XAXIM, Curitiba",-25.5080412,-49.2588082
54,"rua andre prado, CIDADE INDUSTRIAL, Curitiba",-25.5325556,-49.3366785
55,"rua ricardo emílio michel, CIDADE INDUSTRIAL, Curitiba",-25.4922776,-49.3409157
56,"rua henrique josé sikorski, SEMINÁRIO, Curitiba",-25.4485115,-49.3131299
57,"rua angelina ansai, FAZENDINHA, Curitiba",-25.4797031,-49.3216957
58,"rua nova aurora, SÍTIO CERCADO, Curitiba",-25.5443524,-49.2640623
59,"rua amadeu piotto, CAMPO COMPRIDO, Curitiba",-25.4344515,-49.3569265
60,"rua município de campo novo, CIDADE INDUSTRIAL, Curitiba",-25.4722755,-49.3492142
61,"rua joão nicoletti daros, XAXIM, Curitiba",-25.5058855,-49.2774492
62,"rua adir josé frason, CAMPO COMPRIDO, Curitiba",-25.4353363,-49.3630672
63,"rua raul pompeia, CIDADE INDUSTRIAL, Curitiba",-25.4806276,-49.3429399
64,"rua joão casagrande, CIDADE INDUSTRIAL, Curitiba",-25.4615343,-49.3486312
65,"rua desembargador cid campelo, CIDADE INDUSTRIAL, Curitiba",-25.49842,-49.337959
66,"rua pedro sebastião medeiros, ALTO BOQUEIRÃO, Curitiba",-25.52734,-49.24335319999999
67,"rua luis casa grande, CIDADE INDUSTRIAL, Curitiba",-25.463106,-49.3492714
68,"rua haydée pereira do nascimento, NOVO MUNDO, Curitiba",-25.4851566,-49.3071379
69,"rua iris antonio campos, CAMPO COMPRIDO, Curitiba",-25.46567,-49.3223958
70,"rua república argentina, PORTÃO, Curitiba",-25.4728714,-49.2943385
71,"rua marquês de barbacena, CIDADE INDUSTRIAL, Curitiba",-25.4810339,-49.3480224
72,"rua professor theodócio jorge atherino, BOQUEIRÃO, Curitiba",-25.4775147,-49.3413756
73,"rua doutor bley zornig, BOQUEIRÃO, Curitiba",-25.5131678,-49.22919539999999
74,"rua laranjeiras do sul, ALTO BOQUEIRÃO, Curitiba",-25.52721,-49.234025
75,"rua alvares de azevedo, CIDADE INDUSTRIAL, Curitiba",-25.4817657,-49.348043
76,"rua josé batista dos santos, CIDADE INDUSTRIAL, Curitiba",-25.4799406,-49.3439543
77,"rua das torres, TATUQUARA, Curitiba",-25.5647384,-49.3282697
78,"rua laranjeiras do sul, BOQUEIRÃO, Curitiba",-25.52721,-49.234025
79,"rua manoel ribas, CASCATINHA, Curitiba",-25.4137614,-49.3117505
80,"rua comendador araújo, CENTRO, Curitiba",-25.4370356,-49.2803024
81,"rua antonio vieira borges, REBOUÇAS, Curitiba",-25.4429538,-49.25237260000001
82,"rua reinaldo strobel, CIDADE INDUSTRIAL, Curitiba",-25.48512,-49.3545069
83,"rua pastor manoel virgínio de souza, CAPÃO DA IMBUIA, Curitiba",-25.4363383,-49.2106874
84,"rua guabirotuba, PRADO VELHO, Curitiba",-25.4479094,-49.2527137
85,"rua rogerio pereira de camargo, CAMPO COMPRIDO, Curitiba",-25.4441213,-49.3552498
86,"rua engenheiro alberto monteiro de carvalho, CAPÃO DA IMBUIA, Curitiba",-25.4359762,-49.2114722
87,"rua brigadeiro arthur carlos peralta, BOA VISTA, Curitiba",-25.3859715,-49.2489825
88,"rua marechal floriano peixoto, REBOUÇAS, Curitiba",-25.4454801,-49.2648526
89,"rua pinheiro machado, FAZENDINHA, Curitiba",-25.4864749,-49.3311915
90,"rua elias casseb, TATUQUARA, Curitiba",-25.5616529,-49.33264459999999
91,"rua elias casseb, PINHEIRINHO, Curitiba",-25.5616529,-49.33264459999999
92,"rua hiato shimori, BOQUEIRÃO, Curitiba",-25.5030083,-49.2367172
93,"rua arthur martins franco, PORTÃO, Curitiba",-25.4962233,-49.33521289999999
94,"rua joão batista dos santos, CIDADE INDUSTRIAL, Curitiba",-25.4936221,-49.3504437
95,"rua garuva, CIDADE INDUSTRIAL, Curitiba",-25.4770185,-49.3411638
96,"rua coronel pedro scherer sobrinho, CAPÃO DA IMBUIA, Curitiba",-25.4359731,-49.2399987
97,"rua assis brasil, BARREIRINHA, Curitiba",-25.3692062,-49.2645258
98,"rua são bento, JARDIM BOTÂNICO, Curitiba",-25.479431,-49.25371860000001
99,"rua mário bueno sobrinho, UBERABA, Curitiba",-25.4719985,-49.2254695
100,"rua vicente machado, CENTRO, Curitiba",-25.4350783,-49.28153
101,"rua aristides tissot, CIDADE INDUSTRIAL, Curitiba",-25.4762364,-49.33486809999999
102,"rua herculano de araujo filho, CIDADE INDUSTRIAL, Curitiba",-25.5280708,-49.3368429
103,"rua silvio da maia moreira, UBERABA, Curitiba",-25.4924379,-49.2257668
104,"rua alton tchekow, PINHEIRINHO, Curitiba",38.8906038,-90.1842764
105,"rua curitiba ponta grossa br-277, ORLEANS, Curitiba",-25.103103,-50.1537446
106,"rua quadra 10, TATUQUARA, Curitiba",-25.5647384,-49.3282697
107,"rua leocádio moskaleviski lacerda, SÍTIO CERCADO, Curitiba",-25.5504565,-49.2455028
108,"rua tenente coronel benjamin lage, UBERABA, Curitiba",-25.4985509,-49.2185304
109,"rua doutor bley zornig, BUTIATUVINHA, Curitiba",-25.5129372,-49.2286043
110,"rua cabral, SANTA CÂNDIDA, Curitiba",-25.4068314,-49.2514714
111,"rua nicolau salomão, BOA VISTA, Curitiba",-25.3845345,-49.2247488
112,"rua augusto basso, PILARZINHO, Curitiba",-25.3919796,-49.2849784
113,"rua deputado heitor alencar furtado, CAMPINA DO SIQUEIRA, Curitiba",-25.4378592,-49.3134264
114,"rua juarez távora, PINHEIRINHO, Curitiba",-25.5573018,-49.3327921
115,"rua joão mequetti, SANTA CÂNDIDA, Curitiba",-25.376755,-49.2378355
116,"rua ciro de castro, CIDADE INDUSTRIAL, Curitiba",-25.4711942,-49.34089609999999
117,"rua professor romão wachowicz, CIDADE INDUSTRIAL, Curitiba",-25.5097795,-49.3365689
118,"rua antonio reinaldo zanon, CIDADE INDUSTRIAL, Curitiba",-25.4780424,-49.3362823
119,"rua carlota straube de araújo, BOA VISTA, Curitiba",-25.3876684,-49.2505453
120,"rua  ladislau mikosz, CAJURU, Curitiba",-25.4683792,-49.19831929999999
121,"rua jorge adir nepomoceno, CAMPO COMPRIDO, Curitiba",-25.4377014,-49.3631514
122,"rua da ordem, PINHEIRINHO, Curitiba",-25.5378833,-49.2994965
123,"rua  winston churchill, CAPÃO RASO, Curitiba",-25.5067755,-49.2957937
124,"rua  cidade de laguna, CIDADE INDUSTRIAL, Curitiba",-25.4750745,-49.340517
125,"rua lauro da silva, CIDADE INDUSTRIAL, Curitiba",-25.5026893,-49.32389
126,"rua curitiba ponta grossa br-277, SANTA FELICIDADE, Curitiba",-25.4308832,-49.3326911
127,"rua cerro azul, CAMPO COMPRIDO, Curitiba",-25.4576947,-49.376623
128,"rua ricardo gasparian machado, SÍTIO CERCADO, Curitiba",-25.532319,-49.285807
129,"rua manoel gustavo schier, PORTÃO, Curitiba",-25.4810356,-49.3112192
130,"rua romano bertagnoli, NOVO MUNDO, Curitiba",-25.4215033,-49.3005819
131,"rua orestes codega, PINHEIRINHO, Curitiba",-25.5204652,-49.3051156
132,"rua sigismundo gradowski, CIDADE INDUSTRIAL, Curitiba",-25.4985838,-49.34016099999999
133,"rua bispo são félix, TATUQUARA, Curitiba",-25.5625999,-49.33058219999999
134,"rua  guilherme walter lowry, UBERABA, Curitiba",-25.4881863,-49.20103760000001
135,"rua guy de maupassant, ÁGUA VERDE, Curitiba",-25.3882712,-49.2861376
136,"rua prefeito joão moreira garcez, CENTRO, Curitiba",-25.428824,-49.270358
137,"rua nestor de castro, SÃO FRANCISCO, Curitiba",-25.4281705,-49.2726034
138,"rua antonio escorsin, SANTA FELICIDADE, Curitiba",-25.4175282,-49.3459213
139,"rua doutor carlos de carvalho, BATEL, Curitiba",-25.4380219,-49.2926447
140,"rua da glória, CENTRO CÍVICO, Curitiba",-25.4208533,-49.2676403
141,"rua inocêncio milani, SÃO BRAZ, Curitiba",-25.4138809,-49.3485918
142,"rua  via veneto, SANTA FELICIDADE, Curitiba",-25.4014227,-49.32990470000001
143,"rua senador accioly filho, CIDADE INDUSTRIAL, Curitiba",-25.4974267,-49.3253023
144,"rua rari graal, UMBARÁ, Curitiba",-25.560004,-49.283783
145,"rua padre paulo warkocz, SANTA FELICIDADE, Curitiba",-25.4381559,-49.35511899999999
146,"rua josé scuissiato, CAMPINA DO SIQUEIRA, Curitiba",-25.4454235,-49.3065182
147,"rua teomilia de freitas machado, FAZENDINHA, Curitiba",-25.4780177,-49.3335646
148,"rua delegado bruno de almeida, PINHEIRINHO, Curitiba",-25.5846558,-49.318286
149,"rua delegado bruno de almeida, CAXIMBA, Curitiba",-25.6085605,-49.3339732
150,"rua  jornalista emílio zola florenzano, TATUQUARA, Curitiba",-25.5759821,-49.3362475
151,"rua desembargador joaquim penido monteiro, JARDIM SOCIAL, Curitiba",-25.4142952,-49.2387415
152,"rua colômbia, BACACHERI, Curitiba",-25.4079013,-49.2391424
153,"rua  miguel de lazzari, PILARZINHO, Curitiba",-25.392724,-49.2906062
154,"rua reinaldo issberner, CAJURU, Curitiba",-25.4492541,-49.2250322
155,"rua  ewerton leinig saporski, CAMPO DE SANTANA, Curitiba",-25.5909876,-49.3428253
156,"rua  coronel herculano de araujo, NOVO MUNDO, Curitiba",-25.4873004,-49.303811
157,"rua  antonio moreira lopes, CAJURU, Curitiba",-25.4735303,-49.191649
158,"rua cândido hartmann, SANTO INÁCIO, Curitiba",-25.4228114,-49.31544419999999
159,"rua lupionópolis, SÍTIO CERCADO, Curitiba",-25.5452172,-49.2678545
160,"rua  antonio claudino, PINHEIRINHO, Curitiba",-25.5288546,-49.2962778
161,"rua  cândido hartmann, SANTO INÁCIO, Curitiba",-25.4228114,-49.31544419999999
162,"rua marechal floriano peixoto, BOQUEIRÃO, Curitiba",-25.5057767,-49.2353257
163,"rua joão rodrigues pinheiro, PINHEIRINHO, Curitiba",-25.5120256,-49.3027064
164,"rua  josé alcides de lima, NOVO MUNDO, Curitiba",-25.4926192,-49.3065644
165,"rua guy de maupassant, PILARZINHO, Curitiba",-25.3882712,-49.2861376
166,"rua luiz xavier da silva, CIDADE INDUSTRIAL, Curitiba",-25.4776639,-49.171373
167,"rua nestor victor, ÁGUA VERDE, Curitiba",-25.4556878,-49.2753666
168,"rua emilio bertolini, CAJURU, Curitiba",-25.4460421,-49.2096485
169,"rua francisco castellano, JARDIM DAS AMÉRICAS, Curitiba",-25.4695279,-49.22536119999999
170,"rua eurides cunha, ÁGUA VERDE, Curitiba",-25.4548777,-49.2906194
171,"rua generoso marques, CENTRO, Curitiba",-25.4295062,-49.2702159
172,"rua capitão roberto lopes quintas, ALTO BOQUEIRÃO, Curitiba",-25.5372024,-49.2371681
173,"rua milton miramir visinoni, SÍTIO CERCADO, Curitiba",-25.5434341,-49.2502079
174,"rua carlos klemtz, FAZENDINHA, Curitiba",-25.4763452,-49.32130249999999
175,"rua prefeito maurício fruet, CAPÃO DA IMBUIA, Curitiba",-25.4397073,-49.2237836
176,"rua canal belém, CENTRO, Curitiba",-25.4854914,-49.2346413
177,"rua do rosário, CENTRO, Curitiba",-25.4284309,-49.2732123
178,"rua luiz augusto de toledo leite, UBERABA, Curitiba",-25.5579583,-49.2798679
179,"rua coronel wallace scott murray, SANTA CÂNDIDA, Curitiba",-25.3775846,-49.2323814
180,"rua sergipe, PORTÃO, Curitiba",-25.4716086,-49.2739108
181,"rua presidente affonso camargo, JARDIM BOTÂNICO, Curitiba",-25.4353638,-49.2573899
182,"rua  euclides bandeira, CENTRO CÍVICO, Curitiba",-25.4133879,-49.2703932
183,"rua zorayde mandelli, CAPÃO DA IMBUIA, Curitiba",-25.4419996,-49.2013028
184,"rua guarandi, SÃO BRAZ, Curitiba",-25.4187121,-49.3385672
185,"rua nossa senhora do equilíbrio, CIDADE INDUSTRIAL, Curitiba",-25.498634,-49.3532375
186,"rua pedro zagonel, NOVO MUNDO, Curitiba",-25.4890055,-49.3031167
187,"rua josé irineu budant, SÍTIO CERCADO, Curitiba",-25.555965,-49.2647528
188,"rua conde dos arcos, LINDÓIA, Curitiba",-25.4796343,-49.2775383
189,"rua alberto kosop, PINHEIRINHO, Curitiba",-25.5195129,-49.29835749999999
190,"rua nazilde guimarães paixão, CIDADE INDUSTRIAL, Curitiba",-25.4987296,-49.3434477
191,"rua do trabalho, SÍTIO CERCADO, Curitiba",-25.5378223,-49.2984537
192,"rua gustavo prestes aldenucci, SÍTIO CERCADO, Curitiba",-25.5324637,-49.25714809999999
193,"rua lygia erichsen carneiro, UBERABA, Curitiba",-25.4853816,-49.2016259
194,"rua cabral, CENTRO, Curitiba",-25.4282892,-49.2786445
195,"rua joão amadeu pedro bom, TATUQUARA, Curitiba",-25.5511225,-49.29871110000001
196,"rua ayrton pizzatto gusi, XAXIM, Curitiba",-25.5254615,-49.2594763
197,"rua padre francisco van de water, SÍTIO CERCADO, Curitiba",-25.5459711,-49.2503801
198,"rua jurandir mendes de lima (radialista jurandir carioca), GANCHINHO, Curitiba",-25.5554978,-49.2481186
199,"rua assis figueiredo, PAROLIN, Curitiba",-25.4660817,-49.2700167
200,"rua desembargador josé carlos ribeiro ribas, ABRANCHES, Curitiba",-25.3795824,-49.2791027
201,"rua doutor benedicto siqueira branco, ALTO BOQUEIRÃO, Curitiba",-25.53427,-49.240236
202,"rua gilberto pinto mileo, CIDADE INDUSTRIAL, Curitiba",-25.5011686,-49.3144804
203,"rua bento gonçalves, CAJURU, Curitiba",-25.4509231,-49.2217216
204,"rua marco campos, CIDADE INDUSTRIAL, Curitiba",-25.5318857,-49.3392432
205,"rua  visconde do serro frio, NOVO MUNDO, Curitiba",-25.4862954,-49.3010481
206,"rua general potiguara, FAZENDINHA, Curitiba",-25.4864615,-49.3197134
207,"rua  fredolin wolf, SÃO JOÃO, Curitiba",-25.3847796,-49.3090743
208,"rua dos pioneiros, SÍTIO CERCADO, Curitiba",-25.5345335,-49.26999139999999
209,"rua paula gomes, CENTRO, Curitiba",-25.4244893,-49.2749641
210,"rua ouro verde, CAPÃO RASO, Curitiba",-25.5077029,-49.3009607
211,"rua maria de lourdes mickosz, ATUBA, Curitiba",-25.3749964,-49.2785387
212,"rua maria de lourdes mickosz, ABRANCHES, Curitiba",-25.3749964,-49.2785387
213,"rua nestor de castro, CENTRO, Curitiba",-25.4283558,-49.2727099
214,"rua  mani zir bourges, PINHEIRINHO, Curitiba",-25.5244572,-49.2672311
215,"rua victor ferreira do amaral, TARUMÃ, Curitiba",-25.4292786,-49.22198179999999
216,"rua  pastor waldomiro bileski, SÍTIO CERCADO, Curitiba",-25.5429877,-49.2613677
217,"rua visconde de guarapuava, ALTO DA RUA XV, Curitiba",-25.4298873,-49.2511027
218,"rua  república argentina, NOVO MUNDO, Curitiba",-25.4713135,-49.29432629999999
219,"rua guilherme janz, MOSSUNGUÊ, Curitiba",-25.4418668,-49.3293788
220,"rua helena c s correa, PINHEIRINHO, Curitiba",-25.5187346,-49.282731
221,"rua jaime reis, SÃO FRANCISCO, Curitiba",-25.4263896,-49.2768453
222,"rua macapá, TINGUI, Curitiba",-25.3815969,-49.2251169
223,"rua santa anastásia, CAJURU, Curitiba",-25.4442806,-49.2140729
224,"rua josé julio tortato, CAMPO DE SANTANA, Curitiba",-25.602566,-49.315489
225,"rua  madre emilia riquelme, SÍTIO CERCADO, Curitiba",-25.5441622,-49.2771122
226,"rua natal, CAJURU, Curitiba",-25.4543716,-49.209005
227,"rua mariano torres, CENTRO, Curitiba",-25.431386,-49.2621927
228,"rua  prefeito lothário meissner, JARDIM BOTÂNICO, Curitiba",-25.444067,-49.2388825
229,"rua  joão mequetti, SANTA CÂNDIDA, Curitiba",-25.376755,-49.2378355
230,"rua adir josé frason, CIDADE INDUSTRIAL, Curitiba",-25.4353363,-49.3630672
231,"rua  jovenilson américo de oliveira, TATUQUARA, Curitiba",-25.560451,-49.3305674
232,"rua inacio lustosa, CENTRO, Curitiba",-25.4233618,-49.2757957
233,"rua theodoro alves, CAJURU, Curitiba",-25.4942057,-49.2047968
234,"rua euclides bandeira, CENTRO CÍVICO, Curitiba",-25.4133879,-49.2703932
235,"rua prudente de moraes, LINDÓIA, Curitiba",-25.4279544,-49.283546
236,"rua  república argentina, CAPÃO RASO, Curitiba",-25.494944,-49.2942488
237,"rua afonso lipinski, BIGORRILHO, Curitiba",-25.4331484,-49.3439262
238,"rua  jornalista aderbal g stresser, CAJURU, Curitiba",-25.4728564,-49.1987211
239,"rua visconde de abaeté, BAIRRO ALTO, Curitiba",-25.4267006,-49.20220440000001
240,"rua antonio rebelatto, XAXIM, Curitiba",-25.4943024,-49.2625409
241,"rua joão parize, SÃO BRAZ, Curitiba",-25.4098714,-49.339125
242,"rua do xisto br-476, PINHEIRINHO, Curitiba",-25.7631786,-49.73725
243,"rua francisco josé lobo, SÍTIO CERCADO, Curitiba",-25.5310148,-49.2744846
244,"rua said joão sallum, BAIRRO ALTO, Curitiba",-25.4160415,-49.21178140000001
245,"rua anita garibaldi, CENTRO, Curitiba",-25.3805505,-49.2614333
246,"rua república argentina, ÁGUA VERDE, Curitiba",-25.4598066,-49.2893373
247,"rua tophile kogempa, CAJURU, Curitiba",-25.4629159,-49.195671
248,"rua  padre anchieta, CAMPINA DO SIQUEIRA, Curitiba",-25.4346234,-49.3030647
249,"rua elizeu valentin de lima, CAMPO DE SANTANA, Curitiba",-25.5848434,-49.3211631
250,"rua augusto dias paredes, BOQUEIRÃO, Curitiba",-25.5023823,-49.2228303
251,"rua paraná, BOA VISTA, Curitiba",-25.3886823,-49.2334685
252,"rua josé galeski, CAPÃO RASO, Curitiba",-25.5128341,-49.30268599999999
253,"rua izaac ferreira da cruz, SÍTIO CERCADO, Curitiba",-25.5359612,-49.272154
254,"rua rio araguari, BAIRRO ALTO, Curitiba",-25.4016328,-49.20234
255,"rua deputado benedito lúcio machado, XAXIM, Curitiba",-25.5063538,-49.2758378
256,"rua jacob bertinato, ALTO DA RUA XV, Curitiba",-25.4310058,-49.2371096
257,"rua clávio molinari, CAPÃO DA IMBUIA, Curitiba",-25.4396,-49.2114482
258,"rua luiz leal da rocha, CAMPO DE SANTANA, Curitiba",-25.5813704,-49.324136
259,"rua  velha do barigui, CIDADE INDUSTRIAL, Curitiba",-25.4942291,-49.3450126
260,"rua  santo inácio, CIDADE INDUSTRIAL, Curitiba",-25.500517,-49.321574
261,"rua indefinido, BOQUEIRÃO, Curitiba",-25.5030083,-49.2367172
262,"rua capiberibe, BOQUEIRÃO, Curitiba",-25.4636878,-49.3036363
263,"rua zacarias gomes de souza, UBERABA, Curitiba",-25.4881825,-49.207207
264,"rua praça colégio benedito, BOA VISTA, Curitiba",-25.3886823,-49.2334685
265,"rua presidente wenceslau braz, PORTÃO, Curitiba",-25.478438,-49.2880143
266,"rua pelegrino azzolin (o pedreiro artista), GANCHINHO, Curitiba",-25.5572204,-49.2484204
267,"rua andre de barros, CENTRO, Curitiba",-25.4347863,-49.26866709999999
268,"rua nicolau salomão, TINGUI, Curitiba",-25.3845345,-49.2247488
269,"rua quadra 15, TATUQUARA, Curitiba",-25.5647384,-49.3282697
270,"rua cabral, CENTRO CÍVICO, Curitiba",-25.4174893,-49.2687071
271,"rua  waldemar kost, HAUER, Curitiba",-25.4852738,-49.2526187
272,"rua manoel valdomiro de macedo, CIDADE INDUSTRIAL, Curitiba",-25.5142532,-49.3182753
273,"rua professor ulisses vieira, VILA IZABEL, Curitiba",-25.4607224,-49.2977864
274,"rua francisco de paula sobrinho, CAJURU, Curitiba",-25.4709955,-49.1999997
275,"rua waldemar pereira da silva, UBERABA, Curitiba",-25.5012563,-49.21578179999999
276,"rua xv de novembro, CENTRO, Curitiba",-25.4285759,-49.2650078
277,"rua saturnino miranda, SANTA FELICIDADE, Curitiba",-25.3966966,-49.33495509999999
278,"rua francisco borges machado, CAPÃO DA IMBUIA, Curitiba",-25.4323422,-49.2140444
279,"rua deputado mário de barros, CENTRO CÍVICO, Curitiba",-25.4119308,-49.2693334
280,"rua clávio molinari, ABRANCHES, Curitiba",-25.4396,-49.2114482
281,"rua clávio molinari, CAJURU, Curitiba",-25.4396,-49.2114482
282,"rua  dos funcionários, CABRAL, Curitiba",-25.406527,-49.2517266
283,"rua antenor josé tedeschi, CAJURU, Curitiba",-25.4563518,-49.2008313
284,"rua robert redzimski, CAMPO COMPRIDO, Curitiba",-25.4574862,-49.348574
285,"rua marechal floriano peixoto, HAUER, Curitiba",-25.476999,-49.2494121
286,"rua  monsenhor ivo zanlorenzi, CAMPO COMPRIDO, Curitiba",-25.4390853,-49.33161560000001
287,"rua adolfo joao hilario da veiga, CIDADE INDUSTRIAL, Curitiba",-25.4508624,-49.3540985
288,"rua catulo da paixão cearense, CAPÃO DA IMBUIA, Curitiba",-25.4649395,-49.2061748
289,"rua  1 de maio, XAXIM, Curitiba",-25.5138195,-49.2783394
290,"rua professor joão falarz, CAMPO COMPRIDO, Curitiba",-25.4394581,-49.3464305
291,"rua  tijucas do sul, SÍTIO CERCADO, Curitiba",-25.5444929,-49.2657766
292,"rua 6 quadra 15, SÍTIO CERCADO, Curitiba",-25.5443488,-49.26656209999999
293,"rua antonio moreira lopes, CAJURU, Curitiba",-25.4735303,-49.191649
294,"rua  major nestor luiz de oliveira júnior, SANTO INÁCIO, Curitiba",-25.4266388,-49.3442423
295,"rua maria simao campos, UBERABA, Curitiba",-25.4854885,-49.2120294
296,"rua jornalista octávio sécundino, BOM RETIRO, Curitiba",-25.4050683,-49.2806126
297,"rua  são paulo, GUAÍRA, Curitiba",-25.4671717,-49.2774543
298,"rua saldanha marinho, CENTRO, Curitiba",-25.4313265,-49.2791618
299,"rua elohar scheremetta, CACHOEIRA, Curitiba",-25.3549943,-49.2578285
300,"rua marcos mocellin, SANTA FELICIDADE, Curitiba",-25.4013189,-49.3268061
301,"rua eduardo sprada, AUGUSTA, Curitiba",-25.4536247,-49.3689879
302,"rua  conselheiro laurindo, CENTRO, Curitiba",-25.4345074,-49.2630588
303,"rua  francisco josé lobo, SÍTIO CERCADO, Curitiba",-25.5310148,-49.2744846
304,"rua dos pioneiros, ALTO BOQUEIRÃO, Curitiba",-25.5345335,-49.26999139999999
305,"rua baldur magnus grubba, NOVO MUNDO, Curitiba",-25.483612,-49.3079584
306,"rua  deputado pinheiro junior, UMBARÁ, Curitiba",-25.5599711,-49.2837695
307,"rua paulo bettes, NOVO MUNDO, Curitiba",-25.4794777,-49.286002
308,"rua celeste tortato gabardo, SÍTIO CERCADO, Curitiba",-25.5440645,-49.28107019999999
309,"rua  deputado heitor alencar furtado, CAMPO COMPRIDO, Curitiba",-25.4381247,-49.33185049999999
310,"rua doutor salvador de maio, JARDIM BOTÂNICO, Curitiba",-25.4514866,-49.2413481
311,"rua charles dickens, SANTA CÂNDIDA, Curitiba",-25.3690117,-49.2691047
312,"rua josé damarate, SANTA FELICIDADE, Curitiba",-25.3823688,-49.3353443
313,"rua nossa senhora do sagrado coração, CAPÃO RASO, Curitiba",-25.5337636,-49.2958177
314,"rua waldemar monastier, BOQUEIRÃO, Curitiba",-25.5397327,-49.2335507
315,"rua nossa senhora do sagrado coração, PINHEIRINHO, Curitiba",-25.5337636,-49.2958177
316,"rua charles dickens, PINHEIRINHO, Curitiba",-25.3690117,-49.2691047
317,"rua senador souza naves, CRISTO REI, Curitiba",-25.4310415,-49.2482643
318,"rua charles dickens, ABRANCHES, Curitiba",-25.3694452,-49.2687491
319,"rua mauro gonçalves- zacarias, TATUQUARA, Curitiba",-25.5616973,-49.3392973
320,"rua  joão amadeu pedro bom, TATUQUARA, Curitiba",-25.5511225,-49.29871110000001
321,"rua mercúrio, SÍTIO CERCADO, Curitiba",-25.5312926,-49.2647464
322,"rua general osório, CENTRO, Curitiba",-25.4326878,-49.2762228
323,"rua doutor carlos de carvalho, CENTRO, Curitiba",-25.4331883,-49.2804009
324,"rua reverendo paulo hecke, AHÚ, Curitiba",-25.3971272,-49.2595751
326,"rua florindo rinaldin, XAXIM, Curitiba",-25.5099301,-49.2727241
327,"rua  doutor levy buquera, SÍTIO CERCADO, Curitiba",-25.5307277,-49.2677738
328,"rua uberlândia, ABRANCHES, Curitiba",-25.3609742,-49.2736796
329,"rua abóbora, UBERABA, Curitiba",-25.4809097,-49.20498569999999
330,"rua darcy meirelles da luz, CIDADE INDUSTRIAL, Curitiba",-25.4390034,-49.359761
331,"rua brasília, PORTÃO, Curitiba",-25.4831826,-49.2924701
332,"rua  denilson felipe de lima, CIDADE INDUSTRIAL, Curitiba",-25.5096348,-49.3269682
333,"rua dos pioneiros, ALTO DA GLÓRIA, Curitiba",-25.5345335,-49.26999139999999
334,"rua canadá, CABRAL, Curitiba",-25.3929371,-49.2386451
335,"rua adilio ramos, BAIRRO ALTO, Curitiba",-25.4108029,-49.2058046
