,Endereco,LATITUDE,LONGITUDE
14163,"rua prof. fernando moreira, MERCÊS, Curitiba",-25.4296045,-49.2843116
14164,"rua mal. floriano peixoto, ALTO BOQUEIRÃO, Curitiba",-25.5232533,-49.2268544
14165,"rua pres. affonso camargo, REBOUÇAS, Curitiba",-25.4357588,-49.25584809999999
14166,"rua raul pompéia, CIDADE INDUSTRIAL, Curitiba",-25.4806276,-49.3429399
14167,"rua des. westphalen, CENTRO, Curitiba",-25.4375022,-49.2706537
14168,"rua pres. affonso camargo, JARDIM BOTÂNICO, Curitiba",-25.4366352,-49.2455189
14169,"rua pres. joão goulart, TATUQUARA, Curitiba",-25.5748825,-49.3293659
14170,"rua pr. waldomiro bileski, SÍTIO CERCADO, Curitiba",-25.5429877,-49.2613677
14171,"rua prof. porthos velozo, PAROLIN, Curitiba",-25.4654054,-49.2615327
14172,"rua siegfried rigler, SÃO LOURENÇO, Curitiba",-22.12517,-45.0513189
14173,"rua dep. heitor alencar furtado, CAMPINA DO SIQUEIRA, Curitiba",-25.4378592,-49.3134264
14174,"rua eros ruppel abdalla, TABOÃO, Curitiba",-25.3623462,-49.2812733
14175,"rua frederico stadler júnior, CAPÃO DA IMBUIA, Curitiba",-25.4382679,-49.2117277
14176,"rua pe. anchieta, CAMPINA DO SIQUEIRA, Curitiba",-25.4346234,-49.3030647
14177,"rua ver. elias karam, FAZENDINHA, Curitiba",-25.4802203,-49.3307648
14178,"rua theóphilo mansur, NOVO MUNDO, Curitiba",-25.4926263,-49.3083997
14179,"rua dr. eurico césar de almeida, BACACHERI, Curitiba",-25.392396,-49.2341566
14180,"rua via vêneto, SANTA FELICIDADE, Curitiba",-25.4014227,-49.32990470000001
14181,"rua arthur leal, ALTO BOQUEIRÃO, Curitiba",-25.545661,-49.2355123
14182,"rua gen. mário tourinho, CAMPINA DO SIQUEIRA, Curitiba",-25.4379815,-49.3076809
14183,"rua pe. anchieta, BIGORRILHO, Curitiba",-25.4314342,-49.2954784
14184,"rua analia valente maestrelli, CIDADE INDUSTRIAL, Curitiba",-25.4614083,-49.3528779
14185,"rua peter heinrichs, XAXIM, Curitiba",-25.5135221,-49.2565744
14186,"rua visc. de guarapuava, CENTRO, Curitiba",-25.4367644,-49.26846829999999
14187,"rua exp. francisco pereira dos santos, ALTO BOQUEIRÃO, Curitiba",-25.5383015,-49.2484749
14188,"rua cidade de santa isabel do ivaí, CIDADE INDUSTRIAL, Curitiba",-25.4857732,-49.3533199
14189,"rua da imbuia, BARREIRINHA, Curitiba",-25.3666429,-49.25777919999999
14190,"rua ivo ioneu crocetti, CAJURU, Curitiba",-25.4502563,-49.2235785
14191,"rua sen. accioly filho, CIDADE INDUSTRIAL, Curitiba",-25.4974267,-49.3253023
14192,"rua des. carlos pinheiro guimãraes, SÍTIO CERCADO, Curitiba",-25.5443701,-49.25519449999999
14193,"rua dr. salvador de maio, JARDIM BOTÂNICO, Curitiba",-25.4514866,-49.2413481
14194,"rua dep. heitor alencar furtado, CIDADE INDUSTRIAL, Curitiba",-25.4415504,-49.3446611
14195,"rua alf. poli, REBOUÇAS, Curitiba",-25.4468914,-49.268576
14196,"rua pref. lothário meissner, JARDIM BOTÂNICO, Curitiba",-25.444067,-49.2388825
14197,"rua maria lucia locher de athaide, CIDADE INDUSTRIAL, Curitiba",-25.4928822,-49.3528982
14198,"rua del. bruno de almeida, CAXIMBA, Curitiba",-25.618906,-49.346618
14199,"rua dep. heitor alencar furtado, MOSSUNGUÊ, Curitiba",-25.437083,-49.3265897
14200,"rua barigui, BIGORRILHO, Curitiba",-25.6103941,-49.3867927
14201,"rua br-277 - curitiba / ponta grossa, ORLEANS, Curitiba",-25.4318556,-49.3653728
14202,"rua adolpho carniatto, CAJURU, Curitiba",-25.4563571,-49.19918209999999
14203,"rua dep. heitor alencar furtado, CAMPO COMPRIDO, Curitiba",-25.4381247,-49.33185049999999
14204,"rua josé antonio dos santos, CAJURU, Curitiba",-25.4652274,-49.1999479
14205,"rua guilherme kloss, CIDADE INDUSTRIAL, Curitiba",-25.4564925,-49.3458646
14206,"rua des. cid campelo, CIDADE INDUSTRIAL, Curitiba",-25.49842,-49.337959
14207,"rua capiberibe, PORTÃO, Curitiba",-25.4658763,-49.3028971
14208,"rua eng. benedito mário da silva, CAJURU, Curitiba",-25.4695338,-49.20579009999999
14209,"rua antônio moreira lopes, CAJURU, Curitiba",-25.4735303,-49.191649
14210,"rua dr. mbá de ferrante, SÃO JOÃO, Curitiba",-25.4008308,-49.305702
14211,"rua vereador victòrio josè roda, CIDADE INDUSTRIAL, Curitiba",-25.5323379,-49.3335653
14212,"rua exp. estanislau wojcik, ALTO BOQUEIRÃO, Curitiba",-25.5358716,-49.2433378
14213,"rua jesuíno marcondes, CENTRO, Curitiba",-25.4349054,-49.2751317
14214,"rua casimiro de abreu, CIDADE INDUSTRIAL, Curitiba",-22.4797967,-42.202903
14215,"rua joão batista burbello, TATUQUARA, Curitiba",-25.554373,-49.2955912
14216,"rua fredolin wolf, CASCATINHA, Curitiba",-25.3112867,-49.29651339999999
14217,"rua pres. getúlio vargas, REBOUÇAS, Curitiba",-25.4434404,-49.2678767
14218,"rua josé antônio leprevost, SANTA CÂNDIDA, Curitiba",-25.3752302,-49.23327889999999
14219,"rua 1º de maio, XAXIM, Curitiba",-25.5138195,-49.2783394
14220,"rua alm. donadello, ALTO BOQUEIRÃO, Curitiba",-25.5429764,-49.2443581
14221,"rua isaltino almeida, ALTO BOQUEIRÃO, Curitiba",-25.5317642,-49.2421568
14222,"rua dr. josé de almeida pimpão, SÍTIO CERCADO, Curitiba",-25.5373344,-49.25455059999999
14223,"rua cândido lopes, CENTRO, Curitiba",-25.4309512,-49.2741177
14224,"rua bem me quer, TATUQUARA, Curitiba",-25.5786035,-49.33059129999999
14225,"rua juscelino kubcheki, CIDADE INDUSTRIAL, Curitiba",-25.4808762,-49.3044253
14226,"rua dr. levy buquéra, SÍTIO CERCADO, Curitiba",-25.5307277,-49.2677738
14227,"rua pres. getúlio vargas, ÁGUA VERDE, Curitiba",-25.4491228,-49.2827968
14228,"rua pres. affonso camargo, CAJURU, Curitiba",-25.4416829,-49.2175273
14229,"rua diacomo santoro, SANTA FELICIDADE, Curitiba",-25.4574293,-49.3214114
14230,"rua antônio antoniacomi, SANTA CÂNDIDA, Curitiba",-25.366275,-49.2111096
14231,"rua pres. kennedy, PAROLIN, Curitiba",-25.4560905,-49.2681722
14232,"rua prof. júlio theodorico guimarães, PINHEIRINHO, Curitiba",-25.5283631,-49.2732412
14233,"rua antônio escorsin, SÃO BRAZ, Curitiba",-25.419068,-49.3491214
14234,"rua tenente ernani vidal, BATEL, Curitiba",-25.4808762,-49.3044253
14235,"rua pres. affonso camargo, CAPÃO DA IMBUIA, Curitiba",-25.4416829,-49.2175273
14236,"rua des. westphalen, REBOUÇAS, Curitiba",-25.4462852,-49.26656550000001
14237,"rua francisco fávaro, SANTA CÂNDIDA, Curitiba",-25.368779,-49.2431959
14238,"rua mal. floriano peixoto, PRADO VELHO, Curitiba",-25.4588465,-49.258356
14239,"rua canal belém - marginal leste, UBERABA, Curitiba",-25.4923625,-49.2283881
14240,"rua gen. osório, CENTRO, Curitiba",-25.4289541,-49.267137
14241,"rua prof. josé rodrigues vieira netto, CIDADE INDUSTRIAL, Curitiba",-25.4966706,-49.3483735
14242,"rua do jequitibá, CIDADE INDUSTRIAL, Curitiba",-25.4900526,-49.351554
14243,"rua visc. de guarapuava, ALTO DA RUA XV, Curitiba",-25.4298873,-49.2511027
14244,"rua joao leopoldo jacomel, CAJURU, Curitiba",-25.4808762,-49.3044253
14245,"rua mto. carlos frank, ALTO BOQUEIRÃO, Curitiba",-25.5219994,-49.2400046
14246,"rua olivardo koronoski bueno, TATUQUARA, Curitiba",-25.5647384,-49.3282697
14247,"rua cap. roberto lopes quintas, ALTO BOQUEIRÃO, Curitiba",-25.536838,-49.238481
14248,"rua com. franco, JARDIM BOTÂNICO, Curitiba",-25.4453112,-49.24871479999999
14249,"rua prof. elevir dionysio, FAZENDINHA, Curitiba",-25.4777229,-49.3166589
14250,"rua br. do rio branco, CENTRO, Curitiba",-25.434247,-49.2673107
14251,"rua canal vila guaira, GUAÍRA, Curitiba",10.6024787,-66.9313444
14252,"rua pe. estanislau piasecki, CIDADE INDUSTRIAL, Curitiba",-25.4362357,-49.3581679
14253,"rua luciano cardinale, BOA VISTA, Curitiba",-25.4063548,-49.252997
14254,"rua lúcio de oliveira lara, SÍTIO CERCADO, Curitiba",-25.5557176,-49.2577457
14255,"rua rosina sanson pereira pinto, BOQUEIRÃO, Curitiba",-25.4912322,-49.2268324
14256,"rua cel. victor agner kendrick, SÍTIO CERCADO, Curitiba",-25.5333949,-49.2609789
14257,"rua evelázio augusto bley, TATUQUARA, Curitiba",-25.5600171,-49.3247965
14258,"rua ver. toaldo túlio, SÃO BRAZ, Curitiba",-25.4184105,-49.348657
14259,"rua presidente getúlio vargas, CAJURU, Curitiba",-27.0416321,-49.6213852
14260,"rua das olarias, ALTO BOQUEIRÃO, Curitiba",-25.3606702,-49.2092239
14261,"rua pe. albino vico, CAPÃO RASO, Curitiba",-25.4954663,-49.29479449999999
14262,"rua max sesselmeir, ATUBA, Curitiba",-25.4808762,-49.3044253
14263,"rua ten. antônio pupo, XAXIM, Curitiba",-25.5173296,-49.2653302
14264,"rua vicente montepoliciano do nascimento junior, SANTA CÂNDIDA, Curitiba",-25.3626783,-49.21448849999999
14265,"rua pres. arthur da silva bernardes, PORTÃO, Curitiba",-25.4654581,-49.3004813
14266,"rua antonio jeronymo, CIDADE INDUSTRIAL, Curitiba",-25.5151355,-49.33068129999999
14267,"rua profa. delminda santos fernandes, SÍTIO CERCADO, Curitiba",-25.5293363,-49.2697775
14268,"rua oswaldo martin, CAMPO COMPRIDO, Curitiba",-25.4406099,-49.3528138
14269,"rua bronislau lupinski, SANTA CÂNDIDA, Curitiba",-25.3760489,-49.2430923
14270,"rua rua canadá, SANTA CÂNDIDA, Curitiba",-25.3690362,-49.2364955
14271,"rua edvino antonio deboni, CIDADE INDUSTRIAL, Curitiba",-25.4834077,-49.32137549999999
14272,"rua juá, UBERABA, Curitiba",-25.4841883,-49.2124044
14273,"rua engs. rebouças, JARDIM BOTÂNICO, Curitiba",-25.4413645,-49.2486019
14274,"rua profa. theresinha de jesus voigt, CAJURU, Curitiba",-25.4455813,-49.2005689
14275,"rua dr. carlos de carvalho, BIGORRILHO, Curitiba",-25.4380219,-49.2926447
14276,"rua jorn. aderbal gaertner stresser, CAJURU, Curitiba",-25.4728564,-49.1987211
14277,"rua dr. domício costa, XAXIM, Curitiba",-25.5104974,-49.2564485
14278,"rua dr. alvir brambilla zilli, ALTO BOQUEIRÃO, Curitiba",-25.5363407,-49.230822
14279,"rua cap. souza franco, BIGORRILHO, Curitiba",-25.4334093,-49.291676
14280,"rua emília erichsen, CIDADE INDUSTRIAL, Curitiba",-25.4538706,-49.3551395
14281,"rua pref. erasto gaertner, BACACHERI, Curitiba",-25.3989117,-49.23628679999999
14282,"rua andré petrelli, JARDIM DAS AMÉRICAS, Curitiba",-25.4654169,-49.2264554
14283,"rua pres. wenceslau braz, NOVO MUNDO, Curitiba",-25.4783203,-49.2873892
14284,"rua ten. tito teixeira de castro, BOQUEIRÃO, Curitiba",-25.4924788,-49.2440178
14285,"rua capitao qao milton stricker, CAMPO DE SANTANA, Curitiba",-25.5792381,-49.3203738
14286,"rua ver. yrlan cavet, ALTO BOQUEIRÃO, Curitiba",-25.5248238,-49.2515407
14287,"rua são valério, CIDADE INDUSTRIAL, Curitiba",-25.4988204,-49.34447429999999
14288,"rua prof. nivaldo braga, CAPÃO DA IMBUIA, Curitiba",-25.4363978,-49.2186964
14289,"rua praça 3, CIDADE INDUSTRIAL, Curitiba",-25.4506781,-49.355733
14290,"rua dr. mbá de ferrante -, SÃO JOÃO, Curitiba",-25.4008308,-49.305702
14291,"rua fr. teófilo, CAPÃO RASO, Curitiba",-25.5024408,-49.3019212
14292,"rua alexandro gleiski, SÍTIO CERCADO, Curitiba",-25.5607177,-49.2566018
14293,"rua luiz julio, CAMPO COMPRIDO, Curitiba",-25.4365259,-49.3467691
14294,"rua profa. maria de assumpção, BOQUEIRÃO, Curitiba",-25.4924152,-49.245995
14295,"rua pedro kurzava, NOVO MUNDO, Curitiba",-25.483947,-49.3069254
14296,"rua marcos nelson casagrande, GANCHINHO, Curitiba",32.9110027,-111.7733902
14297,"rua ni, SANTA FELICIDADE, Curitiba",-25.4039852,-49.32869170000001
14298,"rua eurides titon, SÍTIO CERCADO, Curitiba",-25.5352375,-49.26714
14299,"rua joão negrao, CENTRO, Curitiba",-25.4357272,-49.26395979999999
14300,"rua luiz himann, SÃO BRAZ, Curitiba",-25.4262157,-49.3461826
14301,"rua carlos antonio de azevedo, JARDIM BOTÂNICO, Curitiba",-25.4410665,-49.2441064
14302,"rua engs. rebouças, REBOUÇAS, Curitiba",-25.4434404,-49.2678767
14303,"rua prof. fernando moreira, CENTRO, Curitiba",-25.4299698,-49.2825818
14304,"rua santa paulina, CIDADE INDUSTRIAL, Curitiba",-25.4587673,-49.340881
14305,"rua ângelo marqueto, AUGUSTA, Curitiba",-25.4746593,-49.3749237
14306,"rua joão gilberto justus, SANTA QUITÉRIA, Curitiba",-25.4569744,-49.3145819
14307,"rua mal. hermes, CENTRO CÍVICO, Curitiba",-25.4130261,-49.2657464
14308,"rua pres. wenceslau braz, PORTÃO, Curitiba",-25.4749753,-49.2736584
14309,"rua eng. joão visinoni, CIDADE INDUSTRIAL, Curitiba",-25.437832,-49.3600737
14310,"rua prof. plácido e silva, PAROLIN, Curitiba",-25.4664431,-49.2613636
14311,"rua virgínia dalabona, ORLEANS, Curitiba",-25.4294852,-49.3582771
14312,"rua da. bárbara cid, UBERABA, Curitiba",-25.493028,-49.2237863
14313,"rua engenheiro elato silva, CIDADE INDUSTRIAL, Curitiba",-25.4959241,-49.339639
14314,"rua visc. de nacar, CENTRO, Curitiba",-25.4290968,-49.27964679999999
14315,"rua d. geraldo micheletto pellanda, SÍTIO CERCADO, Curitiba",-25.5556638,-49.2622532
14316,"rua profa. antônia reginato vianna, CAPÃO DA IMBUIA, Curitiba",-25.4356983,-49.2093463
14317,"rua dr. jorge meyer filho, JARDIM BOTÂNICO, Curitiba",-25.4434107,-49.2432217
14318,"rua pr. antônio polito, ALTO BOQUEIRÃO, Curitiba",-25.5235994,-49.2330774
14319,"rua pr. carlos frank, BOQUEIRÃO, Curitiba",-25.4808762,-49.3044253
14320,"rua david tows, BOQUEIRÃO, Curitiba",-25.5311926,-49.2588674
14321,"rua paulo vilimavicius, TATUQUARA, Curitiba",-25.5572666,-49.3178937
14322,"rua antônio augusto de brito, UMBARÁ, Curitiba",-25.5565737,-49.2799409
14323,"rua gov. jorge lacerda, GUABIROTUBA, Curitiba",-25.4590425,-49.24757289999999
14324,"rua antônio claudino, PINHEIRINHO, Curitiba",-25.5288546,-49.2962778
14325,"rua francisco ritzmann, CAMPO DE SANTANA, Curitiba",-25.5922269,-49.3455109
14326,"rua não informado, ALTO BOQUEIRÃO, Curitiba",-25.4808762,-49.3044253
14327,"rua rua luiz valenza, CIDADE INDUSTRIAL, Curitiba",-25.4925508,-49.3326716
14328,"rua josé casagrande, VISTA ALEGRE, Curitiba",-25.4101455,-49.3037284
14329,"rua br-476, NOVO MUNDO, Curitiba",-25.4976888,-49.2774632
14330,"rua carteiro luciano ramos de oliveira, COLOMBO, Curitiba",-25.3895412,-49.1745812
14331,"rua alexandre kaminski, TATUQUARA, Curitiba",-25.4808762,-49.3044253
14332,"rua prof. arthur virmond de lacerda, SÃO MIGUEL, Curitiba",-25.4928923,-49.3552734
14333,"rua pacífico guimarães teixeira filho, UBERABA, Curitiba",-25.4798149,-49.2364437
14334,"rua otto cabél, NOVO MUNDO, Curitiba",-25.4921938,-49.2929835
14335,"rua juruaçú, SÃO BRAZ, Curitiba",-25.4152498,-49.34349109999999
14336,"rua pres. wenceslau braz, FAZENDINHA, Curitiba",-25.4808762,-49.3044253
14337,"rua jose vieira, CAMPO DE SANTANA, Curitiba",-25.5815472,-49.3211412
14338,"rua prof. nilo brandão, SÃO LOURENÇO, Curitiba",-25.3888899,-49.2644066
14339,"rua renê descartes, ABRANCHES, Curitiba",-25.3688028,-49.2677868
14340,"rua joão bom, CENTRO CÍVICO, Curitiba",-25.4080435,-49.2680929
14341,"rua regis bittencourt, FANNY, Curitiba",-25.4813871,-49.2638798
14342,"rua tv. santo antônio, CAMPO DE SANTANA, Curitiba",-25.4808762,-49.3044253
14343,"rua travessa santo antonio, TATUQUARA, Curitiba",-25.5647384,-49.3282697
14344,"rua des. vatél gonçalves pereira, SÍTIO CERCADO, Curitiba",-25.5363153,-49.2534729
14345,"rua treze de maio, ÁGUA VERDE, Curitiba",-25.4268053,-49.2717861
14346,"rua cel. joão guilherme guimarães, BOM RETIRO, Curitiba",-25.4101487,-49.2817842
14347,"rua ten. cel. benjamin lage, UBERABA, Curitiba",-25.4985509,-49.2185304
14348,"rua brig. eduardo gomes, PINHEIRINHO, Curitiba",-25.5194927,-49.28614109999999
14349,"rua pe. gaston, CIDADE INDUSTRIAL, Curitiba",-25.5138176,-49.3230955
14350,"rua silveira peixoto, BATEL, Curitiba",-25.4452933,-49.2852469
14351,"rua araújo porto alegre, GUABIROTUBA, Curitiba",-25.4571744,-49.247217
14352,"rua filós. huberto rohden, SÍTIO CERCADO, Curitiba",-25.5406027,-49.2737719
14353,"rua eng. ostoja roguski, JARDIM BOTÂNICO, Curitiba",-25.4416234,-49.2411384
14354,"rua omar raymundo picheth, PINHEIRINHO, Curitiba",-25.5096373,-49.277927
14355,"rua joão candido de oliveira junior, CIDADE INDUSTRIAL, Curitiba",-25.461198,-49.3518434
14356,"rua jardim botânico francisca maria garfunkel rischbieter, CAJURU, Curitiba",-25.4413645,-49.2486019
14357,"rua prof. ângelo antônio dallegrave, SANTO INÁCIO, Curitiba",-25.4266984,-49.3436289
14358,"rua getulio pires de arruda, CIDADE INDUSTRIAL, Curitiba",-25.5125248,-49.3343161
14359,"rua gen. carneiro, CENTRO, Curitiba",-25.4287147,-49.2603764
14360,"rua eugênio geraldo zeglin, TATUQUARA, Curitiba",-25.5692347,-49.3291528
14362,"rua mto. carlos frank, BOQUEIRÃO, Curitiba",-25.5200534,-49.2353157
14363,"rua pres. rodrigo otávio, HUGO LANGE, Curitiba",-25.4158218,-49.2436119
14364,"rua visconde de guarapuava, BIGORRILHO, Curitiba",-25.3907214,-51.4628097
14365,"rua rua 14, TATUQUARA, Curitiba",-25.5647384,-49.3282697
14366,"rua pres. kennedy, PORTÃO, Curitiba",-25.4289541,-49.267137
14367,"rua cel. vergínio leinig de mello, ABRANCHES, Curitiba",-25.3651248,-49.2751635
14368,"rua pe. francisco chylaszek, CIDADE INDUSTRIAL, Curitiba",-25.4353749,-49.3551783
14369,"rua reinaldo de carvalho - bola, GANCHINHO, Curitiba",-25.5564456,-49.2498556
14370,"rua joão emidio nogueira, TINGUI, Curitiba",-25.3835274,-49.2200555
14371,"rua dr. joão fleury da rocha, SÍTIO CERCADO, Curitiba",-25.5428066,-49.2671381
14372,"rua inácio lustosa, CENTRO, Curitiba",-25.4233618,-49.2757957
14373,"rua professor dr duilio anibal calderari, HUGO LANGE, Curitiba",-25.4224646,-49.2436835
14374,"rua professor alberto piekarz, CAJURU, Curitiba",-25.3337586,-49.2530036
14375,"rua santo túlio, SANTA FELICIDADE, Curitiba",-25.40513,-49.335538
14376,"rua mario marcondes lobo, UBERABA, Curitiba",-25.4982885,-49.2052421
14377,"rua são pio x, JUVEVÊ, Curitiba",-25.4095791,-49.2634982
14378,"rua edgar moutinho zandoná, CIDADE INDUSTRIAL, Curitiba",-25.4855977,-49.3434377
14379,"rua jorn. aramis milarch, TATUQUARA, Curitiba",-25.5669953,-49.3341009
14380,"rua pe. jacinto miensopust, CIDADE INDUSTRIAL, Curitiba",-25.4385711,-49.3568582
14381,"rua manoel guidolin, PILARZINHO, Curitiba",-25.3806431,-49.2998219
14382,"rua estr. delegado bruno de almeida, CAXIMBA, Curitiba",-25.6031512,-49.32605359999999
14383,"rua dr. aluízio frança, BIGORRILHO, Curitiba",-25.4257043,-49.3062225
14384,"rua desembargador lauro lima lopes, UMBARÁ, Curitiba",-25.5514026,-49.2469629
14385,"rua curitiba ponta grossa br-277, SÃO BRAZ, Curitiba",-25.4189771,-49.34834739999999
14386,"rua santa rita, BOQUEIRÃO, Curitiba",-25.4808762,-49.3044253
14387,"rua joão bettega, CIDADE INDUSTRIAL, Curitiba",-25.4913046,-49.3224021
14388,"rua pref. lothário meissner, GUABIROTUBA, Curitiba",-25.4440623,-49.2375015
14389,"rua jose da luz, PINHEIRINHO, Curitiba",-25.5198383,-49.2840616
14390,"rua marino pereira junior, ATUBA, Curitiba",-25.3799963,-49.19672629999999
14391,"rua clóvis edilberto d assumpção, BOA VISTA, Curitiba",-25.408955,-49.2472366
14392,"rua cleberson, CAJURU, Curitiba",-25.4601547,-49.2132111
14393,"rua dr joaquim meneleu de almeida torres, ALTO BOQUEIRÃO, Curitiba",-25.5317642,-49.2421568
14394,"rua pe. anchieta, MERCÊS, Curitiba",-25.4283594,-49.2876293
14395,"rua angela costa bazzo, PILARZINHO, Curitiba",-25.3859325,-49.283458
14396,"rua álvaro bello sovinski, XAXIM, Curitiba",-25.4991698,-49.25965420000001
14397,"rua bittencourt, ALTO DA GLÓRIA, Curitiba",-25.4808762,-49.3044253
14398,"rua amaury lange silvério, PILARZINHO, Curitiba",-25.3902514,-49.2837433
14399,"rua presidente getúlio vargas, CRISTO REI, Curitiba",-27.0416321,-49.6213852
14400,"rua pe. anchieta, SANTA FELICIDADE, Curitiba",-25.4318071,-49.2959336
14401,"rua br. do serro azul, CENTRO, Curitiba",-25.4267186,-49.2707073
14402,"rua vereador jose maria de azevedo, ALTO BOQUEIRÃO, Curitiba",-25.532965,-49.22977059999999
14403,"rua julieta abrão sado, UBERABA, Curitiba",-25.4926051,-49.20408579999999
14404,"rua delegado armando josé azevedo lobo, PINHEIRINHO, Curitiba",-25.5320662,-49.2792429
14405,"rua cel. zacarias, PRADO VELHO, Curitiba",-25.4480629,-49.2569001
14406,"rua thirso del corso, CAMPO DE SANTANA, Curitiba",-25.5921458,-49.3222389
14407,"rua rua padre estanislau trzebiatowski, ALTO BOQUEIRÃO, Curitiba",-25.5210315,-49.2334323
14408,"rua ver. adeodato volpi, CAPÃO RASO, Curitiba",-25.4969005,-49.2923249
14409,"rua cel joão maria sobrinho, VISTA ALEGRE, Curitiba",-25.4014639,-49.29462969999999
14410,"rua padre natal pigato, SANTA FELICIDADE, Curitiba",-25.4020501,-49.33345629999999
14411,"rua nicolanor soares, CAPÃO RASO, Curitiba",-25.4943222,-49.3015075
14412,"rua cel. francisco heráclito dos santos, UBERABA, Curitiba",-25.4604724,-49.2334124
14413,"rua pe. antônio, ALTO DA GLÓRIA, Curitiba",-25.423079,-49.2652593
14414,"rua dep. pinheiro júnior, UMBARÁ, Curitiba",-25.5599711,-49.2837695
14415,"rua mal. rondon, CAPÃO RASO, Curitiba",-25.511165,-49.300933
14416,"rua joão de deus flores de paula, CAJURU, Curitiba",-25.4667878,-49.1903759
14417,"rua rio iguaçú, CENTRO CÍVICO, Curitiba",-25.4174893,-49.2687071
14418,"rua prof. pedro viriato parigot de souza, MOSSUNGUÊ, Curitiba",-25.4358787,-49.3265474
14419,"rua 1º de maio, PINHEIRINHO, Curitiba",-25.527816,-49.29186550000001
14420,"rua francisco braga, GUABIROTUBA, Curitiba",-25.4548518,-49.2432828
14421,"rua benedito siqueira branco, ALTO BOQUEIRÃO, Curitiba",-25.53427,-49.240236
14422,"rua josé picussa, AUGUSTA, Curitiba",-25.4738619,-49.3612131
14423,"rua oséas lazzari stoterau, SÍTIO CERCADO, Curitiba",-25.5360912,-49.278499
14424,"rua frei fabiano de cristo, JARDIM DAS AMÉRICAS, Curitiba",-25.4551294,-49.2330963
14425,"rua falcão, PINHEIRINHO, Curitiba",-25.5279268,-49.2738548
14426,"rua mons. celso, CENTRO, Curitiba",-25.4317002,-49.2704132
14427,"rua carlos eichhorn, CAJURU, Curitiba",-25.4647205,-49.197796
14428,"rua br cento e dezesseis, GUABIROTUBA, Curitiba",-25.4808762,-49.3044253
14429,"rua maria do carmo do amaral silva, PINHEIRINHO, Curitiba",-25.5199987,-49.2845021
14430,"rua josé sella, UMBARÁ, Curitiba",-25.5561898,-49.2753184
14431,"rua maria a zaramella grande, SANTA FELICIDADE, Curitiba",-25.3985138,-49.3335294
14432,"rua luigi scroccaro, UMBARÁ, Curitiba",-25.5621175,-49.2714189
14433,"rua roberto simonsen, GUABIROTUBA, Curitiba",-25.4575383,-49.2413397
14434,"rua pres. arthur da silva bernardes, SANTA QUITÉRIA, Curitiba",-25.4593389,-49.3025083
14435,"rua dr. bley zornig, BOQUEIRÃO, Curitiba",-25.5131678,-49.22919539999999
14436,"rua santa candida, TINGUI, Curitiba",-25.3695412,-49.2164026
14437,"rua aguinardo augustinho, CAMPO DE SANTANA, Curitiba",-25.5999918,-49.3310131
14438,"rua albino homann, SÃO BRAZ, Curitiba",-25.4200661,-49.3582596
14439,"rua antônio lino deconto, SÍTIO CERCADO, Curitiba",-25.5406817,-49.2654857
14440,"rua dr. benedicto siqueira branco, ALTO BOQUEIRÃO, Curitiba",-25.53427,-49.240236
14441,"rua br-116 - régis bittencourt, TATUQUARA, Curitiba",-25.548466,-49.3040397
14442,"rua joão leopoldo jacomel, CAJURU, Curitiba",-25.4460268,-49.1373599
14443,"rua melquiades silveira do valle, SÃO JOÃO, Curitiba",-25.4289541,-49.267137
14444,"rua elisa ducke warkentin, BOQUEIRÃO, Curitiba",-25.5078622,-49.260307
14445,"rua levino schier, PORTÃO, Curitiba",-25.4764614,-49.2917564
14446,"rua nita hubel, PINHEIRINHO, Curitiba",-25.5283706,-49.2997078
14447,"rua brig. franco, MERCÊS, Curitiba",-25.426149,-49.2857615
14448,"rua dos sábias, NOVO MUNDO, Curitiba",-25.4890253,-49.2941253
14449,"rua antônio f do nascimentoado, SANTA CÂNDIDA, Curitiba",-25.3690362,-49.2364955
14450,"rua sarg. francisco da silva cotrin, TATUQUARA, Curitiba",-25.5598713,-49.3159715
14451,"rua ísis sanson monte serrat, TATUQUARA, Curitiba",-25.557004,-49.3220816
14452,"rua dom manuel da silveira d elboux, CAJURU, Curitiba",-25.4316659,-49.22576979999999
14453,"rua das indústrias, CAPÃO RASO, Curitiba",-25.5023923,-49.2974872
14454,"rua roberto osório de almeida, CIDADE INDUSTRIAL, Curitiba",-25.5550366,-49.3186915
14455,"rua joão de paula cordeiro filho, NOVO MUNDO, Curitiba",-25.4917533,-49.3111401
14456,"rua semen úniga, SANTA CÂNDIDA, Curitiba",-25.3748984,-49.2439413
14457,"rua cap. souza franco, BATEL, Curitiba",-25.4358271,-49.29049699999999
14458,"rua lourenço tuletzki, CAMPO COMPRIDO, Curitiba",-25.455939,-49.3239346
14459,"rua antonio carlos suplicy de lacerda, UBERABA, Curitiba",-25.483105,-49.1959061
14460,"rua cel. joaquim antônio de azevedo, SÍTIO CERCADO, Curitiba",-25.5394404,-49.24864940000001
14461,"rua br-277 - curitiba / ponta grossa, SANTO INÁCIO, Curitiba",-25.4303651,-49.3327772
14462,"rua joão sebastião, SANTO INÁCIO, Curitiba",-25.4256109,-49.3228971
14463,"rua pref. rosaldo gomes mello leitão, CENTRO CÍVICO, Curitiba",-25.4156656,-49.26636269999999
14464,"rua dr. pedro zavaski, PINHEIRINHO, Curitiba",-25.5216933,-49.2707975
14465,"rua praça osório, CENTRO, Curitiba",-25.4326878,-49.2762228
14466,"rua diva castellano girardi, GANCHINHO, Curitiba",-25.5612572,-49.25553559999999
14467,"rua joão antônio braga cortes, FAZENDINHA, Curitiba",-25.4873226,-49.3293223
14468,"rua cel. hoche pedra pires, VILA IZABEL, Curitiba",-25.4542407,-49.3016732
14469,"rua stefano triska, ABRANCHES, Curitiba",-25.3594615,-49.276233
14470,"rua cel. enéas, SÃO FRANCISCO, Curitiba",-25.4279758,-49.2721825
14471,"rua delegado ricardo taborda ribas, UMBARÁ, Curitiba",-25.5511788,-49.2461242
14472,"rua mal. anor teixeira dos santos, BOA VISTA, Curitiba",-25.3808053,-49.2450825
14473,"rua marcia regina pavanelo, CAJURU, Curitiba",-25.4717898,-49.1894673
14474,"rua rua arthur manoel iversen, ALTO BOQUEIRÃO, Curitiba",-25.5235563,-49.2349419
14475,"rua dino brassac, UBERABA, Curitiba",-25.4976579,-49.2037363
14476,"rua isolde teixeira domingues, CAJURU, Curitiba",-25.4469337,-49.1999027
14477,"rua carlota mion, CAMPINA DO SIQUEIRA, Curitiba",-25.4421595,-49.3146162
14478,"rua infante d. henrique, CAPÃO RASO, Curitiba",-25.4971618,-49.2788201
14479,"rua barigui, SÃO BRAZ, Curitiba",-25.4189771,-49.34834739999999
14480,"rua coronel jackson pitombo cavalcante, BAIRRO ALTO, Curitiba",-37.0340769,-73.1404838
14481,"rua harry blas gomm, SEMINÁRIO, Curitiba",-25.4521419,-49.3086572
14482,"rua papa joão xxiii, CENTRO CÍVICO, Curitiba",-25.417984,-49.2696243
14483,"rua pedro rodrigues de lima, PINHEIRINHO, Curitiba",-25.5336697,-49.2773522
14484,"rua monalisa stefani, CAJURU, Curitiba",-25.4992006,-49.2047968
