,Endereco,LATITUDE,LONGITUDE
2983,"rua padre joão kominek, CIDADE INDUSTRIAL, Curitiba",-25.4378357,-49.3581288
2984,"rua rodrigo de freitas, BACACHERI, Curitiba",-25.3916405,-49.22782970000001
2985,"rua santa bernadethe, FANNY, Curitiba",-25.4813307,-49.2739191
2986,"rua soledade regina sanzovo mourão, LAMENHA PEQUENA, Curitiba",-25.3725661,-49.34153560000001
2987,"rua jorge gava, PILARZINHO, Curitiba",-25.3872871,-49.2927827
2988,"rua adelmo arkanjo bissi, CACHOEIRA, Curitiba",-25.3585054,-49.265316
2989,"rua joão tokarski, CAMPO COMPRIDO, Curitiba",-25.4578347,-49.344305
2990,"rua do amapá, VISTA ALEGRE, Curitiba",-25.4117182,-49.2879839
2991,"rua marcílio dias, BAIRRO ALTO, Curitiba",-25.4077046,-49.201889
2992,"rua profa  ivette rocha krüger, CIDADE INDUSTRIAL, Curitiba",-25.5474171,-49.3418861
2993,"rua matias de albuquerque, FAZENDINHA, Curitiba",-25.4909385,-49.3292256
2994,"rua tibério gracco, BARREIRINHA, Curitiba",-25.3776661,-49.2559914
2995,"rua barra de santo anjo, XAXIM, Curitiba",-25.5064759,-49.26414949999999
2996,"rua david abrão, BIGORRILHO, Curitiba",-25.4299084,-49.3054604
2997,"rua  maestro carlos frank, BOQUEIRÃO, Curitiba",-25.5200534,-49.2353157
2998,"rua  logradouro não denominado, CAJURU, Curitiba",-25.4541704,-49.2141019
2999,"rua brasilio de lara, BAIRRO ALTO, Curitiba",-25.4303425,-49.20424449999999
3000,"rua  frederico stadler junior, CAJURU, Curitiba",-25.4382679,-49.2117277
3001,"rua poeta bernardo guimarães, TATUQUARA, Curitiba",-25.5695357,-49.3350774
3002,"rua melchiades silveira do valle, SANTA FELICIDADE, Curitiba",-25.3922624,-49.306422
3003,"rua  josé manoel voluz, PINHEIRINHO, Curitiba",-25.5302446,-49.2817079
3004,"rua laguna, TATUQUARA, Curitiba",-25.5657265,-49.32881
3005,"rua cuiaba, CAJURU, Curitiba",-25.4550742,-49.2112716
3006,"rua ana berta roskamp, JARDIM DAS AMÉRICAS, Curitiba",-25.4535698,-49.2274153
3007,"rua general carneiro, ALTO DA GLÓRIA, Curitiba",-25.4240219,-49.26272780000001
3008,"rua padre antonio, CENTRO, Curitiba",-25.423079,-49.2652593
3009,"rua arthur manoel iwersen, BOQUEIRÃO, Curitiba",-25.5201153,-49.236687
3010,"rua isaias ferreira da silva, CAJURU, Curitiba",-25.477367,-49.1953834
3011,"rua professor ulisses vieira, SANTA QUITÉRIA, Curitiba",-25.4622467,-49.3102413
3012,"rua francisco nowotarski, FAZENDINHA, Curitiba",-25.4772478,-49.3175761
3013,"rua da colonia augusta, CIDADE INDUSTRIAL, Curitiba",-25.4819917,-49.3694433
3014,"rua charles darwin, BARREIRINHA, Curitiba",-25.3652119,-49.2633451
3015,"rua  marechal floriano peixoto, ALTO BOQUEIRÃO, Curitiba",-25.5232533,-49.2268544
3016,"rua  professor plácido e silva, PAROLIN, Curitiba",-25.4664431,-49.2613636
3017,"rua joão gualberto, CENTRO, Curitiba",-25.4234113,-49.26794109999999
3018,"rua das paineiras, BARREIRINHA, Curitiba",-25.3742376,-49.252655
3019,"rua  formosa do oeste, CIDADE INDUSTRIAL, Curitiba",-25.475564,-49.34924720000001
3020,"rua carmelo greco junior, XAXIM, Curitiba",-25.5065178,-49.2710841
3021,"rua da colonia augusta, AUGUSTA, Curitiba",-25.4819351,-49.3693999
3022,"rua dos funcionários, CABRAL, Curitiba",-25.406527,-49.2517266
3023,"rua  benedito gomes dos reis, CAMPO DE SANTANA, Curitiba",-25.5752935,-49.3220592
3024,"rua sabino costa cristo, XAXIM, Curitiba",-25.5241902,-49.2629574
3025,"rua sofia dubiella, ABRANCHES, Curitiba",-25.3747182,-49.2701541
3026,"rua rodovia dos minérios, ABRANCHES, Curitiba",-25.3513793,-49.2810805
3027,"rua  presidente getúlio vargas, REBOUÇAS, Curitiba",-25.4434424,-49.2678912
3028,"rua senador corrêia, CENTRO, Curitiba",-25.4325354,-49.2649003
3029,"rua ladislau mikosz, CAJURU, Curitiba",-25.4683792,-49.19831929999999
3030,"rua wadisnaw mucharski, ABRANCHES, Curitiba",-25.3573893,-49.2728602
3031,"rua joão inocencio  paula, CIDADE INDUSTRIAL, Curitiba",-25.4347302,-49.3615415
3032,"rua  netuno, SÍTIO CERCADO, Curitiba",-25.5285432,-49.2593586
3033,"rua professor nuno de souza e silva, SANTO INÁCIO, Curitiba",-25.4286704,-49.3300674
3034,"rua brasília alves de faria de lara, BOQUEIRÃO, Curitiba",-25.4790429,-49.3487839
3035,"rua  josé tissi, ORLEANS, Curitiba",-25.4359992,-49.35024540000001
3036,"rua eliza ramos de proenca, CAJURU, Curitiba",-25.4537982,-49.2174147
3037,"rua presidente joao goulart, TATUQUARA, Curitiba",-25.5748825,-49.3293659
3038,"rua angélica negrello de conto, UMBARÁ, Curitiba",-25.5680838,-49.2867873
3039,"rua ni, CAJURU, Curitiba",-25.4601547,-49.2132111
3040,"rua berta klemtz, FAZENDINHA, Curitiba",-25.4842443,-49.325785
3041,"rua joão kinelski, CIDADE INDUSTRIAL, Curitiba",-25.4398018,-49.3593354
3042,"rua  tenente coronel benjamin lage, UBERABA, Curitiba",-25.4985509,-49.2185304
3043,"rua henry ford, FANNY, Curitiba",-25.4833853,-49.27074409999999
3044,"rua aristides teixeira, CENTRO CÍVICO, Curitiba",-25.418582,-49.2698743
3045,"rua silvestre kalenetz, TARUMÃ, Curitiba",-25.429985,-49.2337948
3046,"rua  sete de setembro, BATEL, Curitiba",-25.4452896,-49.2864364
3047,"rua joaquim ferreira bello, PINHEIRINHO, Curitiba",-25.5308215,-49.2906424
3048,"rua  padre anchieta, MERCÊS, Curitiba",-25.4283594,-49.2876293
3049,"rua  são miguel do oeste, CIDADE INDUSTRIAL, Curitiba",-25.4734555,-49.3426767
3050,"rua da ribeira br-476, ATUBA, Curitiba",-25.3880389,-49.2030323
3051,"rua  do rosário, SÃO FRANCISCO, Curitiba",-25.4284309,-49.2732123
3052,"rua joão rafael machado, CIDADE INDUSTRIAL, Curitiba",-25.4808762,-49.3044253
3053,"rua  doutor jorge meyer filho, JARDIM BOTÂNICO, Curitiba",-25.4434107,-49.2432217
3054,"rua joão versati, NOVO MUNDO, Curitiba",-25.4942828,-49.3020303
3055,"rua cordilina grosso, XAXIM, Curitiba",-25.5064759,-49.26414949999999
3056,"rua vicente alves padilha, UMBARÁ, Curitiba",-25.5604876,-49.2712241
3057,"rua antonio contin, CAJURU, Curitiba",-25.4531177,-49.2215427
3058,"rua aristides contador boeno, CIDADE INDUSTRIAL, Curitiba",-25.4762364,-49.33486809999999
3059,"rua elza lutman, UMBARÁ, Curitiba",-25.4808762,-49.3044253
3060,"rua tenente coronel benjamin lage, CAJURU, Curitiba",-25.4985509,-49.2185304
3061,"rua fausto pereira, CIDADE INDUSTRIAL, Curitiba",-25.5134264,-49.32188
3062,"rua dr. carlos franco ferreira da costa, SÍTIO CERCADO, Curitiba",-25.5501005,-49.2497264
3063,"rua joão antonio braga cortes, FAZENDINHA, Curitiba",-25.4873226,-49.3293223
3064,"rua professor manoel de oliveira franco sobrinho, CAJURU, Curitiba",-25.6002646,-49.3289536
3065,"rua doutor flavio luz, CABRAL, Curitiba",-25.4113932,-49.2555734
3066,"rua marcolina caetana chaves, SÍTIO CERCADO, Curitiba",-25.5441625,-49.2631144
3067,"rua marcolina caetana chaves, REBOUÇAS, Curitiba",-25.5441625,-49.2631144
3068,"rua são luiz, CABRAL, Curitiba",-25.4040143,-49.25311929999999
3069,"rua rotterdam, FAZENDINHA, Curitiba",-25.4797561,-49.3267929
3070,"rua barão de santo angelo, XAXIM, Curitiba",-25.5123051,-49.2774138
3071,"rua ana jorge de oliveira carvalho, ALTO BOQUEIRÃO, Curitiba",-25.5278539,-49.23918490000001
3072,"rua amaury lange silverio, PILARZINHO, Curitiba",-25.3902514,-49.2837433
3073,"rua monte carmelo, PINHEIRINHO, Curitiba",-25.5268373,-49.2698255
3074,"rua adelaide da silva de macedo, CIDADE INDUSTRIAL, Curitiba",-25.5144134,-49.3358023
3075,"rua alice vauthier de macedo, CIDADE INDUSTRIAL, Curitiba",-25.5108925,-49.3356163
3076,"rua antonia moliva bella, CIDADE INDUSTRIAL, Curitiba",-25.528565,-49.3339195
3077,"rua lizímaco serapião, CAJURU, Curitiba",-25.4865267,-49.291742
3078,"rua valdomiro ribeiro da fonseca, CAPÃO DA IMBUIA, Curitiba",-25.4383709,-49.212888
3079,"rua sinfrônio mesa neto, TATUQUARA, Curitiba",-25.5621105,-49.3383024
3080,"rua pedro rodrigues de lima, SÍTIO CERCADO, Curitiba",-25.53246,-49.27785000000001
3081,"rua josé alcides de lima, CAPÃO RASO, Curitiba",-25.5058016,-49.3063709
3082,"rua arthur pina, BOQUEIRÃO, Curitiba",-25.49585,-49.2436206
3083,"rua wenceslaw bras, GUAÍRA, Curitiba",-25.4706466,-49.2742891
3084,"rua cândido hartmann, MERCÊS, Curitiba",-25.4260736,-49.299645
3085,"rua josé lins do rego, BAIRRO ALTO, Curitiba",-25.4227202,-49.2040045
3086,"rua catuno da paixão cearense, CAJURU, Curitiba",-25.4652141,-49.2098022
3087,"rua monte sinai, PINHEIRINHO, Curitiba",-25.5272434,-49.27135819999999
3088,"rua humberto giraldi, CAJURU, Curitiba",-25.4487082,-49.2073507
3089,"rua das tangerinas, UBERABA, Curitiba",-25.484928,-49.2014699
3090,"rua inajá, UMBARÁ, Curitiba",-25.5410027,-49.2912732
3091,"rua joão kinelski, CAMPO COMPRIDO, Curitiba",-25.4398018,-49.3593354
3092,"rua francisco fido fontana, CIDADE INDUSTRIAL, Curitiba",-25.5081044,-49.3211763
3093,"rua airton duma, CAJURU, Curitiba",-25.5315247,-49.3382015
3094,"rua guaçúi, SÍTIO CERCADO, Curitiba",-25.5530521,-49.2502097
3095,"rua tito galvão filho, CIDADE INDUSTRIAL, Curitiba",-25.5091132,-49.3237001
3096,"rua belem, UBERABA, Curitiba",-25.4948079,-49.2258579
3097,"rua wesceslau bras, GUAÍRA, Curitiba",-25.4749753,-49.2736584
3098,"rua sezinando teixeira oliveira, SÍTIO CERCADO, Curitiba",-25.5568076,-49.2652265
3099,"rua waldemiro bley, CAPÃO RASO, Curitiba",-25.4955817,-49.2861118
3100,"rua padre rafael josé kalinowski, PINHEIRINHO, Curitiba",-25.5265276,-49.2759899
3101,"rua professor manoel de oliveira franco, CAJURU, Curitiba",-25.4698733,-49.1998533
3102,"rua sylseu pereira alves, PILARZINHO, Curitiba",-25.3942254,-49.2973736
3103,"rua joão waldir teixeira de faria, BOA VISTA, Curitiba",-25.3687991,-49.25777979999999
3104,"rua denizart pacheco de carvalho, FANNY, Curitiba",-25.4843621,-49.2758475
3105,"rua corbélia, SÍTIO CERCADO, Curitiba",-25.5370993,-49.2676936
3106,"rua manoel teixeira de andrade, PINHEIRINHO, Curitiba",-25.536124,-49.2935652
3107,"rua ataulfo alves, XAXIM, Curitiba",-25.5139819,-49.2731437
3108,"rua angelo pianaro, BUTIATUVINHA, Curitiba",-25.4014793,-49.3587746
3109,"rua mato grosso, ÁGUA VERDE, Curitiba",-25.4663222,-49.2841873
3110,"rua manoel felipe daher, ORLEANS, Curitiba",-25.4774848,-49.3171179
3111,"rua  colomba merlin, UMBARÁ, Curitiba",-25.5767629,-49.2711483
3112,"rua guaraniaçu, CIDADE INDUSTRIAL, Curitiba",-25.4727333,-49.34659449999999
3113,"rua miguel laudecir de oliveira, GANCHINHO, Curitiba",-25.557252,-49.2501792
3114,"rua joão correa, PINHEIRINHO, Curitiba",-25.5203481,-49.28638189999999
3115,"rua rodolpho senff junior, CAPÃO RASO, Curitiba",-25.4985517,-49.2895055
3116,"rua josé molenda, XAXIM, Curitiba",-25.5185066,-49.2718289
3117,"rua major couto pereira, CIDADE INDUSTRIAL, Curitiba",-25.4983467,-49.3154587
3118,"rua itacolomi, FAZENDINHA, Curitiba",-25.4796502,-49.3128432
3119,"rua maria gonçalves alexandre, CAJURU, Curitiba",-25.4549694,-49.2183145
3120,"rua  marechal floriano peixoto, PAROLIN, Curitiba",-25.460422,-49.257722
3121,"rua iapo, REBOUÇAS, Curitiba",-25.4482214,-49.2542554
3122,"rua professor nivaldo braga, CAJURU, Curitiba",-25.4383385,-49.2197079
3123,"rua padre giacomo cusmano, CAMPINA DO SIQUEIRA, Curitiba",-25.4366287,-49.3071211
3124,"rua ewerton leinig saporski, CAMPO DE SANTANA, Curitiba",-25.5909876,-49.3428253
3125,"rua padre josé lopacinski, ORLEANS, Curitiba",-25.4377609,-49.3551245
3126,"rua monte sião, PINHEIRINHO, Curitiba",-25.5263593,-49.2735633
3127,"rua benjamin lage, CAJURU, Curitiba",-25.4985509,-49.2185304
3128,"rua  pedro bonfim, BUTIATUVINHA, Curitiba",-25.3954645,-49.3592779
3129,"rua  santa catarina, GUAÍRA, Curitiba",-25.4674495,-49.2804779
3130,"rua alberto muller sobrinho, PORTÃO, Curitiba",-25.4729295,-49.3158775
3131,"rua joão faucz, PORTÃO, Curitiba",-25.4738942,-49.3041773
3132,"rua amado henrique pereira, GUABIROTUBA, Curitiba",-25.4717824,-49.2450019
3133,"rua gustavo rattman, BACACHERI, Curitiba",-25.4082731,-49.2227668
3134,"rua conselheiro araújo, CENTRO, Curitiba",-25.4257676,-49.2624855
3135,"rua padre cláudio arenal, UBERABA, Curitiba",-25.4840218,-49.1957978
3136,"rua alagoas, PORTÃO, Curitiba",-25.4749526,-49.28570269999999
3137,"rua  república guarani, ATUBA, Curitiba",-25.3825019,-49.1966326
3138,"rua ana alzira pereira, SÍTIO CERCADO, Curitiba",-25.5465222,-49.2584715
3139,"rua fortaleza, CAJURU, Curitiba",-25.4536718,-49.2067501
3140,"rua leonildo rigo, CIDADE INDUSTRIAL, Curitiba",-25.5395003,-49.33906640000001
3141,"rua  romeu bach, BOQUEIRÃO, Curitiba",-25.496989,-49.2279006
3142,"rua  josé veríssimo, BAIRRO ALTO, Curitiba",-25.4250933,-49.2060106
3143,"rua ruy christovam wachowicz, UMBARÁ, Curitiba",-25.560004,-49.283783
3144,"rua ignacio wacheski, UMBARÁ, Curitiba",-25.5695939,-49.2970886
3145,"rua padre leonardo nunes, ATUBA, Curitiba",-25.4699335,-49.3020643
3147,"rua brigadeiro franco, MERCÊS, Curitiba",-25.426149,-49.2857615
3148,"rua joão volpe, BUTIATUVINHA, Curitiba",-25.4012462,-49.3511953
3149,"rua doutor brasílio vicente de castro, CAMPO COMPRIDO, Curitiba",-25.439662,-49.33579510000001
3150,"rua lirio jacomel, SANTA CÂNDIDA, Curitiba",-25.3647523,-49.242657
3151,"rua colomba merlin, UMBARÁ, Curitiba",-25.5767629,-49.2711483
3152,"rua campina grande do sul, SÍTIO CERCADO, Curitiba",-25.536331,-49.2691046
3153,"rua joaquim augusto de andrade, JARDIM DAS AMÉRICAS, Curitiba",-25.4544619,-49.2408338
3154,"rua  eloy de assis fabris, NOVO MUNDO, Curitiba",-25.488419,-49.28143619999999
3155,"rua delaide benato bieda, CIDADE INDUSTRIAL, Curitiba",-25.5398752,-49.3412035
3156,"rua antonio chella, BOM RETIRO, Curitiba",-25.4069369,-49.2804969
3157,"rua josé morais, PILARZINHO, Curitiba",-25.3893307,-49.2841001
3158,"rua joão bonn, CENTRO CÍVICO, Curitiba",-25.4080435,-49.2680929
3159,"rua das codornas, NOVO MUNDO, Curitiba",-25.492276,-49.2833216
3160,"rua danilo pedro schreiner, ALTO BOQUEIRÃO, Curitiba",-25.534728,-49.24715610000001
3161,"rua paulo graeser sobrinho, MERCÊS, Curitiba",-25.4157316,-49.287886
3162,"rua  três corações, SANTA FELICIDADE, Curitiba",-25.3743527,-49.3281145
3163,"rua  darci vargas, CIDADE INDUSTRIAL, Curitiba",-25.4782662,-49.347528
3164,"rua  padre jacinto miensopust, CAMPO COMPRIDO, Curitiba",-25.4385711,-49.3568582
3165,"rua  antonio reinaldo zanon, CIDADE INDUSTRIAL, Curitiba",-25.4780424,-49.3362823
3166,"rua  henrique mattioli, FAZENDINHA, Curitiba",-25.4843502,-49.3303822
3167,"rua canal belém, REBOUÇAS, Curitiba",-25.4854914,-49.2346413
3168,"rua  francisco nowotarski, FAZENDINHA, Curitiba",-25.4772478,-49.3175761
3169,"rua joão meneghetti, CIDADE INDUSTRIAL, Curitiba",-25.4922128,-49.3271099
3170,"rua  olivio jose rossetti, TATUQUARA, Curitiba",-25.5742849,-49.334855
3171,"rua rio bacacheri, BAIRRO ALTO, Curitiba",-25.4112352,-49.206914
3172,"rua escritor antônio de alcântara machado, SÍTIO CERCADO, Curitiba",-25.53783,-49.2597659
3173,"rua cabral, CABRAL, Curitiba",-25.3996711,-49.252789
3174,"rua paraguassu, JUVEVÊ, Curitiba",-25.4170966,-49.2551412
3175,"rua  professor benedito nicolau dos santos, CENTRO CÍVICO, Curitiba",-25.4137754,-49.2686
3176,"rua canal belém, CAMPO DE SANTANA, Curitiba",-25.4854914,-49.2346413
3177,"rua enette dubard, TATUQUARA, Curitiba",-25.5676444,-49.33917750000001
3178,"rua andre ferreira barbosa, CAPÃO RASO, Curitiba",-25.5117422,-49.2943223
3179,"rua silvia gomes mattos, BARREIRINHA, Curitiba",-25.3777373,-49.2602718
3180,"rua roberto bernert, CIDADE INDUSTRIAL, Curitiba",-25.4486528,-49.3617535
3181,"rua paulo maurício silveira costa, SÍTIO CERCADO, Curitiba",-25.553172,-49.2702405
3182,"rua almirante didio costa, JARDIM DAS AMÉRICAS, Curitiba",-25.4632013,-49.22571569999999
3183,"rua professor pedro viriato parigot de souza, CAMPO COMPRIDO, Curitiba",-25.4362161,-49.3316059
3184,"rua das gaivotas, NOVO MUNDO, Curitiba",-25.4916677,-49.2837746
3185,"rua gregório skora, CIDADE INDUSTRIAL, Curitiba",-25.4993525,-49.3397095
3186,"rua sinésio simões de oliveira, SÍTIO CERCADO, Curitiba",-25.5554079,-49.2566594
3187,"rua itupava, HUGO LANGE, Curitiba",-25.4229065,-49.24712
3188,"rua arábia, CAJURU, Curitiba",-25.4661276,-49.2023266
3189,"rua padre jose edmundo dilly, CAPÃO DA IMBUIA, Curitiba",-25.4341732,-49.2046851
3190,"rua dinarte pinto, CIDADE INDUSTRIAL, Curitiba",-25.5034394,-49.3211652
3191,"rua marechal mallet, JUVEVÊ, Curitiba",-25.4112667,-49.2616118
3192,"rua pedro spisla filho, SANTA CÂNDIDA, Curitiba",-25.371448,-49.2364038
3193,"rua paulina ader, NOVO MUNDO, Curitiba",-25.490748,-49.29824989999999
3194,"rua  gaspar carrilho júnior, VISTA ALEGRE, Curitiba",-25.4115062,-49.2869452
3195,"rua engenheiro antonio batista ribas, TARUMÃ, Curitiba",-25.4318827,-49.2238641
3196,"rua pedro driessen filho, CIDADE INDUSTRIAL, Curitiba",-25.4895654,-49.3500569
3197,"rua angelica erthal kucek, SÍTIO CERCADO, Curitiba",-25.5511556,-49.2659538
3198,"rua libero sant ana, XAXIM, Curitiba",33.7454725,-117.867653
3199,"rua rolando salin zappa mansur, BARREIRINHA, Curitiba",-25.3533844,-49.2663445
3200,"rua rubem berta, PINHEIRINHO, Curitiba",-25.517826,-49.30072269999999
3201,"rua atilio piotto, UBERABA, Curitiba",-25.4801241,-49.1993439
3202,"rua guilherme toniolo, BOA VISTA, Curitiba",-25.3783027,-49.2500592
3203,"rua alviro zarur, SÍTIO CERCADO, Curitiba",-25.5290417,-49.2673514
3204,"rua rua celina orso 1385, CAMPO DE SANTANA, Curitiba",-25.5809276,-49.3220544
3205,"rua afranio peixoto, FAZENDINHA, Curitiba",-25.491707,-49.327378
3206,"rua alberto heyn, UBERABA, Curitiba",-25.4935869,-49.2173538
3207,"rua pedro n pizzatto, BIGORRILHO, Curitiba",-25.4298101,-49.3042124
3208,"rua baldur magnus grubba, FAZENDINHA, Curitiba",-25.4868338,-49.3174419
3209,"rua coronel ottoni maciel, VILA IZABEL, Curitiba",-25.4556977,-49.2928734
3210,"rua joaquim simões, PINHEIRINHO, Curitiba",-25.5212176,-49.2971193
3211,"rua isolde torquato tillo, CAPÃO RASO, Curitiba",-25.5037455,-49.3057251
3212,"rua sérgio harris queirolo, NOVO MUNDO, Curitiba",-25.4858759,-49.2840885
3213,"rua desembargador joaquim ferreira guimarães, TATUQUARA, Curitiba",-25.5585569,-49.3272268
3214,"rua paulo stephano cavichiolo, UMBARÁ, Curitiba",-25.564857,-49.2867298
3215,"rua arsezio antonio scandelari, PILARZINHO, Curitiba",-25.3883536,-49.2807345
3216,"rua damasina bittencourt macedo, SANTA CÂNDIDA, Curitiba",-25.3738336,-49.243274
3217,"rua caja-manga, UBERABA, Curitiba",-25.4876821,-49.2118315
3218,"rua waldomiro daldigan, UBERABA, Curitiba",-25.4886091,-49.1964554
3219,"rua desembargador lauro fabricio de mello pinto, SÍTIO CERCADO, Curitiba",-25.5483029,-49.2553107
3220,"rua jacob wellner, VISTA ALEGRE, Curitiba",-25.4149858,-49.2958418
3221,"rua são thomaz de aquino, SEMINÁRIO, Curitiba",-25.4458305,-49.2981794
3222,"rua teodomiro furtado, XAXIM, Curitiba",-25.5109241,-49.2675535
3223,"rua jeronimo thadeo, ALTO BOQUEIRÃO, Curitiba",-25.5286417,-49.2523904
3224,"rua hassan mohamed raad, BARREIRINHA, Curitiba",-25.3690265,-49.2661536
3225,"rua romulo cesar alves, SANTA FELICIDADE, Curitiba",-25.3799866,-49.3319869
3226,"rua robert kennedy, TINGUI, Curitiba",-25.3858061,-49.2179463
3227,"rua izaac ferreira da cruz, UMBARÁ, Curitiba",-25.5361483,-49.2726933
3228,"rua ebraim sebastião de castro, SANTA CÂNDIDA, Curitiba",-25.3730554,-49.2429301
3229,"rua benedito j f da silva, CIDADE INDUSTRIAL, Curitiba",-25.5127995,-49.3279793
3230,"rua salin calisto, CACHOEIRA, Curitiba",-25.3515665,-49.2588735
3231,"rua  doutor homero ravedutti, ATUBA, Curitiba",-25.3827939,-49.1967672
3232,"rua  marechal floriano peixoto, PRADO VELHO, Curitiba",-25.4588465,-49.258356
3233,"rua jose mulaski gebert, TATUQUARA, Curitiba",-25.5573585,-49.340399
3234,"rua sebastiana cordeiro, CAMPO COMPRIDO, Curitiba",-25.4617647,-49.3450745
3235,"rua tenenete coronel benjamin lage, CAJURU, Curitiba",-25.4985509,-49.2185304
3236,"rua gago coutinho, BACACHERI, Curitiba",-25.3989273,-49.2417919
3237,"rua padre alberto chmielowski, PINHEIRINHO, Curitiba",-25.5198895,-49.2741814
3238,"rua sebastião fávaro, BARREIRINHA, Curitiba",-25.3755992,-49.2640539
3239,"rua deputado sinval martins araújo, SÍTIO CERCADO, Curitiba",-25.5528004,-49.2463029
3240,"rua tereza haisi lupinski, UBERABA, Curitiba",-25.4843212,-49.20343930000001
3241,"rua atilio vieira de moura, CIDADE INDUSTRIAL, Curitiba",-25.5073654,-49.335819
3242,"rua capitão virgílio d'oliveira mello, MERCÊS, Curitiba",-25.420649,-49.282779
3243,"rua hildebrando de araújo, JARDIM BOTÂNICO, Curitiba",-25.440668,-49.2464767
3244,"rua desembargador joão josé arruda júnior, SÍTIO CERCADO, Curitiba",-25.5504097,-49.264344
3245,"rua josé abentin, VISTA ALEGRE, Curitiba",-25.3994343,-49.3030747
3246,"rua amália ludwig dubard, CIDADE INDUSTRIAL, Curitiba",-25.4604591,-49.3427381
3247,"rua josé zaramella, BOA VISTA, Curitiba",-25.3822826,-49.2532098
3248,"rua leonel de moura brizola, TATUQUARA, Curitiba",-25.565976,-49.32599399999999
3249,"rua rogerio xavier rocha loures, PINHEIRINHO, Curitiba",-25.5322734,-49.2843902
3250,"rua angelo piotto, CAMPO COMPRIDO, Curitiba",-25.4405289,-49.3487155
3251,"rua  antonio de brito lopes, CIDADE INDUSTRIAL, Curitiba",-25.4348702,-49.3642676
3252,"rua br cento e dezesseis., CAJURU, Curitiba",-25.4524541,-49.2401754
3253,"rua joão gualberto, MERCÊS, Curitiba",-25.4171921,-49.2624259
3254,"rua maria etelvina antunes de sá, CIDADE INDUSTRIAL, Curitiba",-25.5472655,-49.3377911
3255,"rua antiga rua 11, PINHEIRINHO, Curitiba",-25.51383,-49.2955154
3256,"rua maria etelvina antunes de sa, CIDADE INDUSTRIAL, Curitiba",-25.5472655,-49.3377911
3257,"rua canal belém, CAJURU, Curitiba",-25.4854914,-49.2346413
3258,"rua joão antonio culpi, CAJURU, Curitiba",-25.5269858,-49.2951403
3259,"rua joão fassi casagrande, CAJURU, Curitiba",-25.4541345,-49.2109912
3260,"rua antonio folly primo, NOVO MUNDO, Curitiba",-25.411446,-49.3113603
3261,"rua primo lourenço tosin, NOVO MUNDO, Curitiba",-25.4907724,-49.30240999999999
3262,"rua demetrio romaniuk, BAIRRO ALTO, Curitiba",-25.4803716,-49.3136722
3263,"rua joão ortolani, SANTA CÂNDIDA, Curitiba",-25.3668553,-49.22954240000001
3264,"rua thereza mouro peinado, CIDADE INDUSTRIAL, Curitiba",-25.5105641,-49.3248228
3265,"rua  coronel francisco h dos santos, GUABIROTUBA, Curitiba",-25.4673309,-49.2349871
3266,"rua josé mário de oliveira, BACACHERI, Curitiba",-25.4146306,-49.2290403
3267,"rua albano reis, AHÚ, Curitiba",-25.4049851,-49.2688921
3268,"rua antonia mollina bello, CIDADE INDUSTRIAL, Curitiba",-25.528565,-49.3339195
3269,"rua rio japurá, ATUBA, Curitiba",-25.3938112,-49.2034425
3270,"rua eduardo pinto da rocha, UMBARÁ, Curitiba",-25.5647251,-49.2746122
3271,"rua  milton miramir visinoni, SÍTIO CERCADO, Curitiba",-25.5434341,-49.2502079
3272,"rua  júlio zandoná, ALTO BOQUEIRÃO, Curitiba",-25.520418,-49.2494921
3273,"rua araruna, PINHEIRINHO, Curitiba",-25.540025,-49.28950709999999
3274,"rua são mateus, PORTÃO, Curitiba",-25.477939,-49.2969249
3275,"rua cônego januário da cunha barbosa, UBERABA, Curitiba",-25.4687415,-49.2320326
3276,"rua bortolo pelanda, UMBARÁ, Curitiba",-25.5607164,-49.2933138
3277,"rua padre franscico chylavesk, CIDADE INDUSTRIAL, Curitiba",-25.4232972,-49.264737
3278,"rua jerônimo durski, CAMPINA DO SIQUEIRA, Curitiba",-25.4375138,-49.3032489
3279,"rua desembargador otávio do amaral, MERCÊS, Curitiba",-25.4239296,-49.2975621
3280,"rua luiz cardoso, CIDADE INDUSTRIAL, Curitiba",-25.4894522,-49.3359542
3281,"rua maracujas, UBERABA, Curitiba",-25.4753583,-49.2248505
3282,"rua sergipe, PAROLIN, Curitiba",-25.4702814,-49.27054949999999
3283,"rua júlio perneta, MERCÊS, Curitiba",-25.4179006,-49.287836
3284,"rua  zacarias mansur, SÃO BRAZ, Curitiba",-25.4141129,-49.3434868
3285,"rua coronel benedito tertuliano cordeiro, TINGUI, Curitiba",-25.3910945,-49.215354
3286,"rua otávio francisco dias, ÁGUA VERDE, Curitiba",-25.4548827,-49.2758455
3287,"rua alcebiades nunes guimarães, ATUBA, Curitiba",-25.3884664,-49.2097691
3288,"rua agostinho leão júnior, CENTRO, Curitiba",-25.4235158,-49.2642146
3289,"rua lavínia zanon, BACACHERI, Curitiba",-25.4010216,-49.2187497
3290,"rua major miguel balbino blasi, SÍTIO CERCADO, Curitiba",-25.5491728,-49.2601605
3291,"rua angela gabardo parolin, UMBARÁ, Curitiba",-25.5964682,-49.30299890000001
3292,"rua  genauro ferreira de almeida, SÃO BRAZ, Curitiba",-25.4179741,-49.3434971
3293,"rua inacio wolski, CIDADE INDUSTRIAL, Curitiba",-25.5499585,-49.3428021
3294,"rua velcy bolivar grando, UBERABA, Curitiba",-25.4977423,-49.20934159999999
3295,"rua joao batista scucato, ATUBA, Curitiba",-25.3840221,-49.2009531
3296,"rua jeremias lissa, VISTA ALEGRE, Curitiba",-25.4109961,-49.29058449999999
3297,"rua antonio pinto de jesus, CIDADE INDUSTRIAL, Curitiba",-25.4969785,-49.3241169
3298,"rua  rodrigo faiçal zeni, CIDADE INDUSTRIAL, Curitiba",-25.5067581,-49.3368783
3299,"rua melchiades silveira do valle, SÃO JOÃO, Curitiba",-25.3922624,-49.306422
3300,"rua  lázaro borssatto, ALTO BOQUEIRÃO, Curitiba",-25.5284405,-49.241477
3301,"rua rosa mehl, UBERABA, Curitiba",-25.4848452,-49.2205789
3302,"rua ioshka santa ana, CAMPO DE SANTANA, Curitiba",-25.5804989,-49.3196325
3303,"rua engenheiro roberto fischer, CIDADE INDUSTRIAL, Curitiba",-25.4704598,-49.3467638
3304,"rua vereador angelo burbello, CAMPO DE SANTANA, Curitiba",-25.5799365,-49.3090202
3305,"rua juvenal dos santos, CASCATINHA, Curitiba",-25.4081526,-49.30894
3306,"rua prefeito rosaldo gomes mello leitao, CENTRO CÍVICO, Curitiba",-25.4156656,-49.26636269999999
3307,"rua lúcia dechandt, BARREIRINHA, Curitiba",-25.3660905,-49.2655693
3308,"rua hilário moro, TINGUI, Curitiba",-25.3909582,-49.2113145
3309,"rua joão dembinski, CAMPO COMPRIDO, Curitiba",-25.4658433,-49.3448868
3310,"rua pandiá calógeras, CAJURU, Curitiba",-25.44332,-49.2180209
3311,"rua florianópolis, CAJURU, Curitiba",-25.4575262,-49.2078245
3312,"rua waldemar cavanha, CAMPO COMPRIDO, Curitiba",-25.4740917,-49.3293956
3313,"rua nunes machado, CENTRO, Curitiba",-25.4403879,-49.2741032
3314,"rua batista pessine, VISTA ALEGRE, Curitiba",-25.4115707,-49.301977
3315,"rua felin calixto, CACHOEIRA, Curitiba",-25.3515665,-49.2588735
