,Endereco,LATITUDE,LONGITUDE
1992,"rua professor octávio da silveira, ÁGUA VERDE, Curitiba",-25.4520004,-49.2930042
1993,"rua  emilio romani, CENTRO, Curitiba",-25.538067,-49.3281244
1994,"rua  fanny bertoldi, CAMPO DE SANTANA, Curitiba",-25.5929383,-49.3406642
1995,"rua antonio sarote, TATUQUARA, Curitiba",-25.5610784,-49.3141385
1996,"rua sebastião marcos luiz, CAJURU, Curitiba",-25.4616164,-49.2042023
1997,"rua martins fontes, FAZENDINHA, Curitiba",-25.4826197,-49.324462
1998,"rua hermínio nichele, SÍTIO CERCADO, Curitiba",-25.550454,-49.2893508
1999,"rua roberto plonka, SÍTIO CERCADO, Curitiba",-25.5487352,-49.2689485
2000,"rua  flávio dallegrave, BOA VISTA, Curitiba",-25.3911144,-49.2578213
2001,"rua br 116, TATUQUARA, Curitiba",-25.5692754,-49.3104259
2002,"rua orlando luis lamarca, CIDADE INDUSTRIAL, Curitiba",-25.5060611,-49.3238034
2003,"rua padre josé lopacinski, CAMPO COMPRIDO, Curitiba",-25.4377609,-49.3551245
2004,"rua desembargador manoel de lacerda pinto, BACACHERI, Curitiba",-25.3971167,-49.2200965
2005,"rua simão bolívar, HUGO LANGE, Curitiba",-25.420126,-49.24566100000001
2006,"rua joão diório, TATUQUARA, Curitiba",-25.5648736,-49.3307231
2007,"rua heinz pechner, CAMPO COMPRIDO, Curitiba",-25.4362438,-49.3607969
2008,"rua antonio simoes de oliveira, SÍTIO CERCADO, Curitiba",-25.5406817,-49.2654857
2009,"rua alberto otto, BARREIRINHA, Curitiba",-25.3557135,-49.2488201
2010,"rua miguel abrao, PORTÃO, Curitiba",-25.4787281,-49.3014928
2011,"rua dante honório, XAXIM, Curitiba",-25.5101048,-49.2705272
2012,"rua 25 de agosto, BOQUEIRÃO, Curitiba",-25.4970987,-49.2574629
2013,"rua victorio celli, CAJURU, Curitiba",-25.4690828,-49.19325689999999
2014,"rua irmãs paulinas, NOVO MUNDO, Curitiba",-25.4925303,-49.2912984
2015,"rua francisco alves, ALTO BOQUEIRÃO, Curitiba",-25.5388496,-49.2473529
2016,"rua  desembargador hugo simas, BOM RETIRO, Curitiba",-25.4100639,-49.2817742
2017,"rua  professora antonia reginato vianna, CAPÃO DA IMBUIA, Curitiba",-25.4356983,-49.2093463
2018,"rua professor jose farani mansur guerios, GUAÍRA, Curitiba",-25.4693863,-49.2633632
2019,"rua  rio iriri, BAIRRO ALTO, Curitiba",-25.4023983,-49.20436309999999
2020,"rua cezinando dias paredes, BOQUEIRÃO, Curitiba",-25.5060759,-49.2224587
2021,"rua adelino leal nunes, NOVO MUNDO, Curitiba",-25.4841385,-49.2861126
2022,"rua rutildo pulido, CAJURU, Curitiba",-25.465955,-49.1934936
2023,"rua itauna do sul, ALTO BOQUEIRÃO, Curitiba",-25.5310157,-49.2342043
2024,"rua cocos, CAJURU, Curitiba",-25.4758502,-49.2233798
2025,"rua edson campos matesich, SANTA FELICIDADE, Curitiba",-25.3804475,-49.3273733
2026,"rua estephano reva, SANTA FELICIDADE, Curitiba",-25.4169077,-49.3375859
2027,"rua coronel newton oliveira da silva, GANCHINHO, Curitiba",-25.5577683,-49.25016420000001
2028,"rua  engenheira enedina alves marques, CAJURU, Curitiba",-25.4511661,-49.2185231
2029,"rua jose ferreira de camargo, CIDADE INDUSTRIAL, Curitiba",-25.5034548,-49.3405858
2030,"rua muinicipio de floreta, CIDADE INDUSTRIAL, Curitiba",-25.4506781,-49.355733
2031,"rua benvinda camilo antunes, ALTO BOQUEIRÃO, Curitiba",-25.5331826,-49.2534757
2032,"rua doutor jonas salomão dequech, ALTO BOQUEIRÃO, Curitiba",-25.5308427,-49.2406659
2033,"rua professor milton vianna, SÍTIO CERCADO, Curitiba",-25.545511,-49.2548465
2034,"rua presbítero deusdete dos santos, CACHOEIRA, Curitiba",-25.3531748,-49.2582738
2035,"rua santa zita, GUAÍRA, Curitiba",-25.466558,-49.269773
2036,"rua do escriturário, BOQUEIRÃO, Curitiba",-25.5078066,-49.2201594
2037,"rua diva regnier barrozo, UMBARÁ, Curitiba",-25.5579434,-49.2788266
2038,"rua nelson de macedo justos, CAJURU, Curitiba",-25.4688755,-49.1905815
2039,"rua antonio vicente de andrade, CAMPO COMPRIDO, Curitiba",-25.4676901,-49.3277313
2040,"rua orlando destefani, SÃO BRAZ, Curitiba",-25.4221085,-49.3434831
2041,"rua côcos, UBERABA, Curitiba",-25.4758502,-49.2233798
2042,"rua doutor carlos de paula soares, MERCÊS, Curitiba",-25.4217245,-49.2973118
2043,"rua jundiai do sul, SÍTIO CERCADO, Curitiba",-25.5523319,-49.25132929999999
2044,"rua luiz bressan filho, PINHEIRINHO, Curitiba",-25.5207861,-49.28931559999999
2045,"rua wilson dacheux pereira, AUGUSTA, Curitiba",-25.5283523,-49.2439601
2046,"rua luiz leão, TARUMÃ, Curitiba",-25.4253925,-49.2659438
2047,"rua frederico müller, CAMPO COMPRIDO, Curitiba",-25.456936,-49.3223602
2048,"rua quitandinha, SÍTIO CERCADO, Curitiba",-25.5369396,-49.2749984
2049,"rua lourenço imoski, SÍTIO CERCADO, Curitiba",-25.5324067,-49.2756763
2050,"rua nelson borba, CIDADE INDUSTRIAL, Curitiba",-25.4976294,-49.3355129
2051,"rua joão stall, BUTIATUVINHA, Curitiba",-25.3946542,-49.35730660000001
2052,"rua barigui, CIDADE INDUSTRIAL, Curitiba",-25.5216388,-49.3489418
2053,"rua josé baggio, UMBARÁ, Curitiba",-25.4486425,-49.3265878
2054,"rua reinaldo sguarnnia, CAJURU, Curitiba",-25.4492541,-49.2250322
2055,"rua ricardo negrão filho, PORTÃO, Curitiba",-25.4743293,-49.3114129
2056,"rua  curitiba ponta grossa br-277, ORLEANS, Curitiba",-25.103103,-50.1537446
2057,"rua  alfredo bufren, CENTRO, Curitiba",-25.4286136,-49.2674689
2058,"rua  nestor victor, ÁGUA VERDE, Curitiba",-25.4556878,-49.2753666
2059,"rua da paz, CENTRO, Curitiba",-25.4324144,-49.2573167
2060,"rua joão kania, SANTA CÂNDIDA, Curitiba",-25.3694367,-49.2425519
2061,"rua bartolomeu lourenço de gusmão, HAUER, Curitiba",-25.4821973,-49.241566
2062,"rua méxico, JARDIM SOCIAL, Curitiba",-25.4124906,-49.23453629999999
2063,"rua ophir ruy woitowicz, SÍTIO CERCADO, Curitiba",-25.5456212,-49.2663303
2064,"rua alferes angelo sampaio, ÁGUA VERDE, Curitiba",-25.4466438,-49.2810448
2065,"rua inajá, TATUQUARA, Curitiba",-25.5410027,-49.2912732
2066,"rua  manoel valdomiro de macedo, CIDADE INDUSTRIAL, Curitiba",-25.5142532,-49.3182753
2067,"rua parque residencial fazendinha, FAZENDINHA, Curitiba",-25.4771521,-49.3246624
2068,"rua joão ivanoski, SÃO JOÃO, Curitiba",-25.3932751,-49.2145185
2069,"rua  doutor benedicto siqueira branco, ALTO BOQUEIRÃO, Curitiba",-25.53427,-49.240236
2070,"rua joão vendramin, SANTA FELICIDADE, Curitiba",-25.4091124,-49.3256282
2071,"rua valdomiro baldigan, UBERABA, Curitiba",-25.4886091,-49.1964554
2072,"rua arno emilio gerstenberger, PILARZINHO, Curitiba",-25.3938812,-49.3026804
2073,"rua nazareno collini, BARREIRINHA, Curitiba",-25.3667617,-49.2512531
2074,"rua  vereador elias karam, FAZENDINHA, Curitiba",-25.4802203,-49.3307648
2075,"rua  décio barreto, CIDADE INDUSTRIAL, Curitiba",-25.5034225,-49.3238777
2076,"rua marechal octávio saldanha mazza, CAPÃO RASO, Curitiba",-25.5085244,-49.2974064
2077,"rua  bittencourt, CENTRO, Curitiba",-25.3874489,-49.1986262
2078,"rua joão nogarolli, FANNY, Curitiba",-25.4778933,-49.2646719
2079,"rua  catulo da paixão cearense, CAJURU, Curitiba",-25.4649395,-49.2061748
2080,"rua capitão amin mosse, BOQUEIRÃO, Curitiba",-25.5315964,-49.25041
2081,"rua professor arnaldo alves de araújo, SEMINÁRIO, Curitiba",-25.4442916,-49.3142879
2082,"rua de santa cândida, SANTA CÂNDIDA, Curitiba",-25.3690362,-49.2364955
2083,"rua  celeste tortato gabardo, SÍTIO CERCADO, Curitiba",-25.5440645,-49.28107019999999
2084,"rua monteiro tourinho, TINGUI, Curitiba",-25.3871003,-49.2163273
2085,"rua  engenheiros rebouças, CENTRO, Curitiba",-25.4421531,-49.2602994
2086,"rua  jorge luis della coletta, CAJURU, Curitiba",-25.4415677,-49.2042947
2087,"rua cidade de missal, ATUBA, Curitiba",-25.383981,-49.1984235
2088,"rua centro de convivencia amigo curitibano, BOQUEIRÃO, Curitiba",-25.5002588,-49.23866
2089,"rua osmar rosa, CIDADE INDUSTRIAL, Curitiba",-25.4999403,-49.3151323
2090,"rua  antonio antoniacomi, SANTA CÂNDIDA, Curitiba",-25.366275,-49.2111096
2091,"rua eduardo carlos pereira, PORTÃO, Curitiba",-25.477864,-49.2894403
2092,"rua antonio antoniacomi, SANTA CÂNDIDA, Curitiba",-25.366275,-49.2111096
2093,"rua silva jardim, SEMINÁRIO, Curitiba",-25.4514593,-49.2987374
2094,"rua antonio muzzillo, TINGUI, Curitiba",-25.3893462,-49.2202013
2095,"rua francisco santiago soares, PORTÃO, Curitiba",-25.4725616,-49.3170092
2096,"rua arary souto, BACACHERI, Curitiba",-25.3854639,-49.2303468
2097,"rua  fortaleza, CAJURU, Curitiba",-25.4536718,-49.2067501
2098,"rua bejamin gelisnki, CAJURU, Curitiba",-25.4541704,-49.2141019
2099,"rua major inacio gomes da costa, UBERABA, Curitiba",-25.4765815,-49.2299055
2100,"rua angelo mazzarotto, SANTA FELICIDADE, Curitiba",-25.4013642,-49.34121150000001
2101,"rua rogerio de macedo postarek, TATUQUARA, Curitiba",-25.5739154,-49.32617630000001
2102,"rua da graça, TATUQUARA, Curitiba",-25.5012558,-49.3388587
2103,"rua nicolau bogdano bajaluk, CAMPO DE SANTANA, Curitiba",-25.5837173,-49.3404706
2104,"rua br 277   42000, SANTA FELICIDADE, Curitiba",-25.464294,-50.3480193
2105,"rua das indústrias, CIDADE INDUSTRIAL, Curitiba",-25.5016083,-49.3160812
2106,"rua professor nivaldo braga, CAPÃO DA IMBUIA, Curitiba",-25.4363978,-49.2186964
2107,"rua frederico peter, PINHEIRINHO, Curitiba",-25.5217755,-49.27476979999999
2108,"rua professor joão falarz, SANTA FELICIDADE, Curitiba",-25.4369346,-49.348369
2109,"rua josé correia tramujas, CIDADE INDUSTRIAL, Curitiba",-25.4720025,-49.33930470000001
2110,"rua paraná, TINGUI, Curitiba",-25.3804189,-49.2283799
2111,"rua coronel joão batista lopes, CACHOEIRA, Curitiba",-25.3533545,-49.25984649999999
2112,"rua professor benedito conceição, CAPÃO DA IMBUIA, Curitiba",-25.4391636,-49.2151856
2113,"rua travessa sebastiana cordeiro, CAMPO COMPRIDO, Curitiba",-25.4617647,-49.3450745
2114,"rua getulio silveira, CIDADE INDUSTRIAL, Curitiba",-25.4639709,-49.35362300000001
2115,"rua anton tchekov, CAPÃO RASO, Curitiba",-25.5023923,-49.2974872
2116,"rua joão batista rossato belinazo, SANTA FELICIDADE, Curitiba",-25.441266,-49.3592631
2117,"rua diamante do norte, CIDADE INDUSTRIAL, Curitiba",-25.4851443,-49.3445469
2118,"rua padre joão rzemelka, CIDADE INDUSTRIAL, Curitiba",-25.4401438,-49.3578775
2119,"rua clara polsin, NOVO MUNDO, Curitiba",-25.4892201,-49.2855819
2120,"rua augusto hauer, PILARZINHO, Curitiba",-25.3901614,-49.2875021
2121,"rua joão batista dallarmi, SANTA FELICIDADE, Curitiba",-25.4218062,-49.3305879
2122,"rua padre francisco chylaszek, ORLEANS, Curitiba",-25.4353749,-49.3551783
2123,"rua doutor levy buquera, SÍTIO CERCADO, Curitiba",-25.5307277,-49.2677738
2124,"rua  engenheiro benedito mario da silva, CAJURU, Curitiba",-25.4695338,-49.20579009999999
2125,"rua odete laura foggiato, ATUBA, Curitiba",-25.3831122,-49.2094889
2126,"rua doutor manoel linhares de lacerda, CAPÃO RASO, Curitiba",-25.4991013,-49.291912
2127,"rua piraí do sul, AUGUSTA, Curitiba",-25.4558311,-49.3784713
2128,"rua  josé bassa, SÍTIO CERCADO, Curitiba",-25.5454647,-49.2580606
2129,"rua butiá, UBERABA, Curitiba",-25.4893275,-49.213316
2130,"rua prof lycio grein de castro vellozo, MERCÊS, Curitiba",-25.4242345,-49.29442479999999
2131,"rua  cidade de laguna, FAZENDINHA, Curitiba",-25.4778676,-49.33740659999999
2132,"rua lodovico kaminski, AUGUSTA, Curitiba",-25.4708016,-49.3615259
2133,"rua ana pietrobelli, UBERABA, Curitiba",-25.4819644,-49.2042358
2134,"rua das olarias, ATUBA, Curitiba",-25.3745669,-49.2126533
2135,"rua eduardo pinto da rocha, SÍTIO CERCADO, Curitiba",-25.557006,-49.2545362
2136,"rua da república, GUAÍRA, Curitiba",-25.4726695,-49.2743034
2137,"rua presidente arthur da silva bernardes, VILA IZABEL, Curitiba",-25.457862,-49.3025579
2138,"rua mobral, SANTA CÂNDIDA, Curitiba",-25.3630723,-49.2306529
2139,"rua joao antonio braga cortes, FAZENDINHA, Curitiba",-25.4873226,-49.3293223
2140,"rua thomaz david borges, CAJURU, Curitiba",-25.4714658,-49.1980544
2141,"rua euclides da cunha, BIGORRILHO, Curitiba",-25.4349225,-49.2978588
2142,"rua jornalista josé pedro dos santos-pedrinho, GANCHINHO, Curitiba",-25.5527441,-49.2471852
2143,"rua rau popmpeia, FAZENDINHA, Curitiba",-25.4780946,-49.325892
2144,"rua ministro josé linhares, BAIRRO ALTO, Curitiba",-25.4155648,-49.2126479
2145,"rua luiz machuca, ALTO BOQUEIRÃO, Curitiba",-25.5340354,-49.2348535
2146,"rua santana do itarare, SÍTIO CERCADO, Curitiba",-25.5382307,-49.26010669999999
2147,"rua timoteo josé ferreira, BACACHERI, Curitiba",-25.3956157,-49.2150031
2148,"rua lamenha lins, REBOUÇAS, Curitiba",-25.4474006,-49.271994
2149,"rua rezala simão, SANTA QUITÉRIA, Curitiba",-25.4665579,-49.3159017
2150,"rua francisco kochinski, SÍTIO CERCADO, Curitiba",-25.5404763,-49.2529031
2151,"rua quadra, TATUQUARA, Curitiba",-25.5647384,-49.3282697
2152,"rua canal belem, UBERABA, Curitiba",-25.4923625,-49.2283881
2153,"rua hilda amaral visinoni, ALTO BOQUEIRÃO, Curitiba",-25.5442479,-49.2463553
2154,"rua presidente wenceslau braz, FANNY, Curitiba",-25.4749753,-49.2736584
2155,"rua santa joana d´arc, LINDÓIA, Curitiba",-25.479591,-49.27852050000001
2156,"rua nicarágua, BACACHERI, Curitiba",-25.3974459,-49.2360492
2157,"rua francisco tissot, PORTÃO, Curitiba",-25.4716649,-49.3168428
2158,"rua frei rogério, JARDIM DAS AMÉRICAS, Curitiba",-25.4522231,-49.2289675
2159,"rua cecília meireles, SÃO LOURENÇO, Curitiba",-25.3986743,-49.2698967
2160,"rua da glória, ALTO DA GLÓRIA, Curitiba",-25.4208533,-49.2676403
2161,"rua rua das conchas, CIDADE INDUSTRIAL, Curitiba",-25.5016556,-49.3406294
2162,"rua rezala simão, PORTÃO, Curitiba",-25.4682546,-49.3171547
2163,"rua general carneiro, CENTRO, Curitiba",-25.4287147,-49.2603764
2164,"rua rezala simao, SANTA QUITÉRIA, Curitiba",-25.4665579,-49.3159017
2165,"rua alberto sanchez paredes, CIDADE INDUSTRIAL, Curitiba",-25.4406477,-49.3601817
2166,"rua monte nebo, PINHEIRINHO, Curitiba",-25.527556,-49.2719035
2167,"rua coronel dulcídio, ÁGUA VERDE, Curitiba",-25.4476466,-49.2789041
2168,"rua diogo diroko  gastão aihabe, UBERABA, Curitiba",-25.4858632,-49.2193668
2169,"rua prefeito omar sabbag, JARDIM BOTÂNICO, Curitiba",-25.439492,-49.2498252
2170,"rua joão ponciano borges, CAJURU, Curitiba",-25.4397204,-49.2105121
2171,"rua  ewerton leinig saporski, TATUQUARA, Curitiba",-25.5909876,-49.3428253
2172,"rua  iguaçú, REBOUÇAS, Curitiba",-25.4423319,-49.2695849
2173,"rua zoraide mandele, CAJURU, Curitiba",-25.4419996,-49.2013028
2174,"rua calisto cumin, SANTA FELICIDADE, Curitiba",-25.4046042,-49.3329974
2175,"rua ovídio garcez, CACHOEIRA, Curitiba",-25.3510842,-49.2597503
2176,"rua josé chimanski, UMBARÁ, Curitiba",-25.554951,-49.2820394
2177,"rua rua zorade mandelli, CAPÃO DA IMBUIA, Curitiba",-25.4419996,-49.2013028
2178,"rua nelson rieke, CIDADE INDUSTRIAL, Curitiba",-25.5008281,-49.3445748
2179,"rua jair coelho, CIDADE INDUSTRIAL, Curitiba",-25.493874,-49.3489752
2180,"rua  sargento francisco da silva cotrin, TATUQUARA, Curitiba",-25.5598713,-49.3159715
2181,"rua sete de setembro, SEMINÁRIO, Curitiba",-25.4401856,-49.273565
2182,"rua reinaldo casagrande, SANTO INÁCIO, Curitiba",-25.42671,-49.319828
2183,"rua alferes poli, REBOUÇAS, Curitiba",-25.4468914,-49.268576
2184,"rua fabio fanuchi, SANTA CÂNDIDA, Curitiba",-25.3690193,-49.2194485
2185,"rua nelson thomaz, SANTA FELICIDADE, Curitiba",-25.4131943,-49.3556721
2186,"rua rio japurá, BAIRRO ALTO, Curitiba",-25.400467,-49.2003149
2187,"rua deputado pinheiro junior, UMBARÁ, Curitiba",-25.5599711,-49.2837695
2188,"rua iguaçú, VILA IZABEL, Curitiba",-25.4527205,-49.2975558
2189,"rua professor assis goncalves, ÁGUA VERDE, Curitiba",-25.4602151,-49.2837468
2190,"rua marechal hermes, ALTO DA GLÓRIA, Curitiba",-25.4171738,-49.2655962
2191,"rua imaculada conceicao, PRADO VELHO, Curitiba",-25.45156,-49.252883
2192,"rua professor elysio viana, ALTO DA RUA XV, Curitiba",-25.4303161,-49.2373572
2193,"rua osório dos santos pacheco, CAPÃO RASO, Curitiba",-25.5012545,-49.2860865
2194,"rua padre estanislau trzebiatowski, ALTO BOQUEIRÃO, Curitiba",-25.5210315,-49.2334323
2195,"rua alcir martins bastos, FAZENDINHA, Curitiba",-25.484787,-49.3242205
2196,"rua et teófilo otoni, CAJURU, Curitiba",-25.4564925,-49.2107885
2197,"rua arapoti, SÍTIO CERCADO, Curitiba",-25.5403308,-49.279339
2198,"rua maria lúcia locher de athayde, CIDADE INDUSTRIAL, Curitiba",-25.4928822,-49.3528982
2199,"rua casemiro paulo gabardo, CIDADE INDUSTRIAL, Curitiba",-25.5155088,-49.3337551
2200,"rua oscar schrappe senior, CAPÃO DA IMBUIA, Curitiba",-25.4353194,-49.2051781
2201,"rua theodoro gbur, TINGUI, Curitiba",-25.3898993,-49.2193558
2202,"rua manoel borba gato, BARREIRINHA, Curitiba",-25.3703423,-49.2643307
2203,"rua maria falat, BOA VISTA, Curitiba",-25.3562369,-49.2765673
2204,"rua francisco de almeida filho, CIDADE INDUSTRIAL, Curitiba",-25.4584581,-49.35639
2205,"rua lourenço volpi, SANTA CÂNDIDA, Curitiba",-25.3732468,-49.2414796
2206,"rua regina vanhoni, PRADO VELHO, Curitiba",-25.5023397,-49.2898424
2207,"rua jerônimo de souza sobrinho, CIDADE INDUSTRIAL, Curitiba",-25.5123314,-49.336751
2208,"rua osires paixão gonçalves, SANTA FELICIDADE, Curitiba",-25.3782279,-49.3318951
2209,"rua desembargador francisco de paula xavier filho, SÍTIO CERCADO, Curitiba",-25.5427276,-49.26360769999999
2210,"rua maximiliano boscardin, FAZENDINHA, Curitiba",-25.4882629,-49.327564
2211,"rua leopoldo de lazari, FAZENDINHA, Curitiba",-25.4767133,-49.3336794
2212,"rua flávio dallegrave, BARREIRINHA, Curitiba",-25.3722606,-49.2636662
2213,"rua eulivio pastre, SÍTIO CERCADO, Curitiba",-25.5405294,-49.2503491
2214,"rua masao ishii, UBERABA, Curitiba",-25.4723964,-49.2182099
2215,"rua coronel domingos soares, BAIRRO ALTO, Curitiba",-25.421922,-49.2069845
2216,"rua abel da silva almeida, VILA IZABEL, Curitiba",-25.4557835,-49.3023827
2217,"rua anibio gonçalves de souza, CIDADE INDUSTRIAL, Curitiba",-25.4994512,-49.343805
2218,"rua paulo mader bittencourt, ABRANCHES, Curitiba",-25.3795754,-49.2713615
2219,"rua cristiano strobel, XAXIM, Curitiba",-25.5065039,-49.2549992
2220,"rua professor álvaro jorge, ALTO BOQUEIRÃO, Curitiba",-25.4576678,-49.2953044
2221,"rua tenente coronel vilagran cabrita, ALTO BOQUEIRÃO, Curitiba",-25.5231101,-49.2337912
2222,"rua benedicto berillo fangueiro, UBERABA, Curitiba",-25.4711836,-49.2231534
2223,"rua  francisco schaffer, VISTA ALEGRE, Curitiba",-25.4072825,-49.2860288
2224,"rua raul kuhn, CACHOEIRA, Curitiba",-25.3524329,-49.2577864
2225,"rua agostinho zaninelli, BOA VISTA, Curitiba",-25.3797113,-49.2539458
2226,"rua  ayrton pizzatto gusi, XAXIM, Curitiba",-25.5254615,-49.2594763
2227,"rua br 376, CAJURU, Curitiba",-25.4319537,-49.3647624
2228,"rua senador salgado filho, CAJURU, Curitiba",-25.4798779,-49.22502919999999
2229,"rua engenheiros rebouças, ÁGUA VERDE, Curitiba",-25.4463681,-49.2712688
2230,"rua petit carneiro, ÁGUA VERDE, Curitiba",-25.4513108,-49.2842511
2231,"rua nilo pecanha, SÃO FRANCISCO, Curitiba",-25.4182127,-49.27454059999999
2232,"rua carneiro lobo, ÁGUA VERDE, Curitiba",-25.4479636,-49.2897454
2233,"rua sesinando chaves, CAJURU, Curitiba",-25.4459372,-49.224799
2234,"rua são pio x, AHÚ, Curitiba",-25.4066127,-49.26162919999999
2235,"rua 24 de maio, REBOUÇAS, Curitiba",-25.4472437,-49.2694845
2236,"rua  engenheira enedina alves marques, GUABIROTUBA, Curitiba",-25.4511661,-49.2185231
2237,"rua cyrillo merlin, NOVO MUNDO, Curitiba",-25.4826938,-49.2847426
2238,"rua benjamin gelinski, CAJURU, Curitiba",-25.4855107,-49.1932546
2239,"rua romeu pereira de godoy, UMBARÁ, Curitiba",-25.5584428,-49.2764062
2240,"rua doutor roberto barrozo, BIGORRILHO, Curitiba",-25.4165604,-49.2789331
2241,"rua  joão gualberto, CENTRO CÍVICO, Curitiba",-25.4219494,-49.2665057
2242,"rua  joão gualberto, JUVEVÊ, Curitiba",-25.4162381,-49.2615263
2243,"rua luiz burda, TATUQUARA, Curitiba",-25.563925,-49.3125916
2244,"rua soldado josé bueno da silva, ALTO BOQUEIRÃO, Curitiba",-25.5309088,-49.253988
2245,"rua romeu pereira de souza, UMBARÁ, Curitiba",-25.5584428,-49.2764062
2246,"rua josephina demeterco, SANTA FELICIDADE, Curitiba",-25.4402379,-49.35406589999999
2247,"rua joaquim nabuco, TINGUI, Curitiba",-25.3845345,-49.2247488
2248,"rua plinio matos pessoa, AUGUSTA, Curitiba",33.4734978,-82.0105148
2249,"rua da república, XAXIM, Curitiba",-25.5064759,-49.26414949999999
2250,"rua adib joão sallum, PINHEIRINHO, Curitiba",-25.5243485,-49.2744449
2251,"rua marquês de abrantes, BAIRRO ALTO, Curitiba",-25.428263,-49.2021604
2252,"rua andrelino queiroz dourado, CIDADE INDUSTRIAL, Curitiba",-25.51171,-49.3364619
2253,"rua arno duarte, CIDADE INDUSTRIAL, Curitiba",-25.5006655,-49.3506246
2254,"rua professor homero batista de barros, PINHEIRINHO, Curitiba",-25.5264084,-49.28985609999999
2255,"rua professor júlio theodorico guimarães, PINHEIRINHO, Curitiba",-25.5283631,-49.2732412
2256,"rua padre boleslau lucas bayer, CIDADE INDUSTRIAL, Curitiba",-25.4369716,-49.355133
2257,"rua doutor augusto lobo de moura, FAZENDINHA, Curitiba",-25.486441,-49.3306668
2258,"rua frederico maurer, BOQUEIRÃO, Curitiba",-25.4875253,-49.2469569
2259,"rua joão luiz foerster, ALTO BOQUEIRÃO, Curitiba",-25.5396751,-49.24373
2260,"rua av. francisco gulin, SANTA FELICIDADE, Curitiba",-25.3870786,-49.3383434
2261,"rua simão guebur, UBERABA, Curitiba",-25.4915378,-49.22419350000001
2262,"rua jurandir a loro, BACACHERI, Curitiba",-25.4097415,-49.2397386
2263,"rua antonio skrepec, PINHEIRINHO, Curitiba",-25.524432,-49.2821146
2264,"rua são salvador, PILARZINHO, Curitiba",-25.3857584,-49.2831226
2265,"rua doutor heleno da silveira, BOQUEIRÃO, Curitiba",-25.51625,-49.2343404
2266,"rua rio grande do sul, PORTÃO, Curitiba",-30.0346471,-51.2176584
2267,"rua ari josé valle, SANTA FELICIDADE, Curitiba",-25.3916802,-49.3188688
2268,"rua nicola pellanda, PINHEIRINHO, Curitiba",-25.5363823,-49.2952169
2269,"rua  presidente arthur da silva bernardes, VILA IZABEL, Curitiba",-25.457862,-49.3025579
2270,"rua josé martin, SANTA FELICIDADE, Curitiba",-25.4356022,-49.33770370000001
2271,"rua arthur belache, SANTA FELICIDADE, Curitiba",-25.3820509,-49.3288173
2272,"rua major fabriciano do rego barros, HAUER, Curitiba",-25.4750673,-49.2530993
2273,"rua francisco monteiro painhas, SÍTIO CERCADO, Curitiba",-25.5314393,-49.2708342
2274,"rua brasilio cuman, SÃO BRAZ, Curitiba",-25.4083489,-49.36034249999999
2275,"rua  general mario tourinho, CAMPINA DO SIQUEIRA, Curitiba",-25.4379815,-49.3076809
2276,"rua rogério zara do amaral, CAMPO DE SANTANA, Curitiba",-25.595036,-49.342852
2277,"rua flávio dallegrave, CABRAL, Curitiba",-25.4049868,-49.2459852
2278,"rua deputado mário de barros, JUVEVÊ, Curitiba",-25.4128369,-49.2636695
2279,"rua reynaldo contin, UMBARÁ, Curitiba",-25.5602198,-49.273142
2280,"rua manoel ribas, BUTIATUVINHA, Curitiba",-25.3946906,-49.3482689
2281,"rua  clemente ritz, CIDADE INDUSTRIAL, Curitiba",-25.4723325,-49.3475467
2282,"rua  alcir martins bastos, FAZENDINHA, Curitiba",-25.484787,-49.3242205
2283,"rua jorn. lourival souza curvelo, CAJURU, Curitiba",-18.7532048,-44.4306733
2284,"rua hermes farias de macedo, TATUQUARA, Curitiba",-25.5631789,-49.3316844
2285,"rua antonio rebelatto, BOQUEIRÃO, Curitiba",-25.4935661,-49.2581473
2286,"rua rua nelson de macedo justus, CAJURU, Curitiba",-25.4688755,-49.1905815
2287,"rua joão lucca, SANTA QUITÉRIA, Curitiba",-25.5106495,-49.2763941
2288,"rua madre leopoldina de santa tereza, XAXIM, Curitiba",-25.5057411,-49.2672398
2289,"rua  rockefeller, REBOUÇAS, Curitiba",-25.444576,-49.2624885
2290,"rua fabio roger mendes, CAJURU, Curitiba",-25.452552,-49.21801689999999
2291,"rua professor narciso mendes, XAXIM, Curitiba",-25.5035662,-49.2713153
2292,"rua frei henrique de coimbra, HAUER, Curitiba",-25.4810542,-49.2543228
2293,"rua rui barbosa, CENTRO CÍVICO, Curitiba",-25.436289,-49.2738464
2294,"rua  domingos imbronizio, MOSSUNGUÊ, Curitiba",-25.4350065,-49.3249084
2295,"rua frederico stella, CACHOEIRA, Curitiba",-25.3507658,-49.2612128
2296,"rua max schubert, ALTO BOQUEIRÃO, Curitiba",-25.521056,-49.2521983
2297,"rua doutor lauro gentio portugal tavares, SÍTIO CERCADO, Curitiba",-25.5382171,-49.2658002
2298,"rua  wilson dacheux pereira, ALTO BOQUEIRÃO, Curitiba",-25.5275115,-49.24037449999999
2299,"rua padre estanislau piasecki, CIDADE INDUSTRIAL, Curitiba",-25.4362357,-49.3581679
2300,"rua uruguai, BACACHERI, Curitiba",-25.4045425,-49.2427868
2301,"rua  primo lourenco tosin, NOVO MUNDO, Curitiba",-25.4907724,-49.30240999999999
2302,"rua acil lourenco da cruz, UBERABA, Curitiba",-25.4934777,-49.2043379
2303,"rua clara tedesco, BOQUEIRÃO, Curitiba",-25.5038092,-49.25505159999999
2304,"rua  miguel novicki, SÃO BRAZ, Curitiba",-25.4125037,-49.3555382
2305,"rua  joão budel, BUTIATUVINHA, Curitiba",-25.389011,-49.3572141
2306,"rua pia lazzari bertoldi, CAMPO DE SANTANA, Curitiba",-25.5886186,-49.3371711
2307,"rua professor osvaldo ormiamin, CIDADE INDUSTRIAL, Curitiba",-25.4760741,-49.34832309999999
2308,"rua raposo tavares, PILARZINHO, Curitiba",-25.3908513,-49.297207
2309,"rua general josé ferreira de barros, SÍTIO CERCADO, Curitiba",-25.53543,-49.2546741
2310,"rua manoel ribeiro de macedo, PINHEIRINHO, Curitiba",-25.5242005,-49.2716115
2311,"rua esper jorge chueri, CAJURU, Curitiba",-25.453261,-49.2081753
2312,"rua pretestato taborda ribas, PORTÃO, Curitiba",-25.4663708,-49.3092883
2313,"rua joão scuissiato, SANTA QUITÉRIA, Curitiba",-25.4618801,-49.3147707
2314,"rua padre anchieta, BIGORRILHO, Curitiba",-25.4314342,-49.2954784
2315,"rua laudelino ferreira lopes, PINHEIRINHO, Curitiba",-25.5128715,-49.3044805
2316,"rua rosamelia de oliveira, CAMPO COMPRIDO, Curitiba",-25.4582268,-49.3283472
2317,"rua antonio alexandre pillato, CAMPO DE SANTANA, Curitiba",-25.5878191,-49.34152599999999
2318,"rua marechal mascarenhas de moraes, SANTA CÂNDIDA, Curitiba",-25.3808384,-49.21927489999999
2319,"rua albino pavelski, AUGUSTA, Curitiba",-25.479753,-49.3599595
2320,"rua  vale dos pássaros, CIDADE INDUSTRIAL, Curitiba",-25.4905982,-49.3499352
2321,"rua professor benedito nicolau dos santos, CENTRO CÍVICO, Curitiba",-25.4137754,-49.2686
