,Endereco,LATITUDE,LONGITUDE
12202,"rua ouro verde, PINHEIRINHO, Curitiba",-25.5077029,-49.3009607
12203,"rua luiz de lara da penha, CAJURU, Curitiba",-26.7744186,-48.64368959999999
12204,"rua zumbi dos palmares, ÁGUA VERDE, Curitiba",-25.4530706,-49.2779229
12205,"rua ferdinando patitucci, TATUQUARA, Curitiba",-25.5797989,-49.3348252
12206,"rua andré bonato, XAXIM, Curitiba",-25.5712382,-49.2744894
12207,"rua doutor faivre, CAPÃO RASO, Curitiba",-25.4295951,-49.2610657
12208,"rua exp eurides fernandes do nascimento, ALTO BOQUEIRÃO, Curitiba",-25.5356434,-49.2463651
12209,"rua andré matte, PINHEIRINHO, Curitiba",-25.5309032,-49.28433039999999
12210,"rua emilio de menezes, BOA VISTA, Curitiba",-25.4165604,-49.2789331
12211,"rua antônio geroslau ferreira, CIDADE INDUSTRIAL, Curitiba",-25.4964458,-49.3517881
12212,"rua max sesselmeir, XAXIM, Curitiba",-25.4900748,-49.2669562
12213,"rua doutor dalton dória pinto, GUAÍRA, Curitiba",10.6024787,-66.9313444
12214,"rua centenario, CAPÃO DA IMBUIA, Curitiba",-25.4373004,-49.211194
12215,"rua francisco ader, ALTO DA RUA XV, Curitiba",-25.4916782,-49.29964349999999
12216,"rua jose gomes de mello, UBERABA, Curitiba",-25.4959677,-49.2236244
12217,"rua gastao natal simone (cic), CIDADE INDUSTRIAL, Curitiba",-25.5153245,-49.3290281
12218,"rua antonio ferreira maciel, SANTA CÂNDIDA, Curitiba",-25.3658008,-49.2436003
12219,"rua diva machado da luz, SÍTIO CERCADO, Curitiba",-25.5441718,-49.2718244
12220,"rua josé fabiano barcik, ABRANCHES, Curitiba",-25.4593153,-49.2135109
12221,"rua josé bonifacio de barros pimpão, CENTRO, Curitiba",-25.5455175,-49.29180040000001
12222,"rua aluizio finzetto, PAROLIN, Curitiba",-25.4615011,-49.2547808
12223,"rua reinhold jabin, TATUQUARA, Curitiba",-25.5623282,-49.3302349
12224,"rua libero sant ana nunes, XAXIM, Curitiba",-25.5090296,-49.26630590000001
12225,"rua antonio vieira sobrinho, GANCHINHO, Curitiba",-25.5598497,-49.2589925
12226,"rua otelo queirolo, SANTA FELICIDADE, Curitiba",-25.4333401,-49.3074213
12227,"rua gotardo boza, BUTIATUVINHA, Curitiba",-25.3956612,-49.3417725
12228,"rua pedro doska, SANTA CÂNDIDA, Curitiba",-25.3762452,-49.223215
12229,"rua josé becker davet, SANTA CÂNDIDA, Curitiba",-25.3700651,-49.2126459
12230,"rua major moacir fonseca lopes, CIDADE INDUSTRIAL, Curitiba",-25.513456,-49.3313298
12231,"rua carlópolis, SÍTIO CERCADO, Curitiba",-25.5393083,-49.2934889
12232,"rua arthur s. correia de freitas, CAJURU, Curitiba",-25.4623698,-49.1961337
12233,"rua jaime jose vojciechovski, TATUQUARA, Curitiba",-25.5594043,-49.3142327
12234,"rua hussein ibrahim omairy 526, SÍTIO CERCADO, Curitiba",-25.554125,-49.2614208
12235,"rua engenheiro luiz carlos de oliveira borges, SANTA QUITÉRIA, Curitiba",-25.4655881,-49.3157714
12236,"rua tito schier, FAZENDINHA, Curitiba",-25.4826261,-49.2931762
12237,"rua egídio antonio zamilian, SANTA FELICIDADE, Curitiba",-25.3978544,-49.32721550000001
12238,"rua astor toniolo, SANTA FELICIDADE, Curitiba",-25.3913964,-49.3358855
12239,"rua adriano lugarini, BUTIATUVINHA, Curitiba",-25.3932709,-49.3437232
12240,"rua léa moreira de souza moura, CAJURU, Curitiba",-25.5111147,-49.32572
12241,"rua paul garfunkel, CAPÃO RASO, Curitiba",-25.5402881,-49.3355818
12242,"rua mariluz, ALTO BOQUEIRÃO, Curitiba",-25.5248269,-49.2371223
12243,"rua dr levi miro carneiro, CIDADE INDUSTRIAL, Curitiba",-25.5321962,-49.3402091
12244,"rua rafael simira oliveira, CIDADE INDUSTRIAL, Curitiba",-25.4808762,-49.3044253
12245,"rua deputado josé hoffmann, CAMPO DE SANTANA, Curitiba",-25.4084441,-49.3008104
12246,"rua ubaldino leal fontoura, ALTO DA GLÓRIA, Curitiba",41.9567528,-8.6328394
12247,"rua aracas, CAJURU, Curitiba",-25.4731877,-49.2137847
12248,"rua reinaldo hecke, SÃO LOURENÇO, Curitiba",-25.3785938,-49.266043
12249,"rua joão henrique hoffman, UBERABA, Curitiba",-25.4965695,-49.20105
12250,"rua bejamim lage, UBERABA, Curitiba",-25.4858632,-49.2193668
12251,"rua bile garmarte, SÍTIO CERCADO, Curitiba",-25.5443488,-49.26656209999999
12252,"rua epaminondas franco, TARUMÃ, Curitiba",-25.4292558,-49.2308063
12253,"rua ricardo padavani filho, CIDADE INDUSTRIAL, Curitiba",-25.4856208,-49.3435358
12254,"rua nair caselato, ALTO BOQUEIRÃO, Curitiba",-25.5272468,-49.2286702
12255,"rua monsenhor joao augusto sobrinho, MOSSUNGUÊ, Curitiba",-25.4616299,-49.3506371
12256,"rua pintor ricardo krieger, CENTRO, Curitiba",-25.3815507,-49.2063815
12257,"rua dolores de souza pacheco, BOA VISTA, Curitiba",-25.3774322,-49.2441621
12258,"rua guararapes, ABRANCHES, Curitiba",-21.2528671,-50.6458503
12259,"rua gastao natal simone, CIDADE INDUSTRIAL, Curitiba",-25.5153245,-49.3290281
12260,"rua carlos eduardo martins mercer, CIDADE INDUSTRIAL, Curitiba",-25.4992076,-49.3567754
12261,"rua josé silva de lima, CAPÃO RASO, Curitiba",-25.516661,-49.3115821
12262,"rua professora woyslava trzeciak angelotti, SÍTIO CERCADO, Curitiba",-25.5403967,-49.255643
12263,"rua delegada ieda cristina ribeiro, BUTIATUVINHA, Curitiba",-25.5630171,-49.3408422
12264,"rua josé gava, PILARZINHO, Curitiba",-25.3830107,-49.2956046
12265,"rua isabel bakker, BOQUEIRÃO, Curitiba",-25.5121023,-49.2457296
12266,"rua vereador victório j. da roda, CIDADE INDUSTRIAL, Curitiba",-25.4808762,-49.3044253
12267,"rua ildefonso clemente puppi, CIDADE INDUSTRIAL, Curitiba",-25.4997641,-49.3370257
12268,"rua leia grupenmacher, SÍTIO CERCADO, Curitiba",-25.5490565,-49.2493049
12269,"rua rua ds periquitos, NOVO MUNDO, Curitiba",-25.4920468,-49.2840742
12270,"rua bernardo bubniak, ATUBA, Curitiba",-25.3833852,-49.2058867
12271,"rua senador salgado filho, PINHEIRINHO, Curitiba",-28.0276247,-54.5441571
12272,"rua joão zaniolo, REBOUÇAS, Curitiba",-25.4561054,-49.2681881
12273,"rua ernesto bley, BOQUEIRÃO, Curitiba",-25.5415724,-49.2674374
12274,"rua carlos pisani, XAXIM, Curitiba",-25.5116948,-49.2748451
12275,"rua guabirotuba, CENTRO, Curitiba",-25.4479094,-49.2527137
12276,"rua presidente faria, GANCHINHO, Curitiba",-25.4273866,-49.2685354
12277,"rua ivan caroiolano barros durandi, CIDADE INDUSTRIAL, Curitiba",44.58916199999999,7.196875400000001
12278,"rua jorge bom, TINGUI, Curitiba",-25.3916028,-49.21987439999999
12279,"rua osires delcor, CAJURU, Curitiba",-25.4541704,-49.2141019
12280,"rua alferes poli, FANNY, Curitiba",-25.4522504,-49.2660347
12281,"rua tito schier, CAMPINA DO SIQUEIRA, Curitiba",-25.4785584,-49.2927249
12282,"rua carlos leopoldo glaser, CAMPO COMPRIDO, Curitiba",-25.4526378,-49.317737
12283,"rua sagitário, BOQUEIRÃO, Curitiba",-25.4808762,-49.3044253
12284,"rua giacomo mylla, BOM RETIRO, Curitiba",-25.4095941,-49.2819207
12285,"rua diomar wambier, UBERABA, Curitiba",-25.4928036,-49.2178415
12286,"rua ambiental olga de araújo espíndola, NOVO MUNDO, Curitiba",-25.4916728,-49.3010328
12287,"rua campina da lagoa, TATUQUARA, Curitiba",-25.5322724,-49.254452
12288,"rua doutor darcy alves de souza, CAMPO COMPRIDO, Curitiba",-25.4475734,-49.3376964
12289,"rua octavio primo stocchero, BUTIATUVINHA, Curitiba",-25.3905331,-49.362249
12290,"rua domingos stival, BUTIATUVINHA, Curitiba",-25.3895229,-49.3621203
12291,"rua iguacu, REBOUÇAS, Curitiba",-25.4423319,-49.2695849
12292,"rua anjo de luz, CIDADE INDUSTRIAL, Curitiba",-25.4623119,-49.3433633
12293,"rua maria emiliano de moraes, CIDADE INDUSTRIAL, Curitiba",-25.5016195,-49.3210034
12294,"rua nossa senhora de nazaré, BACACHERI, Curitiba",-25.3898883,-49.2449844
12295,"rua curitiba paranaguá br-277, ORLEANS, Curitiba",-25.4438879,-49.2369667
12296,"rua monteiro lobato, CENTRO, Curitiba",-22.9545553,-45.8386923
12297,"rua osmar simoes, SÍTIO CERCADO, Curitiba",-25.54489,-49.2900248
12298,"rua doutor leão mocellin, CASCATINHA, Curitiba",-25.3986201,-49.3204924
12299,"rua josé veiga, SÃO BRAZ, Curitiba",-25.4168878,-49.357917
12300,"rua barbosa ferraz, ALTO BOQUEIRÃO, Curitiba",-25.5271055,-49.2575611
12301,"rua joão meneghetti, FAZENDINHA, Curitiba",-25.4920772,-49.3281286
12302,"rua josé batista dos santos, PORTÃO, Curitiba",-25.4799406,-49.3439543
12303,"rua edna walderez bassetti habith, XAXIM, Curitiba",-25.5156465,-49.2643876
12304,"rua francisco vacheski, TATUQUARA, Curitiba",-25.5504835,-49.2981177
12305,"rua eduardo  hendler, BOA VISTA, Curitiba",-25.3923891,-49.2366641
12306,"rua joão machado, XAXIM, Curitiba",-25.5012443,-49.2607948
12307,"rua frederico lambertucci, CIDADE INDUSTRIAL, Curitiba",-25.4856234,-49.3287935
12308,"rua joão ribeiro baptista, CAXIMBA, Curitiba",-25.6155213,-49.352147
12309,"rua principal, CAXIMBA, Curitiba",-25.6165382,-49.35423309999999
12310,"rua professor fábio de souza, NOVO MUNDO, Curitiba",-25.4647356,-49.3071984
12311,"rua reinoldes stepurski, CAMPO COMPRIDO, Curitiba",-25.469044,-49.3252436
12312,"rua paulo roberto munhoz costa, LINDÓIA, Curitiba",-25.4797247,-49.2759782
12313,"rua miguel suchevicz, BARREIRINHA, Curitiba",-25.3664155,-49.258596
12314,"rua maria moreira frotte., BOA VISTA, Curitiba",-25.3508789,-49.26816239999999
12315,"rua deputado waldemiro pedroso, ALTO BOQUEIRÃO, Curitiba",-25.4925977,-49.3031071
12316,"rua joão henrique hofmann, UBERABA, Curitiba",-25.4965695,-49.20105
12317,"rua maria orso pereira, TATUQUARA, Curitiba",-25.5903281,-49.3172887
12318,"rua osmário de lima, CAMPINA DO SIQUEIRA, Curitiba",-12.0463731,-77.042754
12319,"rua joão manoel, TABOÃO, Curitiba",-23.6228759,-46.7816647
12320,"rua brigadeiro rocha loures, CRISTO REI, Curitiba",-25.432421,-49.241075
12321,"rua vilibaldo josé hoffmann, PINHEIRINHO, Curitiba",-25.5907478,-49.3233013
12322,"rua maria gomes, NOVO MUNDO, Curitiba",-25.4865476,-49.28850740000001
12323,"rua coronel nicolau bley neto, CIDADE INDUSTRIAL, Curitiba",-25.4810473,-49.34496739999999
12324,"rua eduardo baiena, CIDADE INDUSTRIAL, Curitiba",-25.481109,-49.3545281
12325,"rua wilson lois koehler junior, XAXIM, Curitiba",-25.4872733,-49.2655042
12326,"rua general ary duarte nunes, CAJURU, Curitiba",-25.473266,-49.2319143
12327,"rua mário vendramel, PRADO VELHO, Curitiba",-25.4496885,-49.2464344
12328,"rua comendador alfredo munhoz, BOQUEIRÃO, Curitiba",-25.422767,-49.2304116
12329,"rua gustavo barrozo gonçalves, UBERABA, Curitiba",-19.7473668,-47.93915399999999
12330,"rua general osório, CAJURU, Curitiba",-25.4808762,-49.3044253
12331,"rua brigadeiro antonio de sampaio, JARDIM BOTÂNICO, Curitiba",-25.4404403,-49.24594099999999
12332,"rua joao reboli, BOA VISTA, Curitiba",-25.3798224,-49.2342564
12333,"rua das tropas, GUABIROTUBA, Curitiba",-25.4641444,-49.2404933
12334,"rua arary souto, TINGUI, Curitiba",-25.3854639,-49.2303468
12335,"rua barão de studart, VISTA ALEGRE, Curitiba",-25.4085716,-49.2943073
12336,"rua maurilio szardo, CAMPO DE SANTANA, Curitiba",-25.5915928,-49.3371224
12337,"rua do capanema, CRISTO REI, Curitiba",-1.2056483,-47.178192
12338,"rua joanna rieke rutz, CAMPINA DO SIQUEIRA, Curitiba",-25.4431424,-49.3154774
12339,"rua tenente antonio pupo, XAXIM, Curitiba",-25.5173296,-49.2653302
12340,"rua antonio krasinski, CAMPO COMPRIDO, Curitiba",-25.4346474,-49.3443382
12341,"rua leonardo glelinski, CAJURU, Curitiba",-25.4691132,-49.202758
12342,"rua stella surugi leprevost, JARDIM BOTÂNICO, Curitiba",-25.4420753,-49.23877040000001
12343,"rua delegado bruno de almeida, CIDADE INDUSTRIAL, Curitiba",-25.4808762,-49.3044253
12344,"rua jerônimo durski, SEMINÁRIO, Curitiba",-25.4428881,-49.2973975
12345,"rua doutor carlos franco ferreira da costa, SÍTIO CERCADO, Curitiba",-25.5501005,-49.2497264
12346,"rua professora emma carvalho dos santos, XAXIM, Curitiba",-25.5148424,-49.2704039
12347,"rua doutor ennio marçal, TINGUI, Curitiba",-25.3920445,-49.2170215
12348,"rua josé clementino bettega, PORTÃO, Curitiba",-25.4993859,-49.2996215
12349,"rua valeriana da cunha ribas, SÃO MIGUEL, Curitiba",-25.5044004,-49.3602383
12350,"rua albino vico, CAPÃO RASO, Curitiba",-25.4959967,-49.29479509999999
12351,"rua wasdilau brand, CIDADE INDUSTRIAL, Curitiba",-25.4506781,-49.355733
12352,"rua dr. epaminondas ribeiro, CIDADE INDUSTRIAL, Curitiba",-25.5484715,-49.3394262
12353,"rua antônio salin, UMBARÁ, Curitiba",-25.5862508,-49.2853845
12355,"rua rua jornalista augusto valdrigues, CIDADE INDUSTRIAL, Curitiba",-25.5040295,-49.3297882
12356,"rua anna reinahrt, PAROLIN, Curitiba",-25.4397887,-49.2475709
12357,"rua osmar lipinski, CIDADE INDUSTRIAL, Curitiba",-25.5170439,-49.3170564
12358,"rua manoel valdomiro de macedo, PINHEIRINHO, Curitiba",-25.5142532,-49.3182753
12359,"rua conselheiro raul viana, CENTRO CÍVICO, Curitiba",-25.4129326,-49.27015369999999
12360,"rua verônica tribek môro, CIDADE INDUSTRIAL, Curitiba",-25.4628314,-49.3397199
12361,"rua daniel comboni, FAZENDINHA, Curitiba",-25.4863121,-49.3233597
12362,"rua coronel joão maria sobrinho, VISTA ALEGRE, Curitiba",-25.4014639,-49.29462969999999
12363,"rua do garimpo, GUABIROTUBA, Curitiba",-25.4643745,-49.2389393
12364,"rua aurea da silva senff, UBERABA, Curitiba",-25.4846034,-49.1933381
12365,"rua nicolau kresko, HAUER, Curitiba",-25.484419,-49.2464464
12366,"rua travessa miguel pedro abibi, CAJURU, Curitiba",-25.4541704,-49.2141019
12367,"rua jose pedro cardoso, CAMPO DE SANTANA, Curitiba",-25.590882,-49.3323555
12368,"rua josé egidio martins, PINHEIRINHO, Curitiba",-25.5243454,-49.29372850000001
12369,"rua josé dal negro, XAXIM, Curitiba",-25.5069929,-49.261026
12370,"rua treze de maio, REBOUÇAS, Curitiba",-25.4808762,-49.3044253
12371,"rua leoni azeredo rocha, CAJURU, Curitiba",-25.4469473,-49.2174967
12372,"rua manoel borba, PINHEIRINHO, Curitiba",-25.527816,-49.29186550000001
12373,"rua argemiro candido jardim, CIDADE INDUSTRIAL, Curitiba",-25.5160002,-49.3306272
12374,"rua major arnoldo mayer, CAMPO DE SANTANA, Curitiba",-25.596615,-49.3286161
12375,"rua benno henrique doetzer, TATUQUARA, Curitiba",-25.5622804,-49.3287981
12376,"rua rodovia do café, km 4,5, CAMPO COMPRIDO, Curitiba",-25.4304844,-49.3525137
12377,"rua dezesseis de abril, CAMPO COMPRIDO, Curitiba",-25.4668761,-49.3274627
12378,"rua quadra e, UMBARÁ, Curitiba",-25.4808762,-49.3044253
12379,"rua evelázio de oliveira, CIDADE INDUSTRIAL, Curitiba",-25.4808762,-49.3044253
12380,"rua francisco juneida ferreira dos santos, BOA VISTA, Curitiba",-25.3886823,-49.2334685
12381,"rua moradias do iguaçu 03, GANCHINHO, Curitiba",-25.4808762,-49.3044253
12382,"rua av. do canal, SÍTIO CERCADO, Curitiba",-25.5617361,-49.2523512
12383,"rua marechal cardoso júnior, UBERABA, Curitiba",-25.4684292,-49.229028
12384,"rua arthur erzinger, CAJURU, Curitiba",-25.4735143,-49.2004765
12385,"rua júlio maito sobrinho, UBERABA, Curitiba",-25.4811211,-49.21794
12386,"rua rua amaral guimarães, CAJURU, Curitiba",-25.4628602,-49.1984485
12387,"rua adolfo werneck, UBERABA, Curitiba",-25.4797897,-49.2221515
12388,"rua professor jorge visca, CIDADE INDUSTRIAL, Curitiba",-25.4576678,-49.2953044
12389,"rua jornalista luzimar de maria dionysio (meio quilo), SÍTIO CERCADO, Curitiba",-25.5447212,-49.24814970000001
12390,"rua isidio isidoro kalinoski, SANTA CÂNDIDA, Curitiba",-25.3690362,-49.2364955
12391,"rua mara regina scaramussa marques, CAMPO DE SANTANA, Curitiba",-25.5849133,-49.3418921
12392,"rua jorge pedro chueri, TARUMÃ, Curitiba",-25.430546,-49.2325459
12393,"rua doutor theodorico de oliveira franco, CAJURU, Curitiba",-25.4704465,-49.1999362
12394,"rua joão netzel, CIDADE INDUSTRIAL, Curitiba",-25.4571535,-49.346768
12395,"rua engenheiro sady souza, CIDADE INDUSTRIAL, Curitiba",-25.4341017,-49.3687028
12396,"rua eduardo geronasso, CAPÃO RASO, Curitiba",-25.3923891,-49.2366641
12397,"rua gerson da graça, CIDADE INDUSTRIAL, Curitiba",-25.4448013,-49.31001089999999
12398,"rua do cedro, BARREIRINHA, Curitiba",-25.3679175,-49.2571841
12399,"rua geronimo muraro, BUTIATUVINHA, Curitiba",-25.3903136,-49.3375589
12400,"rua florindo josé moreschi, GUAÍRA, Curitiba",-25.4663005,-49.2707594
12401,"rua ecilda melania voluz brum, PINHEIRINHO, Curitiba",-25.528692,-49.2866543
12402,"rua das esmeraldas, XAXIM, Curitiba",-25.4808762,-49.3044253
12403,"rua ariane maria frança de souza, UBERABA, Curitiba",-25.496492,-49.2236837
12404,"rua madre úrsula ledóchowska, CAPÃO RASO, Curitiba",-25.5038063,-49.2927776
12405,"rua ludovica robert, SÍTIO CERCADO, Curitiba",-25.5379176,-49.26333400000001
12406,"rua jose vieira neto, CIDADE INDUSTRIAL, Curitiba",-25.4506781,-49.355733
12407,"rua joao zaions, SÍTIO CERCADO, Curitiba",-25.5344969,-49.2791886
12408,"rua victor stec, PINHEIRINHO, Curitiba",-25.4930624,-49.2674404
12409,"rua constante de conto, ORLEANS, Curitiba",-25.4360856,-49.3474808
12410,"rua dos pioneiros, CIDADE INDUSTRIAL, Curitiba",-25.4808762,-49.3044253
12411,"rua república argentina, CAMPINA DO SIQUEIRA, Curitiba",-25.4713135,-49.29432629999999
12412,"rua dr. ivan jorge curi, CAJURU, Curitiba",-25.4566551,-49.1985
12413,"rua tranquilo saragiotto, CAJURU, Curitiba",-25.4565384,-49.2032682
12414,"rua debora eloisa pereira, CAJURU, Curitiba",-25.4569003,-49.2031089
12415,"rua antonio nogarolli, BIGORRILHO, Curitiba",-25.4253352,-49.30390939999999
12416,"rua rua comandante jose jeis neto, TATUQUARA, Curitiba",-25.5612838,-49.3118278
12417,"rua dr jose alexandre de moura negrini, UBERABA, Curitiba",-25.4767946,-49.1966924
12418,"rua antenor guimarães, PILARZINHO, Curitiba",-25.3954089,-49.2881539
12419,"rua augusto stresser, NOVO MUNDO, Curitiba",-25.4170897,-49.2513792
12420,"rua tenente antônio pupo, BOQUEIRÃO, Curitiba",-25.5173296,-49.2653302
12421,"rua professor paulo ribeiro da silva, UMBARÁ, Curitiba",-25.560004,-49.283783
12422,"rua br-476, fanny, Curitiba",-25.4854437,-49.2675764
12423,"rua joão lunardelli, TATUQUARA, Curitiba",-25.548078,-49.3209166
12424,"rua theodoro de bona, CIDADE INDUSTRIAL, Curitiba",-25.4771335,-49.3532265
12425,"rua joão alexandre kopp, SÃO BRAZ, Curitiba",-25.4812687,-49.347473
12426,"rua alcides vasconcelos, CIDADE INDUSTRIAL, Curitiba",-25.3862229,-49.2021441
12427,"rua joaquim nabuco, TINGÜI, Curitiba",-25.3845345,-49.2247488
12428,"rua joaquim amaral, UBERABA, Curitiba",-25.4679337,-49.2309573
12429,"rua dr. joão luiz bettega, UBERABA, Curitiba",-25.4609672,-49.196028
12430,"rua fúlvio josé alice, ATUBA, Curitiba",-25.4166857,-49.2211654
12431,"rua marechal, BOQUEIRÃO, Curitiba",-25.4808762,-49.3044253
12432,"rua luiz carlos bruginski, PORTÃO, Curitiba",-25.4724553,-49.32305969999999
12433,"rua arthur martins franco, SÃO BRAZ, Curitiba",-25.4962233,-49.33521289999999
12434,"rua renato polatti, CIDADE INDUSTRIAL, Curitiba",-25.4607422,-49.331917
12435,"rua almirante gonçalves, PRADO VELHO, Curitiba",-25.4474814,-49.2660102
12436,"rua lucio pereira, TINGUI, Curitiba",-25.3890527,-49.2219902
12437,"rua antonio gunha, VILA IZABEL, Curitiba",-25.4577686,-49.294653
12438,"rua plinio anciutti pessoa, CIDADE INDUSTRIAL, Curitiba",-25.4808762,-49.3044253
12439,"rua fanny bertoldi, TATUQUARA, Curitiba",-25.5929383,-49.3406642
12440,"rua rua vitoria, CIDADE INDUSTRIAL, Curitiba",-25.5040295,-49.3297882
12441,"rua coronel irazê paes brasil, TARUMÃ, Curitiba",-25.4316726,-49.2285081
12442,"rua araticum, UBERABA, Curitiba",-25.47603,-49.223374
12443,"rua palmira cliverrado bertoldi, TATUQUARA, Curitiba",3.5379718,-76.2971657
12444,"rua manoel martins de abreu, CAPÃO DA IMBUIA, Curitiba",-25.4467587,-49.2490231
12445,"rua antonio agenor do nascimento, JARDIM DAS AMÉRICAS, Curitiba",-25.4663091,-49.2166477
12446,"rua joao domingues calvaca, SÍTIO CERCADO, Curitiba",-25.533601,-49.2779391
12447,"rua lucia soppelza de boni, BOA VISTA, Curitiba",-25.3545411,-49.276199
12448,"rua presidente faria, SÃO FRANCISCO, Curitiba",-25.4273866,-49.2685354
12449,"rua general gastão pereira cordeiro, SÃO FRANCISCO, Curitiba",-25.4808762,-49.3044253
12450,"rua murillo  szabo, CAMPO DE SANTANA, Curitiba",-25.5991173,-49.3278097
12451,"rua ancião joaquim dos santos neto, CIDADE INDUSTRIAL, Curitiba",-25.4857655,-49.3393452
12452,"rua desembargador cid campelo, FAZENDINHA, Curitiba",-25.4816722,-49.3371425
12453,"rua dep sival martins, SÍTIO CERCADO, Curitiba",-25.5443488,-49.26656209999999
12454,"rua guido jorge de souza, CAMPO DE SANTANA, Curitiba",-25.5984183,-49.33488630000001
12455,"rua fernando souza costa, FAZENDINHA, Curitiba",-25.4845669,-49.3266419
12456,"rua vicente machado, BIGORRILHO, Curitiba",-25.4389025,-49.2912399
12457,"rua dias da rocha filho, CRISTO REI, Curitiba",-25.4259292,-49.24942
12458,"rua paulina pontaroli, TATUQUARA, Curitiba",-25.5730876,-49.3410298
12459,"rua márcio santos, CIDADE INDUSTRIAL, Curitiba",-25.5312407,-49.3419853
12460,"rua romeu felipe bacellar, CIDADE INDUSTRIAL, Curitiba",-25.5336477,-49.3359811
12461,"rua presidente faria, PINHEIRINHO, Curitiba",-25.4273866,-49.2685354
12462,"rua alceu galize, SÍTIO CERCADO, Curitiba",-25.5465137,-49.265469
12463,"rua luiz valenza, CIDADE INDUSTRIAL, Curitiba",-25.4925508,-49.3326716
12464,"rua deizy luci ribeiro, GUAÍRA, Curitiba",-25.4706466,-49.2742891
12465,"rua gastão de abreu pires, SÃO BRAZ, Curitiba",-25.4544125,-49.3549666
12466,"rua florita wilcek leitoles, AUGUSTA, Curitiba",-25.4956421,-49.344616
12467,"rua sao pedro maria chanel, CIDADE INDUSTRIAL, Curitiba",-25.4929544,-49.3507717
12468,"rua largo coronel enéas, SÃO FRANCISCO, Curitiba",-25.4279758,-49.2721825
12469,"rua senador gaspar velloso, BOA VISTA, Curitiba",-25.3856202,-49.2379207
12470,"rua trincheira da av joao gualberto, ALTO DA GLÓRIA, Curitiba",-25.4192945,-49.2640155
12471,"rua luiz manzochi, BIGORRILHO, Curitiba",-25.4220981,-49.3022011
12472,"rua presidente faria, PILARZINHO, Curitiba",-25.4273866,-49.2685354
12473,"rua roberto kranz, CIDADE INDUSTRIAL, Curitiba",-25.5336702,-49.339052
12474,"rua são vicente pallotti, JARDIM DAS AMÉRICAS, Curitiba",-25.4483151,-49.2265215
12475,"rua josé loureiro, CAPÃO RASO, Curitiba",-25.5023923,-49.2974872
12476,"rua josé valle, CASCATINHA, Curitiba",-25.4039238,-49.3082983
12477,"rua professor francisco ribeiro azevedo de macedo, CABRAL, Curitiba",-25.4289541,-49.267137
12478,"rua leonardo guembaroski, SÍTIO CERCADO, Curitiba",-25.5280754,-49.26775929999999
12479,"rua luiz sperandio, ORLEANS, Curitiba",-25.4275631,-49.3464051
12480,"rua doutor alarico vieira de alencar, BACACHERI, Curitiba",-25.4064333,-49.2234783
12481,"rua desembargador cid campelo, VILA IZABEL, Curitiba",-25.49842,-49.337959
12482,"rua desembargador cid campelo, ÁGUA VERDE, Curitiba",-25.49842,-49.337959
12483,"rua altamiro machado, PINHEIRINHO, Curitiba",-25.4194423,-49.3393245
12484,"rua sebastião vieira da rosa, XAXIM, Curitiba",-25.5176275,-49.2737128
12485,"rua reinaldo mayer, PORTÃO, Curitiba",-25.4289541,-49.267137
12486,"rua ricardo gonçalez júnior, ATUBA, Curitiba",-25.3842161,-49.2003965
12487,"rua dante nellara, CAJURU, Curitiba",-25.4533372,-49.2055863
12488,"rua lodovico kaminski, BOQUEIRÃO, Curitiba",-25.4755627,-49.3590222
12489,"rua curitiba ponta grossa br-277, BUTIATUVINHA, Curitiba",-25.4308832,-49.3326911
12490,"rua mozart rossetto, CACHOEIRA, Curitiba",-25.3485284,-49.2573477
12491,"rua carlos joao goudard, FAZENDINHA, Curitiba",-25.4887608,-49.32959109999999
12492,"rua senador alencar guimarães, CAJURU, Curitiba",-25.4343259,-49.2745061
12493,"rua rua veronica tribeck moro, CIDADE INDUSTRIAL, Curitiba",-25.4628957,-49.33967320000001
12494,"rua guabirutuba, CAJURU, Curitiba",-25.4479094,-49.2527137
12495,"rua heráclides cezar de araújo, CENTRO CÍVICO, Curitiba",-25.4104471,-49.2708813
12496,"rua augusto marach, NOVO MUNDO, Curitiba",-25.4888884,-49.2929465
12497,"rua vila 29 de outubro, TATUQUARA, Curitiba",-25.4808762,-49.3044253
12498,"rua nossa senhora do equilibrio, CIDADE INDUSTRIAL, Curitiba",-25.498634,-49.3532375
12499,"rua tadeu baranczuk, CIDADE INDUSTRIAL, Curitiba",-25.4630977,-49.3505049
12500,"rua tertuliano muller, ALTO DA GLÓRIA, Curitiba",-25.4200321,-49.2607367
12501,"rua hilda hanki gonçalves, CIDADE INDUSTRIAL, Curitiba",-25.4651579,-49.3410114
12502,"rua saul schulman, SÃO MIGUEL, Curitiba",-25.5039617,-49.3525552
12503,"rua abilio de abreu, CAJURU, Curitiba",-25.457549,-49.2463063
12504,"rua da espanha, BATEL, Curitiba",-25.4429635,-49.2889554
12505,"rua napoleão cortês filho, CAJURU, Curitiba",-25.4678333,-49.1894734
12506,"rua waldemar daros, CENTRO, Curitiba",-25.5295928,-49.3383827
12507,"rua ambiental herval, ALTO DA RUA XV, Curitiba",-25.4271538,-49.2488975
12508,"rua da espanha, CENTRO, Curitiba",-25.4351674,-49.2754909
12509,"rua professor francisco alberto de castro, SÍTIO CERCADO, Curitiba",-25.5529164,-49.24848069999999
12510,"rua carlos pradi, JARDIM DAS AMÉRICAS, Curitiba",-25.4565796,-49.2327574
12511,"rua pedro rissetti, GUABIROTUBA, Curitiba",-25.4625129,-49.2421443
12512,"rua jacopo tintoretto, GUABIROTUBA, Curitiba",-25.4621596,-49.2442814
12513,"rua abibe isfer, ÁGUA VERDE, Curitiba",-25.4306443,-49.2777222
12514,"rua zacarias, CAMPINA DO SIQUEIRA, Curitiba",-25.4808762,-49.3044253
12515,"rua josefa cecília portela, CIDADE INDUSTRIAL, Curitiba",-25.5183512,-49.3301781
12516,"rua coronel nelson romero stadler souza, CIDADE INDUSTRIAL, Curitiba",-25.5307792,-49.3373886
12517,"rua presidente faria, CIDADE INDUSTRIAL, Curitiba",-25.4273866,-49.2685354
12518,"rua ralf alberto larsen, ALTO BOQUEIRÃO, Curitiba",-25.5269099,-49.2495345
12519,"rua angelo bonato nichelli, PILARZINHO, Curitiba",-25.4012666,-49.29342279999999
12520,"rua júlia da costa, BATEL, Curitiba",-25.4347612,-49.29747740000001
12521,"rua professora egypcialinda velloso parigot de souza, SÍTIO CERCADO, Curitiba",-25.5443488,-49.26656209999999
12522,"rua ary arquizes, TATUQUARA, Curitiba",-25.5556332,-49.3296794
12523,"rua antonio floriano filho, XAXIM, Curitiba",-25.4920183,-49.266806
12524,"rua nossa senhora de salette, CENTRO, Curitiba",-25.410987,-49.2330599
12525,"rua hermes fontes, BATEL, Curitiba",-25.4443767,-49.2961192
12526,"rua urano, SÍTIO CERCADO, Curitiba",-25.5278677,-49.2632759
12527,"rua angelolilo budeth, CIDADE INDUSTRIAL, Curitiba",-25.4506781,-49.355733
