,Endereco,LATITUDE,LONGITUDE
11552,"rua arcésio guimarães, JARDIM SOCIAL, Curitiba",-25.4211776,-49.2328814
11553,"rua alferes angelo sampaio, CENTRO, Curitiba",-25.439575,-49.2851219
11554,"rua r. hélio dirceu woitikiw, PINHEIRINHO, Curitiba",-25.5225782,-49.2925633
11555,"rua r. reverendo jahyr dittrich, SÍTIO CERCADO, Curitiba",-25.5518329,-49.2691194
11556,"rua francisco nunes, BOQUEIRÃO, Curitiba",-25.4502776,-49.25535929999999
11557,"rua afonso arinos, CAJURU, Curitiba",-25.4374673,-49.2163015
11558,"rua henrique da cunha mello, CAJURU, Curitiba",-25.4052206,-49.3240643
11559,"rua cidade de goioere, ALTO BOQUEIRÃO, Curitiba",-25.5442069,-49.2427228
11560,"rua carlos de laet, UBERABA, Curitiba",-25.4962022,-49.2360925
11561,"rua adelina dutra sanson, CIDADE INDUSTRIAL, Curitiba",-25.5028169,-49.34385630000001
11562,"rua salgado filho, CAJURU, Curitiba",-25.4798779,-49.22502919999999
11563,"rua joão maximiliano baroni, PILARZINHO, Curitiba",-25.3800264,-49.2944126
11564,"rua zozino pinheiro, CIDADE INDUSTRIAL, Curitiba",-25.4882294,-49.3472046
11565,"rua afonso botelho, BATEL, Curitiba",-25.4462024,-49.2751543
11566,"rua sérgio verges, VILA IZABEL, Curitiba",-25.4577686,-49.294653
11567,"rua jornalista divonira torres kudri, JARDIM BOTÂNICO, Curitiba",-25.4362194,-49.2495153
11568,"rua luiz gaspari, PAROLIN, Curitiba",-25.470018,-49.2595082
11569,"rua pedro de campos freire, CAMPO COMPRIDO, Curitiba",-25.4698599,-49.3229857
11570,"rua amália túlio costa, SANTA FELICIDADE, Curitiba",-25.4012794,-49.317663
11571,"rua domingas nicco, MOSSUNGUÊ, Curitiba",-25.4364185,-49.3369074
11572,"rua tenente josé ribas kendrick, CAJURU, Curitiba",-25.4751556,-49.2030671
11573,"rua simão bolívar, ALTO DA GLÓRIA, Curitiba",-25.4195579,-49.2572091
11574,"rua coronel agostinho macedo, BOM RETIRO, Curitiba",-25.4156081,-49.2721451
11575,"rua princesa izabel, BATEL, Curitiba",-25.4347619,-49.2951452
11576,"rua br-476, CAJURU, Curitiba",-21.2755425,-47.30135320000001
11577,"rua república argentina, GUABIROTUBA, Curitiba",-25.4621596,-49.2442814
11578,"rua ernesto guariza, JARDIM DAS AMÉRICAS, Curitiba",-25.459579,-49.2375615
11579,"rua do viamão, GUABIROTUBA, Curitiba",-25.4652703,-49.241225
11580,"rua josé de souza, ATUBA, Curitiba",-25.3842545,-49.1996712
11581,"rua república argentina, CIDADE INDUSTRIAL, Curitiba",-25.5040295,-49.3297882
11582,"rua presidente faria, CENTRO CÍVICO, Curitiba",-25.4273866,-49.2685354
11583,"rua sebastião braganholo, SANTA FELICIDADE, Curitiba",-25.4002615,-49.3405824
11584,"rua albino evaldo muller, AUGUSTA, Curitiba",-25.4568154,-49.3811296
11585,"rua rossana mansur de macedo, CAPÃO DA IMBUIA, Curitiba",-25.431932,-49.2092442
11586,"rua expedicionario francisco pereira dos santos, ALTO BOQUEIRÃO, Curitiba",-25.5383015,-49.2484749
11587,"rua vicente michelotto, CENTRO CÍVICO, Curitiba",-25.5229471,-49.3329999
11588,"rua joão batista ribeiro, CENTRO, Curitiba",-25.4382495,-49.2501684
11589,"rua itambé, SÍTIO CERCADO, Curitiba",-25.5554779,-49.25448859999999
11590,"rua luiz miguel fanchin, SEMINÁRIO, Curitiba",-25.4437622,-49.3130351
11591,"rua br-476, UBERABA, Curitiba",-19.7473668,-47.93915399999999
11592,"rua jose gelbcke, UBERABA, Curitiba",-25.4862976,-49.2019633
11593,"rua eduardo jarnicki, SÃO BRAZ, Curitiba",-25.4155001,-49.3593007
11594,"rua mínero bittencourt, CAMPO DE SANTANA, Curitiba",-25.595629,-49.3430004
11595,"rua judith de freitas granato, PILARZINHO, Curitiba",-25.3834541,-49.2965956
11596,"rua padre alcides zanella, TATUQUARA, Curitiba",-25.5760399,-49.3290951
11597,"rua br-476, BOA VISTA, Curitiba",-25.398083,-49.21505029999999
11598,"rua amauri mauad guérios, CAJURU, Curitiba",-25.4950174,-49.2103443
11599,"rua oldemar justus, BOA VISTA, Curitiba",-25.3638252,-49.2171736
11600,"rua argemiro de lima, SANTA FELICIDADE, Curitiba",-25.3918652,-49.3565347
11601,"rua bom jesus de iguape, BOA VISTA, Curitiba",-25.4957619,-49.237696
11602,"rua anjolilo buzzetti, CIDADE INDUSTRIAL, Curitiba",-25.529193,-49.3326633
11603,"rua mem de sá, GUAÍRA, Curitiba",-25.4757215,-49.2717952
11604,"rua do anhangava, UBERABA, Curitiba",-19.7473668,-47.93915399999999
11605,"rua doutor lauro gentil portugal tavares, SÍTIO CERCADO, Curitiba",28.8041579,-81.725632
11606,"rua victório vizinoni, TARUMÃ, Curitiba",-25.4329293,-49.2182298
11607,"rua pedro gurnacki, CIDADE INDUSTRIAL, Curitiba",-25.438052,-49.3528972
11608,"rua antonio pires da silva, LINDÓIA, Curitiba",-25.4810644,-49.27568249999999
11609,"rua da bandeira, CABRAL, Curitiba",-25.4013484,-49.2542869
11610,"rua das camelias, CAMPO COMPRIDO, Curitiba",-25.4668761,-49.3274627
11611,"rua walter guimarães da costa, SÃO LOURENÇO, Curitiba",-25.3890739,-49.2655003
11612,"rua professora regina casagrande marinoni, PRADO VELHO, Curitiba",-25.4564938,-49.2540112
11613,"rua adão casemiro troczinski, BARREIRINHA, Curitiba",-25.3704428,-49.2507875
11614,"rua carlos alberto de lima fagundes, PORTÃO, Curitiba",-25.479368,-49.3204739
11615,"rua marcos moro, BOM RETIRO, Curitiba",-25.4173705,-49.27267490000001
11616,"rua marilandia do sul, ALTO BOQUEIRÃO, Curitiba",-25.5270024,-49.2346964
11617,"rua brigadeiro franco, BATEL, Curitiba",-25.43664,-49.27986199999999
11618,"rua bela vista do passauna, SÃO MIGUEL, Curitiba",-25.4904651,-49.3561094
11619,"rua principal, MOSSUNGUÊ, Curitiba",-25.4369438,-49.3230219
11620,"rua hildebrando de araújo, CAMPINA DO SIQUEIRA, Curitiba",-25.440668,-49.2464767
11621,"rua rio passo do frança, PINHEIRINHO, Curitiba",-25.5426366,-49.2998014
11622,"rua nelson satenarski monteiro, XAXIM, Curitiba",-25.5064759,-49.26414949999999
11623,"rua theodorico ricetti, ALTO BOQUEIRÃO, Curitiba",-25.5291046,-49.2517726
11624,"rua joão jacob manfron, SANTA FELICIDADE, Curitiba",-25.4026615,-49.32404649999999
11625,"rua benjamin lins, CENTRO, Curitiba",-25.4394243,-49.2802642
11626,"rua arnaldo tha, FAZENDINHA, Curitiba",-25.4828036,-49.3312113
11627,"rua passeio, CENTRO, Curitiba",-25.4351674,-49.2754909
11628,"rua engenheiro mario josé da silva, CAJURU, Curitiba",-21.2755425,-47.30135320000001
11629,"rua guilherme braga de abreu pires, BARREIRINHA, Curitiba",-25.3984538,-49.2950908
11630,"rua professora yeda de souza de castro, JARDIM DAS AMÉRICAS, Curitiba",-25.4808762,-49.3044253
11631,"rua trav. mauro g. zacarias, TATUQUARA, Curitiba",-25.5616973,-49.3392973
11632,"rua canal belem, HAUER, Curitiba",-25.4729763,-49.2445215
11633,"rua amsterdam, SANTO INÁCIO, Curitiba",52.3666969,4.8945398
11634,"rua desembargador joao antonio de barros junior, XAXIM, Curitiba",-25.5065778,-49.2778333
11635,"rua tiepolo severino, CAMPO COMPRIDO, Curitiba",-25.4372839,-49.3413597
11636,"rua cyro veloso, AUGUSTA, Curitiba",33.4734978,-82.0105148
11637,"rua deputado sinval martins de araujo, SÍTIO CERCADO, Curitiba",-25.5528004,-49.2463029
11638,"rua julia da costa, CAMPINA DO SIQUEIRA, Curitiba",-25.4372112,-49.3036561
11639,"rua doutor joao antonio ferreira, SANTA CÂNDIDA, Curitiba",-25.3691696,-49.2093566
11640,"rua itatiaia, CIDADE INDUSTRIAL, Curitiba",-25.4780069,-49.30150460000001
11641,"rua presidente faria, SÍTIO CERCADO, Curitiba",-25.4273866,-49.2685354
11642,"rua br cento e dezesseis, CIDADE INDUSTRIAL, Curitiba",-25.4808762,-49.3044253
11643,"rua elizabete charlote brand, SÍTIO CERCADO, Curitiba",-25.5337241,-49.251827
11644,"rua ernesto krainski, FAZENDINHA, Curitiba",-25.4854698,-49.3162987
11645,"rua joão ferreira, SÍTIO CERCADO, Curitiba",-25.5530921,-49.2663212
11646,"rua teodoro grischy, CAJURU, Curitiba",-25.457303,-49.202953
11647,"rua paulo ziliotto, CAMPINA DO SIQUEIRA, Curitiba",-25.4375037,-49.3131003
11648,"rua capitão ercílio miró, ALTO BOQUEIRÃO, Curitiba",-25.5366987,-49.2366403
11649,"rua ernesto de araújo, JARDIM BOTÂNICO, Curitiba",-25.4423819,-49.2499282
11650,"rua cleide iurk, BOA VISTA, Curitiba",-25.3890283,-49.2342702
11651,"rua desembargador ermelino de leão, CIDADE INDUSTRIAL, Curitiba",-25.4295447,-49.2758828
11652,"rua carlos eduardo leão, ALTO DA GLÓRIA, Curitiba",-25.4220728,-49.2647398
11653,"rua miguel romanel, ÁGUA VERDE, Curitiba",-25.4582459,-49.27174369999999
11654,"rua algacyr manoel voluz, TATUQUARA, Curitiba",-25.5796746,-49.336123
11655,"rua cel. brasílio marques, SÃO LOURENÇO, Curitiba",-25.3804893,-49.2645712
11656,"rua bartolomeu lourenço de gusmão, ALTO BOQUEIRÃO, Curitiba",-25.4957009,-49.2349443
11657,"rua atilio viceli, CIDADE INDUSTRIAL, Curitiba",-25.5040295,-49.3297882
11658,"rua santa madalena de piazzi, SEMINÁRIO, Curitiba",-25.4531865,-49.3034812
11659,"rua joao alencar guimaraes, SANTA QUITÉRIA, Curitiba",-25.4579782,-49.31356299999999
11660,"rua coronel dulcidio, ÁGUA VERDE, Curitiba",-25.4476466,-49.2789041
11661,"rua desembargador oscar carvalho e silva (alto boqueirao), ALTO BOQUEIRÃO, Curitiba",-25.5364888,-49.2318566
11662,"rua eduardo couture, JARDIM DAS AMÉRICAS, Curitiba",-25.4633062,-49.2266018
11663,"rua desembargador hugo simas, CENTRO, Curitiba",-25.4155858,-49.2789131
11664,"rua doutor bley zornig, ATUBA, Curitiba",-25.5129372,-49.2286043
11665,"rua abgail de melo zaneto, CAJURU, Curitiba",-25.4601547,-49.2132111
11666,"rua doutor marins alves de camargo, SANTA CÂNDIDA, Curitiba",-25.3812618,-49.2246654
11667,"rua professor agostinho b.  veiga, SÍTIO CERCADO, Curitiba",-25.5459988,-49.2914284
11668,"rua domenico tonatto, CAJURU, Curitiba",-25.4479048,-49.21743
11669,"rua das conchas, CIDADE INDUSTRIAL, Curitiba",-25.5016556,-49.3406294
11670,"rua coronel anibal dos santos, FANNY, Curitiba",-25.4790887,-49.267289
11671,"rua placido machucheta, ALTO BOQUEIRÃO, Curitiba",-25.5390785,-49.2328419
11672,"rua doutor djalma ferreira lopes, UBERABA, Curitiba",-25.4725234,-49.2420232
11673,"rua quinta do sol, BUTIATUVINHA, Curitiba",-25.4108961,-49.36019839999999
11674,"rua francisco frederico leone, CIDADE INDUSTRIAL, Curitiba",-25.4935407,-49.3483642
11675,"rua teixeira de freitas, SÃO FRANCISCO, Curitiba",-17.5400307,-39.7421813
11676,"rua fernando simas, BATEL, Curitiba",-25.4345683,-49.2873714
11677,"rua francisco juglair, CAMPO COMPRIDO, Curitiba",-25.4384546,-49.33288229999999
11678,"rua josé vendrametto, XAXIM, Curitiba",-25.4933416,-49.26178549999999
11679,"rua monte hermom, PINHEIRINHO, Curitiba",-25.5282752,-49.27043159999999
11680,"rua raphael papa, BAIRRO ALTO, Curitiba",-25.424688,-49.2329738
11681,"rua desembargador vatel goncalves pereira, SÍTIO CERCADO, Curitiba",-25.5363153,-49.2534729
11682,"rua monsenhor ivo zanlorenzi, ÁGUA VERDE, Curitiba",-25.4396686,-49.3330486
11683,"rua bertha lutz, CAJURU, Curitiba",-25.4514673,-49.202416
11684,"rua engenheiro farid surugi, CAPÃO DA IMBUIA, Curitiba",-25.4317515,-49.2216605
11685,"rua delegado naby parana, CAPÃO RASO, Curitiba",-25.4973282,-49.2900903
11686,"rua gottfried werner, SÍTIO CERCADO, Curitiba",-25.5543139,-49.2591919
11687,"rua padre joão bagozzi, PORTÃO, Curitiba",-25.4766986,-49.30256319999999
11688,"rua francisco ader, CAPÃO RASO, Curitiba",-25.4916782,-49.29964349999999
11689,"rua jasmin, SANTA FELICIDADE, Curitiba",-25.4039852,-49.32869170000001
11690,"rua joão prussak, CAMPO DE SANTANA, Curitiba",-25.5959753,-49.33580329999999
11691,"rua hussein ibrain omairy, SÍTIO CERCADO, Curitiba",-25.5536787,-49.259569
11692,"rua ilha de granada, JARDIM SOCIAL, Curitiba",-25.4113857,-49.2367121
11693,"rua jornalista jose cury, CIDADE INDUSTRIAL, Curitiba",-25.4756818,-49.344672
11694,"rua professor paulo d assumpção, UBERABA, Curitiba",-25.4702729,-49.2216341
11695,"rua professor emílio schutz, CAJURU, Curitiba",-25.4808762,-49.3044253
11696,"rua antonio cesar casagrande, PILARZINHO, Curitiba",-25.3928115,-49.2885092
11697,"rua antonio portela, SANTA FELICIDADE, Curitiba",-25.4194293,-49.3377681
11698,"rua josé correia sérgio, FAZENDINHA, Curitiba",-25.4781002,-49.313692
11699,"rua catarina scotti, NOVO MUNDO, Curitiba",-25.4925271,-49.2918982
11700,"rua adolfo ancay, CAMPO DE SANTANA, Curitiba",-25.5872961,-49.3397073
11701,"rua pedro bellon, CAJURU, Curitiba",-25.4496661,-49.20761719999999
11702,"rua angela dall  osto vizoli, SÃO BRAZ, Curitiba",-25.4096348,-49.35331980000001
11703,"rua joão kowal, CIDADE INDUSTRIAL, Curitiba",-25.5143294,-49.3237131
11704,"rua josé vieira de paula, SÍTIO CERCADO, Curitiba",-25.5390605,-49.2607243
11705,"rua lizímaco serapião, NOVO MUNDO, Curitiba",-25.4865267,-49.291742
11706,"rua curupaitis, GANCHINHO, Curitiba",-25.4630129,-49.3051723
11707,"rua josé luiz demeterco, MERCÊS, Curitiba",-25.4165867,-49.280468
11708,"rua darci alcides freitas(cajuru), CAJURU, Curitiba",-25.4514952,-49.1996532
11709,"rua marginal do rio iguaçu, CAJURU, Curitiba",-25.9721109,-51.8158003
11710,"rua rosa ferro cumin, SANTA FELICIDADE, Curitiba",-25.4043347,-49.3325704
11711,"rua maria teixeira de mello, SANTA CÂNDIDA, Curitiba",-25.3686483,-49.214126
11712,"rua emma siglinda da silva, CIDADE INDUSTRIAL, Curitiba",-25.529318,-49.3330717
11713,"rua santo antonio tortato, UBERABA, Curitiba",-25.5718514,-49.3050676
11714,"rua josé araújo filho, BOQUEIRÃO, Curitiba",-25.5117357,-49.2471071
11715,"rua julio bartolomeu taborda luiz, ATUBA, Curitiba",-25.3911194,-49.2111345
11716,"rua júlio fleming, PORTÃO, Curitiba",-25.4540214,-49.2966451
11717,"rua cicero jaime bley, BACACHERI, Curitiba",-25.3977081,-49.2316092
11718,"rua silveira peixoto  a, BATEL, Curitiba",-25.4452933,-49.2852469
11719,"rua toaldo tulio, SÃO BRAZ, Curitiba",-25.4808762,-49.3044253
11720,"rua lineu ferreira do amaral, BOQUEIRÃO, Curitiba",-25.4922678,-49.2462587
11721,"rua anna ciupka, CAMPINA DO SIQUEIRA, Curitiba",-25.4390401,-49.3154052
11722,"rua goiabas, UBERABA, Curitiba",-25.4718488,-49.213134
11723,"rua antonio scheidt, SANTA CÂNDIDA, Curitiba",-25.3702748,-49.209913
11724,"rua ivete maria vargas, SÃO BRAZ, Curitiba",-25.4248866,-49.3464168
11725,"rua deputado fernando ferrari, SÃO LOURENÇO, Curitiba",-25.4020698,-49.2731915
11726,"rua levi alves cordeiro, CAJURU, Curitiba",-22.0693941,-42.3347949
11727,"rua anibal cury, TATUQUARA, Curitiba",50.046162,-5.249872
11728,"rua itambe, SÍTIO CERCADO, Curitiba",-25.5554779,-49.25448859999999
11729,"rua cinco mil, TATUQUARA, Curitiba",-25.5647384,-49.3282697
11730,"rua miguel angelo pelanda, GANCHINHO, Curitiba",-25.5937137,-49.2718016
11731,"rua nossa senhora de fátima, CAPÃO DA IMBUIA, Curitiba",-25.4372863,-49.2278289
11732,"rua afonso theolindo hennequim, GUABIROTUBA, Curitiba",-25.4705332,-49.2403354
11733,"rua joão winter, XAXIM, Curitiba",-25.5185359,-49.2582152
11734,"rua deputado sinval martins de araujo, GANCHINHO, Curitiba",-25.5528004,-49.2463029
11735,"rua genesio de souza nunes, CAJURU, Curitiba",-25.4553957,-49.2038984
11736,"rua nathalia bozza, UMBARÁ, Curitiba",-25.5664799,-49.2828887
11737,"rua doutor heitor baggio, CIDADE INDUSTRIAL, Curitiba",-25.5040612,-49.3353156
11738,"rua rua strobel pinto, CIDADE INDUSTRIAL, Curitiba",-25.48512,-49.3545069
11739,"rua isaac kriger, XAXIM, Curitiba",-25.5235038,-49.2637625
11740,"rua irma anatolia, ABRANCHES, Curitiba",-25.3588187,-49.2684945
11741,"rua pedro soares, SANTA CÂNDIDA, Curitiba",-25.3690362,-49.2364955
11742,"rua rua central, CAJURU, Curitiba",-25.4601547,-49.2132111
11743,"rua sebastiana rodrigues, CIDADE INDUSTRIAL, Curitiba",-25.5063776,-49.3398198
11744,"rua altamiro machado, SANTA FELICIDADE, Curitiba",-25.4194423,-49.3393245
11745,"rua pinhelão, SÍTIO CERCADO, Curitiba",-25.5443488,-49.26656209999999
11746,"rua jose zaleski, CIDADE INDUSTRIAL, Curitiba",-25.5016124,-49.3068258
11747,"rua engenheiro josé, CIDADE INDUSTRIAL, Curitiba",-25.5015668,-49.3449322
11748,"rua marco aurélio malucelli, SANTO INÁCIO, Curitiba",-25.4292613,-49.3430866
11749,"rua cesário kuroski, CIDADE INDUSTRIAL, Curitiba",-25.4601234,-49.3469194
11750,"rua deputado waldemiro pedroso, PORTÃO, Curitiba",-25.4925977,-49.3031071
11751,"rua brasilio itibere, REBOUÇAS, Curitiba",-25.4450551,-49.2637305
11752,"rua constantino alves dos reis, TARUMÃ, Curitiba",-25.4304168,-49.23398450000001
11753,"rua maria aparecida de lima santos, ALTO BOQUEIRÃO, Curitiba",-25.5379973,-49.2367161
11754,"rua curt roters, BOQUEIRÃO, Curitiba",-25.5201837,-49.2446064
11755,"rua rod dos minerios, SANTA CÂNDIDA, Curitiba",-25.2725494,-49.3034777
11756,"rua dona paulina, BACACHERI, Curitiba",-25.394674,-49.2281802
11757,"rua antonio reffo bochino, CAJURU, Curitiba",-25.4601547,-49.2132111
11758,"rua airton sozzi, PINHEIRINHO, Curitiba",-25.5322888,-49.2866528
11759,"rua joacaba, CIDADE INDUSTRIAL, Curitiba",-25.4735155,-49.3452036
11760,"rua leopoldo fróes, PRADO VELHO, Curitiba",-25.46177,-49.2554857
11761,"rua arlene maria hansel, CAJURU, Curitiba",-25.4656167,-49.24071920000001
11762,"rua da bandeira, MERCÊS, Curitiba",-25.4013484,-49.2542869
11763,"rua gianfranco bertoni, SÍTIO CERCADO, Curitiba",-25.5399511,-49.2636634
11764,"rua afonso gonçalves arantes, BOA VISTA, Curitiba",-25.3792285,-49.297556
11765,"rua osiris de brito, CAJURU, Curitiba",-21.2755425,-47.30135320000001
11766,"rua jupiter, SÍTIO CERCADO, Curitiba",-25.5290145,-49.26568409999999
11767,"rua robison ferreira de andrade, UBERABA, Curitiba",-25.4936459,-49.2016976
11768,"rua victor grycajuk, SÃO MIGUEL, Curitiba",-25.5070608,-49.3542131
11769,"rua joao cubas, NOVO MUNDO, Curitiba",-25.4844489,-49.2891127
11770,"rua vicente antonio de oliveira, BARREIRINHA, Curitiba",-25.3686115,-49.2505897
11771,"rua maria goncalves alexandre, CAJURU, Curitiba",-25.4549694,-49.2183145
11772,"rua ladislau veiga, CIDADE INDUSTRIAL, Curitiba",-25.456552,-49.35677949999999
11773,"rua presidente pádua fleury, BOQUEIRÃO, Curitiba",-25.4778274,-49.2531432
11774,"rua joão lourenço de paula, PINHEIRINHO, Curitiba",-25.5327881,-49.2810601
11775,"rua joão sigismundo wysocki, ORLEANS, Curitiba",-25.4285474,-49.374437
11776,"rua comendador bortholo pellanda netto, PINHEIRINHO, Curitiba",-25.5300371,-49.2833705
11777,"rua nicolau jose gravina, SANTA FELICIDADE, Curitiba",-25.4176959,-49.31814300000001
11778,"rua francisco plantes cordeiro, UMBARÁ, Curitiba",-25.5565129,-49.2808759
11779,"rua paulinia, SÍTIO CERCADO, Curitiba",-25.5443488,-49.26656209999999
11780,"rua pedro sebastiao medeiros, ALTO BOQUEIRÃO, Curitiba",-25.52734,-49.24335319999999
11781,"rua jodat nicolas kury, CAMPINA DO SIQUEIRA, Curitiba",-25.438672,-49.3073614
11782,"rua villibaldo josé hoffmann, CAMPO DE SANTANA, Curitiba",-25.5907478,-49.3233013
11783,"rua cecilia aguiale pinto, ALTO BOQUEIRÃO, Curitiba",-25.5365067,-49.23732889999999
11784,"rua vergílio pedro carbonera, SANTA FELICIDADE, Curitiba",-25.4129876,-49.3462289
11785,"rua república oriental do uruguay, BIGORRILHO, Curitiba",-25.4288123,-49.3008406
11786,"rua paulo engel, PINHEIRINHO, Curitiba",-25.526359,-49.2686731
11787,"rua professor jose nogueira dos santos, HAUER, Curitiba",-25.4857482,-49.2591457
11788,"rua oberon floriano dittert, PINHEIRINHO, Curitiba",-25.5380423,-49.3011378
11789,"rua são francisco, PORTÃO, Curitiba",-25.4280348,-49.2704056
11790,"rua maria da luz rockenbauer, SÍTIO CERCADO, Curitiba",-25.5403044,-49.26519099999999
11791,"rua angela gabardo parolin, CAMPO DE SANTANA, Curitiba",-25.5956467,-49.3085007
11792,"rua tenente coronel manoel miguel ribeiro, BOM RETIRO, Curitiba",-25.4147248,-49.2829501
11793,"rua helena grodzinsk, UMBARÁ, Curitiba",-25.5528866,-49.2784321
11795,"rua francisco kleichevicz, ORLEANS, Curitiba",-25.4289098,-49.3471297
11796,"rua francisco frischmann, ÁGUA VERDE, Curitiba",-25.470167,-49.2954332
11797,"rua doutor hugo de barros, CAJURU, Curitiba",-25.4601935,-49.2305719
11798,"rua adam kazimier mazilak, UBERABA, Curitiba",-25.4890823,-49.19736169999999
11799,"rua terminal  do sitio cercado, SÍTIO CERCADO, Curitiba",-25.5443488,-49.26656209999999
11800,"rua cambará, JUVEVÊ, Curitiba",-25.4166521,-49.2576307
11801,"rua victor grycajuck, 121 a, CIDADE INDUSTRIAL, Curitiba",42.9825633,-77.4088794
11802,"rua guilherme tragante, TARUMÃ, Curitiba",-25.4344843,-49.2301927
11803,"rua capitão carlos henrique castor, BOA VISTA, Curitiba",-25.396921,-49.2771912
11804,"rua antonio matheus, UMBARÁ, Curitiba",-25.5653995,-49.2840204
11805,"rua fioravante jose beraldin, CIDADE INDUSTRIAL, Curitiba",-25.4985035,-49.3384346
11806,"rua manoel sebastião borba, XAXIM, Curitiba",-25.5097074,-49.2715113
11807,"rua doutor roberto barrozo, SÃO FRANCISCO, Curitiba",-25.4171952,-49.2758237
11808,"rua senador accioly filho, CENTRO CÍVICO, Curitiba",-25.4974267,-49.3253023
11809,"rua joão micheletto, ALTO BOQUEIRÃO, Curitiba",-25.5317642,-49.2421568
11810,"rua júlio perneta, VISTA ALEGRE, Curitiba",-25.4160082,-49.2873545
11811,"rua candido bonora, CIDADE INDUSTRIAL, Curitiba",-25.5072759,-49.3261732
11812,"rua general djalma da rocha lima, BOQUEIRÃO, Curitiba",40.742551,-84.1052256
11813,"rua puccini, SÃO BRAZ, Curitiba",-25.417635,-49.3509177
11814,"rua avicena, SANTA CÂNDIDA, Curitiba",-25.367013,-49.2111976
11815,"rua elpídio alves assumpção, TINGUI, Curitiba",-25.3932867,-49.2207152
11816,"rua maurício caillet, ÁGUA VERDE, Curitiba",-25.4463818,-49.280296
11817,"rua josé antoniassi, VISTA ALEGRE, Curitiba",-25.4133238,-49.2869578
11818,"rua antonio leocadio pimentel, ATUBA, Curitiba",-25.3868504,-49.1968174
11819,"rua doutor bley zornig, UBERABA, Curitiba",-25.5100235,-49.22137499999999
11820,"rua clementina mehl muhlmann, TINGUI, Curitiba",-25.388492,-49.22059729999999
11821,"rua laura rodrigues macedo, CIDADE INDUSTRIAL, Curitiba",-25.5405498,-49.3362106
11822,"rua professor léo kessler, JARDIM DAS AMÉRICAS, Curitiba",-25.4567477,-49.2391708
11823,"rua agua verde, ÁGUA VERDE, Curitiba",-25.4535428,-49.2837554
11824,"rua joão dalla stella, SANTA FELICIDADE, Curitiba",-25.4008699,-49.3278371
11825,"rua raposo tavares, TINGUI, Curitiba",-25.4808762,-49.3044253
11826,"rua professor luiz carlos lima, CAJURU, Curitiba",-25.4822813,-49.1960333
11827,"rua afonso camargo, CAJURU, Curitiba",-25.4399407,-49.2279898
11828,"rua ghaze saleh, TINGUI, Curitiba",-25.3814106,-49.2208815
11829,"rua doutor lysandro santos lima, CIDADE INDUSTRIAL, Curitiba",-25.5131878,-49.3254963
11830,"rua savigny, BARREIRINHA, Curitiba",-25.3777091,-49.2600254
11831,"rua professor euro brandão, PORTÃO, Curitiba",-25.4765694,-49.2921272
11832,"rua piquiri, PAROLIN, Curitiba",-25.4465817,-49.26010429999999
11833,"rua duque de caxias, CENTRO CÍVICO, Curitiba",-22.7862985,-43.3053106
11834,"rua ada cazemir mazilak, UBERABA, Curitiba",-19.7473668,-47.93915399999999
11835,"rua joao durvalino borba, CAJURU, Curitiba",-21.2755425,-47.30135320000001
11836,"rua general potiguara, PORTÃO, Curitiba",-25.4890834,-49.31717399999999
11837,"rua professor joao doetzer, JARDIM DAS AMÉRICAS, Curitiba",-25.463742,-49.222947
11838,"rua maria chinazzo, CAJURU, Curitiba",-25.4549694,-49.2183145
11839,"rua padre jose rafael kalinoski, PINHEIRINHO, Curitiba",-25.5265276,-49.2759899
11840,"rua augustro stresser, ALTO DA GLÓRIA, Curitiba",-25.4170897,-49.2513792
11841,"rua estação tubo santa bernadete, FANNY, Curitiba",-25.4851218,-49.2669936
11842,"rua br cento e dezesseis, BOQUEIRÃO, Curitiba",-25.4808762,-49.3044253
11843,"rua santa filomena, HUGO LANGE, Curitiba",-25.4175998,-49.2435122
11844,"rua felisbino passos, ATUBA, Curitiba",-25.3836334,-49.2188257
11845,"rua antonio valentin, CAPÃO DA IMBUIA, Curitiba",-25.4390119,-49.2141361
11846,"rua luciano guimarães de gracia, TABOÃO, Curitiba",-25.3728563,-49.27622359999999
11847,"rua conselheiro laurindo, NOVO MUNDO, Curitiba",-25.44007,-49.2603528
11848,"rua margarida pionario moro, CENTRO, Curitiba",-25.4808762,-49.3044253
11849,"rua santa ângela de foligno, CIDADE INDUSTRIAL, Curitiba",-25.5118342,-49.3202493
11850,"rua josé xavier, SANTA FELICIDADE, Curitiba",-25.4165123,-49.3543635
11851,"rua evaldo wendler, SÃO LOURENÇO, Curitiba",-25.3945117,-49.2725646
11852,"rua 14 de julho, ALTO BOQUEIRÃO, Curitiba",-25.526002,-49.2546679
11853,"rua baltazar carrasco dos reis, JARDIM BOTÂNICO, Curitiba",-25.4449256,-49.25575360000001
11854,"rua reinaldo são braz fabrim, CAJURU, Curitiba",-25.4483563,-49.2188464
11855,"rua luiz carlos bruginski, CAJURU, Curitiba",-25.4724553,-49.32305969999999
11856,"rua eugenio jose de souza, GUAÍRA, Curitiba",-25.4682063,-49.27856509999999
11857,"rua amelia rocio dos santos, CIDADE INDUSTRIAL, Curitiba",-25.5174052,-49.3273326
11858,"rua octavio sylvio nicco, SANTA FELICIDADE, Curitiba",-25.4346379,-49.3364444
11859,"rua reinaldo de carvalho bola, GANCHINHO, Curitiba",-25.5564456,-49.2498556
11860,"rua victorio estevam, CIDADE INDUSTRIAL, Curitiba",-25.4808762,-49.3044253
11861,"rua izolda teixeira domingues., CAJURU, Curitiba",-25.4469337,-49.1999027
11862,"rua bine gersten reiss, CAJURU, Curitiba",-25.4396538,-49.2250179
11863,"rua vicente machado, SEMINÁRIO, Curitiba",-25.4389025,-49.2912399
11864,"rua francisco alves ribeiro filho, CAJURU, Curitiba",-25.4623059,-49.2092408
11865,"rua dino bertoldi, TARUMÃ, Curitiba",-25.4251077,-49.2228893
11866,"rua joao alfredo jobbins, CIDADE INDUSTRIAL, Curitiba",-25.500244,-49.31495839999999
11867,"rua parque são lourenço, SÃO LOURENÇO, Curitiba",-25.3817284,-49.2669278
11868,"rua dante honório, SÍTIO CERCADO, Curitiba",-25.5101048,-49.2705272
11869,"rua bassamo de grappa, SANTA FELICIDADE, Curitiba",-25.3964271,-49.3210531
11870,"rua jacob paykala, ATUBA, Curitiba",-25.3720058,-49.2097698
11871,"rua maria regina predebon vanzo, NOVO MUNDO, Curitiba",-25.4822892,-49.3066247
11872,"rua jose marcelino da silva junior, CAPÃO RASO, Curitiba",-25.5033053,-49.3112821
11873,"rua tenente arailton vicente alves, UMBARÁ, Curitiba",-25.5316067,-49.2728918
11874,"rua anita garibaldi, SANTA CÂNDIDA, Curitiba",-25.3805505,-49.2614333
11875,"rua durval leopoldo landal, CAMPO DE SANTANA, Curitiba",-25.4874869,-49.3509665
11876,"rua roni eldo de albuquerque, BAIRRO ALTO, Curitiba",-25.4180052,-49.2123577
