,Endereco,LATITUDE,LONGITUDE
1006,"rua  jandaia do sul, SÍTIO CERCADO, Curitiba",-25.5542486,-49.2540622
1007,"rua  brigadeiro eduardo gomes, CAJURU, Curitiba",-25.5194927,-49.28614109999999
1008,"rua nicolau josé gravina, SANTA FELICIDADE, Curitiba",-25.4176959,-49.31814300000001
1009,"rua expedicionário  francisco a  de oliveira, SÍTIO CERCADO, Curitiba",-25.5388496,-49.2473529
1010,"rua antonio moacir ribeiro batista, CIDADE INDUSTRIAL, Curitiba",-25.49947,-49.3216542
1011,"rua mariano torres, REBOUÇAS, Curitiba",-25.4359191,-49.2602639
1012,"rua lourival wendler, CAJURU, Curitiba",-25.4690437,-49.2096127
1013,"rua adelina ferreira muller lt e e  copel, SÃO BRAZ, Curitiba",-25.4214621,-49.3381423
1014,"rua  joão batista scucato, ATUBA, Curitiba",-25.3840221,-49.2009531
1015,"rua joão batista scucato, ATUBA, Curitiba",-25.3840221,-49.2009531
1016,"rua sete de setembro, PORTÃO, Curitiba",-25.4401856,-49.273565
1017,"rua est. guilherme weigert, SANTA CÂNDIDA, Curitiba",-25.3565388,-49.2380363
1018,"rua guilherme weigert, SANTA CÂNDIDA, Curitiba",-25.3610197,-49.2317468
1019,"rua  josé teixeira de mello, FAZENDINHA, Curitiba",-25.4858249,-49.3260841
1020,"rua  winston churchil, CAPÃO RASO, Curitiba",-25.5067755,-49.2957937
1021,"rua helena moscibroski borges, CAPÃO DA IMBUIA, Curitiba",-25.435114,-49.2219724
1022,"rua jose alcides de lima, NOVO MUNDO, Curitiba",-25.4926192,-49.3065644
1023,"rua carlos benato, SÃO BRAZ, Curitiba",-25.4068111,-49.35012589999999
1024,"rua rubens maister, BARREIRINHA, Curitiba",-25.3766606,-49.2603848
1025,"rua joão parolin, PRADO VELHO, Curitiba",-25.4574966,-49.2591433
1026,"rua marechal rondon, CAPÃO RASO, Curitiba",-25.511165,-49.300933
1027,"rua arthur martins franco, FAZENDINHA, Curitiba",-25.4871197,-49.33604649999999
1028,"rua ney itibere pia de andrade, SANTO INÁCIO, Curitiba",-25.4233092,-49.323065
1029,"rua  iguaçú, ÁGUA VERDE, Curitiba",-25.4471259,-49.2823466
1030,"rua lori victor culack, FAZENDINHA, Curitiba",-25.4780946,-49.325892
1031,"rua antonio jacomazi, ALTO BOQUEIRÃO, Curitiba",-25.5273766,-49.2331197
1032,"rua manoel aristides de farias, BARREIRINHA, Curitiba",-25.3686642,-49.2521853
1033,"rua senador alencar guimarães, CENTRO, Curitiba",-25.4343259,-49.2745061
1034,"rua júlio eduardo gineste, SANTA QUITÉRIA, Curitiba",-25.458443,-49.31142639999999
1035,"rua ferrara, SANTA FELICIDADE, Curitiba",-25.3966692,-49.3121007
1036,"rua marquês do paraná, ÁGUA VERDE, Curitiba",-25.460388,-49.2865602
1037,"rua elsa luttmann, UBERABA, Curitiba",-25.48842,-49.199803
1038,"rua erasmo maeder, BAIRRO ALTO, Curitiba",-25.4171804,-49.2105982
1039,"rua ney pacheco, CIDADE INDUSTRIAL, Curitiba",-25.5303969,-49.3369949
1040,"rua joão fuggiato, SÍTIO CERCADO, Curitiba",-25.5396297,-49.25076199999999
1041,"rua durval pacheco de carvalho, FANNY, Curitiba",-25.4799531,-49.2680014
1042,"rua rio grande do sul, ÁGUA VERDE, Curitiba",-25.4662664,-49.2825946
1043,"rua zoologico do boqueirão, BOQUEIRÃO, Curitiba",-25.5030083,-49.2367172
1044,"rua ricardo padovani filho, CIDADE INDUSTRIAL, Curitiba",-25.496094,-49.33731290000001
1045,"rua guilherme fugmann, CIDADE INDUSTRIAL, Curitiba",-25.5007956,-49.3225147
1046,"rua manoel celestino boaventura, SÃO BRAZ, Curitiba",-25.4131943,-49.3556721
1047,"rua  laudelino ferreira lopes, CAPÃO RASO, Curitiba",-25.5055742,-49.3045792
1048,"rua juscelino kubitschek de oliveira ec, SÍTIO CERCADO, Curitiba",-25.4901584,-49.3446295
1049,"rua juscelino kubitschek de oliveira ec, SANTA CÂNDIDA, Curitiba",-25.4901584,-49.3446295
1050,"rua doutor aluízio frança, SANTO INÁCIO, Curitiba",-25.4254907,-49.3063668
1051,"rua  marechal floriano peixoto, REBOUÇAS, Curitiba",-25.4454801,-49.2648526
1052,"rua  teófilo otoni, CAJURU, Curitiba",-25.4564925,-49.2107885
1053,"rua marco polo, CIDADE INDUSTRIAL, Curitiba",-25.4182954,-49.2048529
1054,"rua jardim alegre, SÍTIO CERCADO, Curitiba",-25.5520173,-49.2526263
1055,"rua nd                  av contorno leste, UMBARÁ, Curitiba",-25.5528225,-49.2776234
1056,"rua  clávio molinari, CAJURU, Curitiba",-25.4396,-49.2114482
1057,"rua kellers, SÃO FRANCISCO, Curitiba",-25.4272309,-49.2767894
1058,"rua nilson gomes ramos, ABRANCHES, Curitiba",-25.3606478,-49.276718
1059,"rua moacir potier, XAXIM, Curitiba",-25.5041773,-49.2666299
1060,"rua brasília, XAXIM, Curitiba",-25.5064759,-49.26414949999999
1061,"rua das goiabeiras, CIDADE INDUSTRIAL, Curitiba",-25.4900411,-49.352723
1062,"rua arnaldo gusi, XAXIM, Curitiba",-25.5262648,-49.25990909999999
1063,"rua paulo fagnani, SÍTIO CERCADO, Curitiba",-25.5582763,-49.25869789999999
1064,"rua elza ribeiro, XAXIM, Curitiba",-25.5269141,-49.25791599999999
1065,"rua  joaquim cardoso da silveira, BOQUEIRÃO, Curitiba",-25.5065322,-49.22092989999999
1066,"rua orlando de moura leite, BARREIRINHA, Curitiba",-25.3721038,-49.2558715
1067,"rua cassemiro mikissuqi, CAMPO COMPRIDO, Curitiba",-25.4668761,-49.3274627
1068,"rua henrique correia, BAIRRO ALTO, Curitiba",-25.4066671,-49.2032163
1069,"rua josé alcides de lima, NOVO MUNDO, Curitiba",-25.4926192,-49.3065644
1070,"rua josé serrato, SANTA CÂNDIDA, Curitiba",-25.3780163,-49.23550729999999
1071,"rua herculano carlos franco de souza, ÁGUA VERDE, Curitiba",-25.450961,-49.2927696
1072,"rua alcino guanabara, HAUER, Curitiba",-25.4832797,-49.2530541
1073,"rua das andorinhas, NOVO MUNDO, Curitiba",-25.4923907,-49.2853187
1074,"rua frederico escorsin, SÃO BRAZ, Curitiba",-25.4207766,-49.3612749
1075,"rua jornalista caio machado, SANTA QUITÉRIA, Curitiba",-25.455932,-49.31032769999999
1076,"rua benedito frança, CAPÃO DA IMBUIA, Curitiba",-25.4382562,-49.2063651
1077,"rua maria teodoro vilalva, CIDADE INDUSTRIAL, Curitiba",-25.505931,-49.3221815
1078,"rua santa bernadethe, LINDÓIA, Curitiba",-25.4808988,-49.2745927
1079,"rua lodovico geronazzo, BOA VISTA, Curitiba",-25.3853567,-49.2476789
1080,"rua josé risseto, SANTA FELICIDADE, Curitiba",-25.4106946,-49.3334116
1081,"rua doutor hugo camargo, CIDADE INDUSTRIAL, Curitiba",-25.4949583,-49.3461814
1082,"rua méxico, BACACHERI, Curitiba",-25.4078259,-49.2382274
1083,"rua camile flammarion, BARREIRINHA, Curitiba",-25.3695761,-49.2538594
1084,"rua norberto tramujas decker, SANTO INÁCIO, Curitiba",-25.4244291,-49.3380746
1085,"rua da lua, SÍTIO CERCADO, Curitiba",-25.5309178,-49.2619633
1086,"rua  presidente affonso camargo, JARDIM BOTÂNICO, Curitiba",-25.4353638,-49.2573899
1087,"rua jocelino kubscheck, CIDADE INDUSTRIAL, Curitiba",-25.4506781,-49.355733
1088,"rua  luiz carlos canesso, ALTO BOQUEIRÃO, Curitiba",-25.5337832,-49.2395474
1089,"rua visconde de nacar, CENTRO, Curitiba",-25.4290968,-49.27964679999999
1090,"rua francisco scorsato, SÍTIO CERCADO, Curitiba",-25.5404763,-49.2529031
1091,"rua antonio bertoldi, CAMPO DE SANTANA, Curitiba",-25.5895655,-49.3385421
1092,"rua professor pedro viriato parigot de souza, MOSSUNGUÊ, Curitiba",-25.4358787,-49.3265474
1093,"rua thales de paula da silva, CIDADE INDUSTRIAL, Curitiba",-25.5040295,-49.3297882
1094,"rua  ernani santiago de oliveira, CENTRO CÍVICO, Curitiba",-25.4165107,-49.26842509999999
1095,"rua  av. do trabalhador (cajuru), CAJURU, Curitiba",-25.4541704,-49.2141019
1096,"rua lodovico kaminski, CIDADE INDUSTRIAL, Curitiba",-25.4755627,-49.3590222
1097,"rua  cataratas do iguaçú, ATUBA, Curitiba",-25.3835286,-49.1980191
1098,"rua presidente wenceslau braz, GUAÍRA, Curitiba",-25.4716523,-49.2624678
1099,"rua  senador accioly filho, CIDADE INDUSTRIAL, Curitiba",-25.4974267,-49.3253023
1100,"rua luiz delfino, SANTA QUITÉRIA, Curitiba",-25.4688832,-49.3139641
1101,"rua luiz gallieri, UBERABA, Curitiba",-25.4932486,-49.21719
1102,"rua tomaz paris, SÃO BRAZ, Curitiba",-25.412473,-49.3575531
1103,"rua pedro leineker, CIDADE INDUSTRIAL, Curitiba",-25.5281949,-49.334827
1104,"rua ignes de souza soares, TATUQUARA, Curitiba",-25.5498496,-49.29864389999999
1105,"rua rua francisco alves de oliveira, CAJURU, Curitiba",-25.5388496,-49.2473529
1106,"rua lia garbaccio, TATUQUARA, Curitiba",-25.5634608,-49.3185797
1107,"rua emanoel ernesto bertoldi, CAMPO DE SANTANA, Curitiba",-25.5881313,-49.3358285
1108,"rua carlos guimarães, SÍTIO CERCADO, Curitiba",-25.5443701,-49.25519449999999
1109,"rua doutor francisco natel de camargo, BOA VISTA, Curitiba",-25.3719241,-49.2432059
1110,"rua dr. josé palú, NOVO MUNDO, Curitiba",-25.4826597,-49.2883265
1111,"rua pedro mossoline gasparin, SANTA FELICIDADE, Curitiba",-25.3801092,-49.33215269999999
1112,"rua capitão guilherme inche, CAJURU, Curitiba",-25.4562781,-49.21097109999999
1113,"rua domingos benatto, BUTIATUVINHA, Curitiba",-25.403801,-49.3594538
1114,"rua cidade de coronel freitas, CAMPO COMPRIDO, Curitiba",-25.4545252,-49.3537853
1115,"rua durvalina purfiria dos santos, CIDADE INDUSTRIAL, Curitiba",-25.5085224,-49.3255692
1116,"rua neusa de fátima ferreira, PINHEIRINHO, Curitiba",-25.5284407,-49.2754747
1117,"rua edviges sofia valesko, XAXIM, Curitiba",-25.5064759,-49.26414949999999
1118,"rua josé tomasi, SANTA FELICIDADE, Curitiba",-25.4152925,-49.3391204
1119,"rua cezar constante schiavon, SÍTIO CERCADO, Curitiba",-25.5514605,-49.267839
1120,"rua abel scuissiato, PORTÃO, Curitiba",-25.469744,-49.2818049
1121,"rua inair da silva duarte, PINHEIRINHO, Curitiba",-25.5326912,-49.28198769999999
1122,"rua professora antonia reginato vianna, CAPÃO DA IMBUIA, Curitiba",-25.4356983,-49.2093463
1123,"rua do ibitirati, UBERABA, Curitiba",-25.4805652,-49.20181299999999
1124,"rua herbert neal, SANTA QUITÉRIA, Curitiba",-25.4613903,-49.31629890000001
1125,"rua são cristóvao, GUAÍRA, Curitiba",-25.4706487,-49.2758496
1126,"rua manoel dos santos, UBERABA, Curitiba",-25.4884943,-49.2283584
1127,"rua  coronel francisco h dos santos, JARDIM DAS AMÉRICAS, Curitiba",-25.4543647,-49.2302153
1128,"rua sérgio amaury lustosa, CAMPO DE SANTANA, Curitiba",-25.5843643,-49.3411984
1129,"rua pedro n pizzatto, MERCÊS, Curitiba",-25.4261552,-49.2902222
1130,"rua jornalista silvino a. batista, TATUQUARA, Curitiba",-25.56451,-49.33288839999999
1131,"rua theodoro makiolka, SANTA CÂNDIDA, Curitiba",-25.367401,-49.238242
1132,"rua inácio martins, XAXIM, Curitiba",-25.5085965,-49.2577414
1133,"rua zeferino da costa, XAXIM, Curitiba",-25.514298,-49.2787211
1134,"rua arnold ferreira veloso, CIDADE INDUSTRIAL, Curitiba",-25.4289541,-49.267137
1135,"rua aristides borsato, FAZENDINHA, Curitiba",-25.47906,-49.3174696
1136,"rua waldemar kost, HAUER, Curitiba",-25.4852738,-49.2526187
1137,"rua cláudio erbano, SÍTIO CERCADO, Curitiba",-25.5471666,-49.2586106
1138,"rua agustin cortizo penelas, SÍTIO CERCADO, Curitiba",-25.5311242,-49.27150409999999
1139,"rua dagoberto de moura, PINHEIRINHO, Curitiba",-25.5314581,-49.2836133
1140,"rua josé alcides de lima, PINHEIRINHO, Curitiba",-25.5124909,-49.3062704
1141,"rua araruna, SÍTIO CERCADO, Curitiba",-25.5420915,-49.2891602
1142,"rua santa regina, CAPÃO RASO, Curitiba",-25.5023397,-49.2898424
1143,"rua vadislau burginski varchaki, ABRANCHES, Curitiba",-25.5902514,-49.34264659999999
1144,"rua harvey de barros silva, PILARZINHO, Curitiba",-25.3910489,-49.2931855
1145,"rua sebastião alves ferreira, BAIRRO ALTO, Curitiba",-25.4086216,-49.20423719999999
1146,"rua joel pedrini, UBERABA, Curitiba",-25.4893523,-49.2285553
1147,"rua irmão libério plêwnia, CAJURU, Curitiba",-25.4705229,-49.1946873
1148,"rua celso luiz peixoto ribas, CAMPO COMPRIDO, Curitiba",-25.4664734,-49.3211908
1149,"rua munhoz da rocha, BACACHERI, Curitiba",-25.4054584,-49.2471961
1150,"rua iguaçú, REBOUÇAS, Curitiba",-25.4423319,-49.2695849
1151,"rua fagundes varela, JARDIM SOCIAL, Curitiba",-25.4145728,-49.2326231
1152,"rua aref kudri, PINHEIRINHO, Curitiba",-25.5203702,-49.2980109
1153,"rua helena carcereri pikarski, UBERABA, Curitiba",-25.4890003,-49.19995180000001
1154,"rua  joão miqueletto, ALTO BOQUEIRÃO, Curitiba",-25.5517523,-49.23478309999999
1155,"rua munhoz da rocha, CABRAL, Curitiba",-25.4073645,-49.2480343
1156,"rua paulo rio branco de macedo, SÍTIO CERCADO, Curitiba",-25.5497932,-49.2654545
1157,"rua maria augusta soares, SÍTIO CERCADO, Curitiba",-25.5412969,-49.2704007
1158,"rua joão negrão, REBOUÇAS, Curitiba",-25.4455462,-49.25909739999999
1159,"rua dos ferroviários, CAJURU, Curitiba",-25.4505226,-49.2076132
1160,"rua velha do barigui, CIDADE INDUSTRIAL, Curitiba",-25.4942291,-49.3450126
1161,"rua engenheiro niépce da silva, PORTÃO, Curitiba",-25.4713064,-49.29146309999999
1162,"rua  frederico stadler junior, CAPÃO DA IMBUIA, Curitiba",-25.436511,-49.2155134
1163,"rua humberto bertoldi, CIDADE INDUSTRIAL, Curitiba",-25.5851417,-49.3386024
1164,"rua victor ferreira do amaral, ALTO DA RUA XV, Curitiba",-25.427371,-49.23681999999999
1165,"rua santa edwiges, ABRANCHES, Curitiba",-25.3564835,-49.2738858
1166,"rua  cândido hartmann, SANTA FELICIDADE, Curitiba",-25.4214015,-49.3220827
1167,"rua professor kydd james galliano, CASCATINHA, Curitiba",-25.4087259,-49.3116839
1168,"rua anita garibaldi, CACHOEIRA, Curitiba",-25.3565185,-49.2635362
1169,"rua rua eunice betine bartoszeck, CAJURU, Curitiba",-25.4864573,-49.2036619
1170,"rua céu azul, SANTA CÂNDIDA, Curitiba",-25.3684036,-49.2081217
1171,"rua aparecida feliciano caetano, CIDADE INDUSTRIAL, Curitiba",-25.5168198,-49.3316348
1172,"rua  cidade de coronel freitas, CAMPO COMPRIDO, Curitiba",-25.4545252,-49.3537853
1173,"rua paraíba, GUAÍRA, Curitiba",-25.470164,-49.2776453
1174,"rua manoel hygino dos santos, GUAÍRA, Curitiba",-25.46774,-49.2698422
1175,"rua professor josé maurício higgins, XAXIM, Curitiba",-25.4990237,-49.2540912
1176,"rua mario mendes de lara, UBERABA, Curitiba",-25.4813787,-49.2317099
1177,"rua beija flor, ALTO BOQUEIRÃO, Curitiba",-25.5184934,-49.1700052
1178,"rua vicente de carvalho, CAJURU, Curitiba",-25.4517591,-49.2226809
1179,"rua marechal otavio saldanha mazza, CAPÃO RASO, Curitiba",-25.5085244,-49.2974064
1180,"rua heitor stockler de frança, CENTRO CÍVICO, Curitiba",-25.4228599,-49.2685898
1181,"rua avenida canal, ALTO BOQUEIRÃO, Curitiba",-25.5617361,-49.2523512
1182,"rua theophilo mansur, NOVO MUNDO, Curitiba",-25.4926263,-49.3083997
1183,"rua cid marcondes de albuquerque, SÍTIO CERCADO, Curitiba",-25.5262949,-49.2676847
1184,"rua oliveira viana, HAUER, Curitiba",-25.4832372,-49.2547097
1185,"rua xanxerê, CIDADE INDUSTRIAL, Curitiba",-25.4631043,-49.3442763
1186,"rua 1 de maio, BOQUEIRÃO, Curitiba",-25.5138195,-49.2783394
1187,"rua jaime reis, UMBARÁ, Curitiba",-25.4263896,-49.2768453
1188,"rua da divina providência, SANTA QUITÉRIA, Curitiba",-25.4600725,-49.3101744
1189,"rua saldanha marinho, BIGORRILHO, Curitiba",-25.4366071,-49.2925239
1190,"rua joão bientinez, CAPÃO DA IMBUIA, Curitiba",-25.4390689,-49.2221622
1191,"rua joao bientinez, CAPÃO DA IMBUIA, Curitiba",-25.4390689,-49.2221622
1192,"rua  professora maria de assumpção, HAUER, Curitiba",-25.4832902,-49.25040310000001
1193,"rua ibiporã, ALTO BOQUEIRÃO, Curitiba",-25.5373326,-49.24062869999999
1194,"rua osório damas de oliveira, PINHEIRINHO, Curitiba",-25.5212785,-49.3045996
1195,"rua joão manoel geremias, SANTA CÂNDIDA, Curitiba",-25.3637725,-49.2266337
1196,"rua josé gulin, BACACHERI, Curitiba",-25.3951271,-49.2194791
1197,"rua iporã, ALTO BOQUEIRÃO, Curitiba",-25.5314795,-49.23536559999999
1198,"rua engenheiros rebouças, REBOUÇAS, Curitiba",-25.4427616,-49.26188639999999
1199,"rua santo bozzi, XAXIM, Curitiba",-25.5087048,-49.2646295
1200,"rua lourenço garzaro, BUTIATUVINHA, Curitiba",-25.3912176,-49.3542222
1201,"rua augusto litz, SANTA FELICIDADE, Curitiba",-25.3906762,-49.3338972
1202,"rua prefeito samuel mileo, SÍTIO CERCADO, Curitiba",-25.5399412,-49.2545461
1203,"rua coronel luiz josé dos santos, BOQUEIRÃO, Curitiba",-25.4980576,-49.2461272
1204,"rua jurandir mendes de lima (radialista jurandir carioca), SÍTIO CERCADO, Curitiba",-25.5554978,-49.2481186
1205,"rua cruz machado, CENTRO, Curitiba",-25.4304931,-49.2754906
1206,"rua almirante gonçalves, REBOUÇAS, Curitiba",-25.446843,-49.264283
1207,"rua izidoro wosch, SANTA CÂNDIDA, Curitiba",-25.3669426,-49.2450903
1208,"rua dona eleusina plaisant, SANTA QUITÉRIA, Curitiba",-25.4620358,-49.3134068
1209,"rua padre francisco madej, SANTA FELICIDADE, Curitiba",-25.4378056,-49.3568368
1210,"rua  joão batista zagonel passos, XAXIM, Curitiba",-25.5215411,-49.26125740000001
1211,"rua agenor antonio rodrigues, SÍTIO CERCADO, Curitiba",-25.5432227,-49.2566293
1212,"rua r. angelo marqueto, AUGUSTA, Curitiba",-25.4746593,-49.3749237
1213,"rua othon cristovao cescatto, SÍTIO CERCADO, Curitiba",-25.539215,-49.2732231
1214,"rua  antônio zanon, TATUQUARA, Curitiba",-25.5677822,-49.3221379
1215,"rua  desembargador carlos pinheiro guimaraes, SÍTIO CERCADO, Curitiba",-25.5443701,-49.25519449999999
1216,"rua brasília, NOVO MUNDO, Curitiba",-25.494606,-49.2838158
1217,"rua angelo marqueto, AUGUSTA, Curitiba",-25.4746593,-49.3749237
1218,"rua joão estevão dos santos, NOVO MUNDO, Curitiba",-25.5289153,-49.27876209999999
1219,"rua  cidade de coronel freitas, CIDADE INDUSTRIAL, Curitiba",-25.4545252,-49.3537853
1220,"rua alcides munhoz, SANTO INÁCIO, Curitiba",-25.4201205,-49.2937436
1221,"rua são paulo, GUAÍRA, Curitiba",-25.4671717,-49.2774543
1222,"rua desembagador cid campelo, CIDADE INDUSTRIAL, Curitiba",-25.49842,-49.337959
1223,"rua rodolfo augusto, ALTO BOQUEIRÃO, Curitiba",-25.5297234,-49.2450817
1224,"rua presidente carlos cavalcanti, CENTRO, Curitiba",-25.4254857,-49.2732076
1225,"rua jose bajerski, ABRANCHES, Curitiba",-25.3592971,-49.27236509999999
1226,"rua engenheiro benedito mario da silva, CAJURU, Curitiba",-25.4695338,-49.20579009999999
1227,"rua doutor luiz losso filho, NOVO MUNDO, Curitiba",-25.4900577,-49.3111699
1228,"rua natalio fagundes, PINHEIRINHO, Curitiba",-25.5224217,-49.2936673
1229,"rua milena costa, PILARZINHO, Curitiba",-25.3952221,-49.29327300000001
1230,"rua salvador josé correia coelho, CIDADE INDUSTRIAL, Curitiba",-25.4528141,-49.3568533
1231,"rua  presidente wenceslau braz, GUAÍRA, Curitiba",-25.4716523,-49.2624678
1232,"rua  odir gomes da rocha, TATUQUARA, Curitiba",-25.5730183,-49.3351395
1233,"rua  travessa 97, SÍTIO CERCADO, Curitiba",-25.5443488,-49.26656209999999
1234,"rua pastor waldomiro bileski, SÍTIO CERCADO, Curitiba",-25.5429877,-49.2613677
1235,"rua ministro flavio suplicy de lacerda, SÍTIO CERCADO, Curitiba",-25.5485326,-49.2574182
1236,"rua rodolfo bernardelli, UBERABA, Curitiba",-25.4890483,-49.2262657
1237,"rua  eugênio josé de souza, GUAÍRA, Curitiba",-25.4682063,-49.27856509999999
1238,"rua  paraná, BACACHERI, Curitiba",-25.3924694,-49.2394589
1239,"rua maestro carlos frank, BOQUEIRÃO, Curitiba",-25.5200534,-49.2353157
1240,"rua  jornalista geraldo russe, PILARZINHO, Curitiba",-25.3894342,-49.2947585
1241,"rua  sebastião marcos luiz, CAJURU, Curitiba",-25.4616164,-49.2042023
1242,"rua manoel valdomiro de macedo, PILARZINHO, Curitiba",-25.5142532,-49.3182753
1243,"rua joão antônio xavier, ÁGUA VERDE, Curitiba",-25.4574783,-49.2769673
1244,"rua professora maria de assumpção, BOQUEIRÃO, Curitiba",-25.4879895,-49.2481352
1245,"rua nossa senhora da paz, BOQUEIRÃO, Curitiba",-25.5094318,-49.2290016
1246,"rua joão augusto martins, CAMPO COMPRIDO, Curitiba",-25.4573006,-49.3452448
1247,"rua prof ruy jose rache, CAJURU, Curitiba",-25.4668428,-49.19899969999999
1248,"rua pedro bonders, CIDADE INDUSTRIAL, Curitiba",-25.504151,-49.31519420000001
1249,"rua   dr  luis bettega, CAJURU, Curitiba",-25.4609672,-49.196028
1250,"rua cras iracema, CAJURU, Curitiba",-25.4613978,-49.2143582
1251,"rua  monsenhor celso, CENTRO, Curitiba",-25.4317002,-49.2704132
1252,"rua senador josé alencar, CENTRO, Curitiba",-25.4351674,-49.2754909
1253,"rua professor antonio martins franco, NOVO MUNDO, Curitiba",-25.4889028,-49.279353
1254,"rua rocha pombo, JUVEVÊ, Curitiba",-25.4140235,-49.2589216
1255,"rua tenente coronel joão antônio ramalho, JARDIM DAS AMÉRICAS, Curitiba",-25.4696808,-49.2311425
1256,"rua paissandu, SÍTIO CERCADO, Curitiba",-25.5339146,-49.27061639999999
1257,"rua filosofo huberto rohden, TABOÃO, Curitiba",-25.5402949,-49.2741023
1258,"rua chile, REBOUÇAS, Curitiba",-25.4490854,-49.2614786
1259,"rua vereador antenor pamphilo dos santos, VISTA ALEGRE, Curitiba",-25.4090925,-49.2995698
1260,"rua professora maria de assumpção, HAUER, Curitiba",-25.4832902,-49.25040310000001
1261,"rua faxinal, AUGUSTA, Curitiba",-25.4554007,-49.3756133
1262,"rua roberto faria, FANNY, Curitiba",-25.4738183,-49.2613582
1263,"rua  da divina providência, SANTA QUITÉRIA, Curitiba",-25.4600725,-49.3101744
1264,"rua dr rafael semili ribeiro, CIDADE INDUSTRIAL, Curitiba",-25.5006793,-49.3383997
1265,"rua baltazar carrasco dos reis, REBOUÇAS, Curitiba",-25.4479358,-49.2635941
1266,"rua padre karol dworaczeck, CAJURU, Curitiba",-25.4698124,-49.1947023
1267,"rua tv. alexandre gutierrez beltrao, SÍTIO CERCADO, Curitiba",-25.5385548,-49.2652461
1268,"rua joão gbur, BOA VISTA, Curitiba",-25.3812255,-49.230652
1269,"rua professor licio de lima, NOVO MUNDO, Curitiba",-25.4916536,-49.2790733
1270,"rua joão fonseca mercer, ATUBA, Curitiba",-25.3816953,-49.216989
1271,"rua guilherme de souza valente, ABRANCHES, Curitiba",-25.3676091,-49.2717061
1272,"rua marcos andreatta, MOSSUNGUÊ, Curitiba",-25.4333733,-49.3309633
1273,"rua desembargador westphalen, CENTRO, Curitiba",-25.4375022,-49.2706537
1274,"rua joão geara, PORTÃO, Curitiba",-25.4670328,-49.29138990000001
1275,"rua rosa trevisan, SANTA FELICIDADE, Curitiba",-25.3998593,-49.34372490000001
1276,"rua r. imaculada conceicao, PRADO VELHO, Curitiba",-25.4518669,-49.2511097
1277,"rua pernambuco, GUAÍRA, Curitiba",-25.4675451,-49.27328989999999
1278,"rua augusto de mari, GUAÍRA, Curitiba",-25.4682063,-49.27856509999999
1279,"rua  doutor pedro zavaski, PINHEIRINHO, Curitiba",-25.5216933,-49.2707975
1280,"rua valdomiro miguel sidral, SÍTIO CERCADO, Curitiba",-25.5554079,-49.2566594
1281,"rua david tows, SÍTIO CERCADO, Curitiba",-25.5370913,-49.256024
1282,"rua antonio parolin junior, PAROLIN, Curitiba",-25.4629562,-49.2609808
1283,"rua  joão negrão, CENTRO, Curitiba",-25.4357272,-49.26395979999999
1284,"rua silvio duarte, CIDADE INDUSTRIAL, Curitiba",-25.4969296,-49.3223519
1285,"rua  jose pedro cardoso, CAMPO DE SANTANA, Curitiba",-25.590882,-49.3323555
1286,"rua waldemar cavanha, FAZENDINHA, Curitiba",-25.4740917,-49.3293956
1287,"rua  antonio geroslau ferreira, CIDADE INDUSTRIAL, Curitiba",-25.4964458,-49.3517881
1288,"rua , quadra 5**, SÍTIO CERCADO, Curitiba",-25.5443488,-49.26656209999999
1289,"rua telêmaco da silva quadros, CIDADE INDUSTRIAL, Curitiba",-25.4865975,-49.3507212
1290,"rua felipe camarão, PRADO VELHO, Curitiba",-25.4457015,-49.2531317
1291,"rua olivia g freitas, ORLEANS, Curitiba",-25.4265938,-49.3606279
1292,"rua palmeiras, ÁGUA VERDE, Curitiba",-25.4607683,-49.2853533
1293,"rua bruno lobo, BAIRRO ALTO, Curitiba",-25.420809,-49.2062589
1294,"rua cabral, PRADO VELHO, Curitiba",-25.4068314,-49.2514714
1295,"rua coronel herminio alves cabral, ALTO BOQUEIRÃO, Curitiba",-25.5279574,-49.2461756
1296,"rua francisca ferreira pontes, XAXIM, Curitiba",-25.5247919,-49.2647793
1297,"rua sinval martins araújo, SÍTIO CERCADO, Curitiba",-25.5528004,-49.2463029
1298,"rua coronel menna barreto monclaro, CENTRO, Curitiba",-25.4377039,-49.2795594
1299,"rua  bocaiuva, SANTA QUITÉRIA, Curitiba",-25.4633749,-49.3063703
1300,"rua mateus leme, SÃO FRANCISCO, Curitiba",-25.4213101,-49.2708997
1301,"rua  waldemar cavanha, CAMPO COMPRIDO, Curitiba",-25.4740917,-49.3293956
1302,"rua joão rodrigues pinheiro, CAPÃO RASO, Curitiba",-25.5120256,-49.3027064
1303,"rua  batista da costa, XAXIM, Curitiba",-25.5152023,-49.2794477
1304,"rua canadá, BOA VISTA, Curitiba",-25.3929371,-49.2386451
1305,"rua parque barigui, CAMPINA DO SIQUEIRA, Curitiba",-25.432796,-49.312856
1306,"rua municipio de campo novo, CIDADE INDUSTRIAL, Curitiba",-25.4722755,-49.3492142
1307,"rua presidente kennedy, REBOUÇAS, Curitiba",-25.4542192,-49.266062
1308,"rua  marechal deodoro, CENTRO, Curitiba",-25.4291336,-49.2641455
1309,"rua joão menegusso, SANTA FELICIDADE, Curitiba",-25.4063988,-49.31894759999999
1310,"rua joao menegusso, SANTA FELICIDADE, Curitiba",-25.4063988,-49.31894759999999
1311,"rua abelardo barbosa, TATUQUARA, Curitiba",-25.5743951,-49.33928479999999
1312,"rua  alexandre marcoski, SÃO BRAZ, Curitiba",-25.4183762,-49.3417184
1313,"rua do comercio 24 horas, CENTRO, Curitiba",-25.4347686,-49.2764537
1314,"rua diogenes do brasil lobato, BOA VISTA, Curitiba",-25.3837577,-49.2269685
1315,"rua bom jesus de iguape, BOQUEIRÃO, Curitiba",-25.4957619,-49.237696
1316,"rua rua zoraide mandele, CAPÃO DA IMBUIA, Curitiba",-25.4419996,-49.2013028
1317,"rua santa catarina, ÁGUA VERDE, Curitiba",-25.4657529,-49.2812715
1318,"rua doutor simão kossobudski, UBERABA, Curitiba",-25.5011396,-49.2266099
1319,"rua joão mendonça, CAPÃO DA IMBUIA, Curitiba",-25.4427538,-49.2029046
1320,"rua engenheiro cezar mattar neto, ATUBA, Curitiba",-25.3865113,-49.2004609
1321,"rua percy feliciano de castilho, BAIRRO ALTO, Curitiba",-25.4148556,-49.21297879999999
1322,"rua francisco jose bozza, s/n - tatuquara, TATUQUARA, Curitiba",-25.5593614,-49.3184432
1323,"rua engenheiro luiz augusto leão fonseca, SANTA CÂNDIDA, Curitiba",-25.376638,-49.23916089999999
1324,"rua diogenes do brasil lobato, TINGUI, Curitiba",-25.3837577,-49.2269685
1325,"rua canal belem, CAJURU, Curitiba",-25.4854914,-49.2346413
1326,"rua  doutor mbá de ferrante, SÃO JOÃO, Curitiba",-25.4008308,-49.305702
1327,"rua campo belo, FAZENDINHA, Curitiba",-25.4751169,-49.3314036
1328,"rua monteiro tourinho, BACACHERI, Curitiba",-25.3871086,-49.2183661
1329,"rua professor ewaldo schiebler, JARDIM SOCIAL, Curitiba",-25.4225644,-49.2364346
1330,"rua josé sebastião baltazar, CIDADE INDUSTRIAL, Curitiba",-25.4859522,-49.3481892
